comment_id,post_id,subreddit,parent_id,author,created_utc,text,distinguished,stickied,collection_week_idx,collection_week_label,pulled_at_utc,date,week_start,year_week,parent_comment_id,has_parent_in_window,is_direct_reply,parent_post_found
ni1pjny,1nzestg,AskDocs,t3_1nzestg,---root--,1759748036,"Um... Having intercourse with a person who has undetectable viral load is about the safest thing you can do in terms of HIV infection risk. There has not been a *single* case described in which a sexual partner was infected with HIV from a patient with undetectable viral load. 

Who the hell prescribed PEP for that?!",,False,1,W01_2025-10-06_to_2025-10-12,2026-04-28T22:25:18.898904+00:00,2025-10-06 10:53:56+00:00,2025-10-06,2025-W40,,False,True,True
nj6wt8x,1o53f2y,AskDocs,t3_1o53f2y,---root--,1760314286,"Refusing a holter for your complaint is questionable.

Whilst it is quite likely that your PVCs, at worst short runs of NSVT, are benign, these demand to be evaluated. 

Which diagnostic tests were performed previously?",,False,2,W02_2025-10-13_to_2025-10-19,2026-04-28T22:25:18.898904+00:00,2025-10-13 00:11:26+00:00,2025-10-13,2025-W41,,False,True,True
nmtl2ak,1on1672,AskDocs,t3_1on1672,---root--,1762140230,"These online IQ tests are generally more akin to a random number generator than anything reliable.

Even if your IQ were below average, would it make a difference? You've good achieved academic and professional results. Who cares about a number, be it high or low?",,False,5,W05_2025-11-03_to_2025-11-09,2026-04-28T22:25:18.898904+00:00,2025-11-03 03:23:50+00:00,2025-11-03,2025-W44,,False,True,True
nmto4n8,1on1672,AskDocs,t1_nmtng2k,---root--,1762141482,"With your academic achievements it's extremely unlikely for you to have such a low IQ, I just wanted to stress that, ultimately, your achievements in life are far more impactful than a questionable measure of overall intelligence :)",,False,5,W05_2025-11-03_to_2025-11-09,2026-04-28T22:25:18.898904+00:00,2025-11-03 03:44:42+00:00,2025-11-03,2025-W44,nmtng2k,True,False,True
nrn4vky,1patf1j,AskDocs,t3_1patf1j,---root--,1764555116,You've posted this at least twice now. The answer is not going to change.,,False,9,W09_2025-12-01_to_2025-12-07,2026-04-28T22:25:18.898904+00:00,2025-12-01 02:11:56+00:00,2025-12-01,2025-W48,,False,True,True
nrn7srf,1paqq7j,AskDocs,t3_1paqq7j,---root--,1764556180,I don't see any images.,,False,9,W09_2025-12-01_to_2025-12-07,2026-04-28T22:25:18.898904+00:00,2025-12-01 02:29:40+00:00,2025-12-01,2025-W48,,False,True,True
np992oi,1oyt21n,AskDocs,t1_np97wqa,0utworld,1763348703,Pseudomonas is green,,False,7,W07_2025-11-17_to_2025-11-23,2026-04-28T22:25:18.898904+00:00,2025-11-17 03:05:03+00:00,2025-11-17,2025-W46,np97wqa,True,False,True
nj7az4k,1o55yri,AskDocs,t3_1o55yri,0wnzl1f3,1760319572,Sounds like a tension headache. Maybe a component of medication overuse depending on how regularly you are using tylenol and advil.,,False,2,W02_2025-10-13_to_2025-10-19,2026-04-28T22:25:18.898904+00:00,2025-10-13 01:39:32+00:00,2025-10-13,2025-W41,,False,True,True
nmsxyj2,1omwsqh,AskDocs,t3_1omwsqh,0wnzl1f3,1762131615,"Lactate isnt particularly specific. As was mentioned vomiting and dehydration cause cause it to rise. upper GI bleeding is also associated with elevated lactate. So is hypotension.

Hard to know the exact rationale for you being discharged. If you were to come hypotensive and tachycardic with history vomiting blood, i would likely keep you for AM scope uness GI tells me otherwise. That being said, it could also plausibly be a consequence of dehydration from recurrent vomiting and inadequate replacements.

The way you describe the bleeding also sounds like it could be a mallory weiss tear with the abdo pain being less directly related (i.e. not due to the cause of the bleeding but more due to your chronic GI issues). Your other labs, namely the hemoglobin trend would also be a consideration for this decision.",,False,5,W05_2025-11-03_to_2025-11-09,2026-04-28T22:25:18.898904+00:00,2025-11-03 01:00:15+00:00,2025-11-03,2025-W44,,False,True,True
nrn99ta,1pb0osp,AskDocs,t3_1pb0osp,147zcbm123,1764556721,"Hard to tell, not a lot of context, but looks more like an ingrown hair",,False,9,W09_2025-12-01_to_2025-12-07,2026-04-28T22:25:18.898904+00:00,2025-12-01 02:38:41+00:00,2025-12-01,2025-W48,,False,True,True
np9r0qp,1oz3r9q,AskDocs,t1_np9ol23,2occupantsandababy,1763356067,No. That was certainly a typo.,,False,7,W07_2025-11-17_to_2025-11-23,2026-04-28T22:25:18.898904+00:00,2025-11-17 05:07:47+00:00,2025-11-17,2025-W46,np9ol23,True,False,True
nvb3r5x,1pskx7f,AskDocs,t1_nvacsgc,718ANYThing,1766372282,"This is not medical advice and I am not a medical professional. (Moderators keep removing comments) I had bacterial meningitis 22 years ago. No idea how I contacted it. I had a headache for 24 hours, I couldn’t sleep and felt as if I had been hit in the head with a baseball bat. I went to my doctors office and he said to go straight to the hospital. Couldn’t open my eyes because light was making my headache worse. Doctor asked if I can make my chin touch my chest and I couldn’t.",,False,12,W12_2025-12-22_to_2025-12-28,2026-04-28T22:25:18.898904+00:00,2025-12-22 02:58:02+00:00,2025-12-22,2025-W51,nvacsgc,True,False,True
ni0aq1e,1nyy6vk,AskDocs,t1_nhzrpy6,90sSquid,1759720294,"Electrolyte imbalance from regular purging killed my best friend at 27, leaving behind three beautiful children. She had just graduated with her masters three days before.",,False,1,W01_2025-10-06_to_2025-10-12,2026-04-28T22:25:18.898904+00:00,2025-10-06 03:11:34+00:00,2025-10-06,2025-W40,nhzrpy6,True,False,False
nlmilqd,1ohal0f,AskDocs,t3_1ohal0f,98706540,1761560149,https://preview.redd.it/u3q2lwupqmxf1.jpeg?width=1290&format=pjpg&auto=webp&s=ed4c30c28284fdaaf0f0737489776514de46e8e8,,False,4,W04_2025-10-27_to_2025-11-02,2026-04-28T22:25:18.898904+00:00,2025-10-27 10:15:49+00:00,2025-10-27,2025-W43,,False,True,True
nlmimmz,1ohal0f,AskDocs,t3_1ohal0f,98706540,1761560163,https://preview.redd.it/ifpo0furqmxf1.jpeg?width=1290&format=pjpg&auto=webp&s=ba897b6a35a2c8d660c8bb6ad1d37dc865e0db34,,False,4,W04_2025-10-27_to_2025-11-02,2026-04-28T22:25:18.898904+00:00,2025-10-27 10:16:03+00:00,2025-10-27,2025-W43,,False,True,True
nlld4ex,1oh4997,AskDocs,t3_1oh4997,AGreenieBeanie,1761535864,https://preview.redd.it/s0zlhayhqkxf1.jpeg?width=3024&format=pjpg&auto=webp&s=ffc510f9223769c64b02fb08ade8562bd7c242be,,False,4,W04_2025-10-27_to_2025-11-02,2026-04-28T22:25:18.898904+00:00,2025-10-27 03:31:04+00:00,2025-10-27,2025-W43,,False,True,True
nro6c7w,1pb4b9x,AskDocs,t1_nro1knh,ASTERnaught,1764570825,"Yes, and some foods, especially sugar, can exacerbate yeast infections, so if her diet is different at the mom’s house, that could explain the timing of the flare ups. But yeah, op needs to take her to get it checked out by a doctor.",,False,9,W09_2025-12-01_to_2025-12-07,2026-04-28T22:25:18.898904+00:00,2025-12-01 06:33:45+00:00,2025-12-01,2025-W48,nro1knh,True,False,True
nvaybbi,1psnq0k,AskDocs,t1_nvay1p5,ATLJOEL,1766370283,Would you be so kind as to tell me a few of those subs names.,,False,12,W12_2025-12-22_to_2025-12-28,2026-04-28T22:25:18.898904+00:00,2025-12-22 02:24:43+00:00,2025-12-22,2025-W51,nvay1p5,True,False,True
nqhufy4,1p55bum,AskDocs,t1_nqhkkp3,Aalphyn,1763969731,"By providing support, a listening ear, and finding out if there is a trend of abuse. They will be able to connect OP to the appropriate resources in that case.",,False,8,W08_2025-11-24_to_2025-11-30,2026-04-28T22:25:18.898904+00:00,2025-11-24 07:35:31+00:00,2025-11-24,2025-W47,nqhkkp3,True,False,True
npa5xms,1oz9j4t,AskDocs,t3_1oz9j4t,AcanthisittaOk3985,1763364128,"i also have not been sick in a long time, like any kind of illness not even a cold, at least in over a year",,False,7,W07_2025-11-17_to_2025-11-23,2026-04-28T22:25:18.898904+00:00,2025-11-17 07:22:08+00:00,2025-11-17,2025-W46,,False,True,True
nrmiu6j,1paxixf,AskDocs,t3_1paxixf,AccomplishedMotor547,1764547203,Sometimes also have faster heart rate and just stiffness everywhere Also doctors say nothing but I just don’t feel the same!,,False,9,W09_2025-12-01_to_2025-12-07,2026-04-28T22:25:18.898904+00:00,2025-12-01 00:00:03+00:00,2025-12-01,2025-W48,,False,True,True
nllxrof,1oh7c8v,AskDocs,t3_1oh7c8v,Accurate-Type9497,1761546955,"And I am not taking any medications whatsoever, aside from Tylenol / Ibuprofen during bouts of viral illness.",,False,4,W04_2025-10-27_to_2025-11-02,2026-04-28T22:25:18.898904+00:00,2025-10-27 06:35:55+00:00,2025-10-27,2025-W43,,False,True,True
nkeofr3,1ob6qdx,AskDocs,t3_1ob6qdx,Acrobatic_Potato5927,1760922857,"https://preview.redd.it/ne01lolp36wf1.jpeg?width=3024&format=pjpg&auto=webp&s=8c36511f7c54706c864d116442f2202fe3c2ec55

This is the culprit",,False,3,W03_2025-10-20_to_2025-10-26,2026-04-28T22:25:18.898904+00:00,2025-10-20 01:14:17+00:00,2025-10-20,2025-W42,,False,True,True
nkg7o02,1ob6qdx,AskDocs,t1_nkf9jm9,Acrobatic_Potato5927,1760950825,"Perfect, thank you so much",,False,3,W03_2025-10-20_to_2025-10-26,2026-04-28T22:25:18.898904+00:00,2025-10-20 09:00:25+00:00,2025-10-20,2025-W42,nkf9jm9,True,False,True
nhzyudu,1nyvxv8,AskDocs,t1_nhztytz,Actual_King_7168,1759715682,thank you,,False,1,W01_2025-10-06_to_2025-10-12,2026-04-28T22:25:18.898904+00:00,2025-10-06 01:54:42+00:00,2025-10-06,2025-W40,nhztytz,True,False,False
nhzyyvl,1nyvxv8,AskDocs,t3_1nyvxv8,Actual_King_7168,1759715728,"https://preview.redd.it/qrlrtgraeetf1.png?width=1518&format=png&auto=webp&s=2cf41b084fb106332868e9d071836e8134ca4ba0

a few hours later, looking worse",,False,1,W01_2025-10-06_to_2025-10-12,2026-04-28T22:25:18.898904+00:00,2025-10-06 01:55:28+00:00,2025-10-06,2025-W40,,False,True,False
nhzz2tq,1nyvxv8,AskDocs,t1_nhztytz,Actual_King_7168,1759715768,is it okay for me to just leave it alone or should i go see a doctor?,,False,1,W01_2025-10-06_to_2025-10-12,2026-04-28T22:25:18.898904+00:00,2025-10-06 01:56:08+00:00,2025-10-06,2025-W40,nhztytz,True,False,False
ni165v9,1nyvxv8,AskDocs,t1_ni13blw,Actual_King_7168,1759736517,"thank you so much, i really appreciate you taking the time to answer!",,False,1,W01_2025-10-06_to_2025-10-12,2026-04-28T22:25:18.898904+00:00,2025-10-06 07:41:57+00:00,2025-10-06,2025-W40,ni13blw,True,False,False
nrnreui,1pb1qr6,AskDocs,t1_nrnr5ec,AdEquivalent407,1764563836,"Ok thanks. I think I was confused bc my mother told me that despite me being in baby classes and socializing with other babies, I never got sick until daycare because “daycare” is different.",,False,9,W09_2025-12-01_to_2025-12-07,2026-04-28T22:25:18.898904+00:00,2025-12-01 04:37:16+00:00,2025-12-01,2025-W48,nrnr5ec,True,False,True
nqh345i,1p55bum,AskDocs,t1_nqgslk2,Adalaide78,1763955969,"Thank you for your blunt honesty. It’s hard to accept criticism of an abusive parent when it’s random strangers, but hopefully a doctor giving the formal diagnosis of incredible bitch hits hard enough for OP to reject the abuse and accept this isn’t her fault.",,False,8,W08_2025-11-24_to_2025-11-30,2026-04-28T22:25:18.898904+00:00,2025-11-24 03:46:09+00:00,2025-11-24,2025-W47,nqgslk2,True,False,True
nlkxk24,1oh1uyc,AskDocs,t1_nlkxdfl,Afraid_Perception120,1761529877,"Thank you so much, I’ll be emailing my doctors in the morning. Is that something a GP would do or am I looking at a specialist?",,False,4,W04_2025-10-27_to_2025-11-02,2026-04-28T22:25:18.898904+00:00,2025-10-27 01:51:17+00:00,2025-10-27,2025-W43,nlkxdfl,True,False,True
no22jeo,1ot0gz4,AskDocs,t1_no21tg6,AgainstMedicalAdvice,1762749869,"It says a years worth over 4 prescriptions, so 90 days seems to be what's implied?",,False,6,W06_2025-11-10_to_2025-11-16,2026-04-28T22:25:18.898904+00:00,2025-11-10 04:44:29+00:00,2025-11-10,2025-W45,no21tg6,True,False,True
nrny3fu,1pb46vn,AskDocs,t1_nrnxd2l,AgentCrazyWolf,1764566681,"Thank you for the reply, it wasn’t alot that came off just mainly a deep cut so surgery seems unlikely in this case. I’ve had many deep cuts before but never had a cold sensation before , do you think it’s better to get it looked at by a pharmacist or doctor before ER? I’m in UK and the wait times are nearly a whole day wait . I appreciated your advice so thank you very much",,False,9,W09_2025-12-01_to_2025-12-07,2026-04-28T22:25:18.898904+00:00,2025-12-01 05:24:41+00:00,2025-12-01,2025-W48,nrnxd2l,True,False,True
nro1rno,1pb46vn,AskDocs,t1_nro1hqd,AgentCrazyWolf,1764568443,"Thank you so much for this information and I completely understand , I will try the finger nail test . Truly appreciate your help and input. Hope you have a wonderful day",,False,9,W09_2025-12-01_to_2025-12-07,2026-04-28T22:25:18.898904+00:00,2025-12-01 05:54:03+00:00,2025-12-01,2025-W48,nro1hqd,True,False,True
nmszdxq,1omyfwz,AskDocs,t1_nmsz4cx,Aggravating_Ease7961,1762132143,"I’m not sure if you underhand the motion I did it’s embarrassing but I was mad and pretend just squeezing hands and head super hard. I’ve had some neck pain too, but you think this wouldn’t cause a brain hemorrhage?",,False,5,W05_2025-11-03_to_2025-11-09,2026-04-28T22:25:18.898904+00:00,2025-11-03 01:09:03+00:00,2025-11-03,2025-W44,nmsz4cx,True,False,True
nmszg9f,1omyfwz,AskDocs,t1_nmsz4cx,Aggravating_Ease7961,1762132167,"I guess my headaches through the week could have caused some neck pain, should I see my pcp",,False,5,W05_2025-11-03_to_2025-11-09,2026-04-28T22:25:18.898904+00:00,2025-11-03 01:09:27+00:00,2025-11-03,2025-W44,nmsz4cx,True,False,True
nmt1p7a,1omyfwz,AskDocs,t1_nmt17mp,Aggravating_Ease7961,1762132994,"Thank you! What do you think I could done then? Nothing serious? I hope I am describing what I did right haha. I’m not sure if that could have raised my blood pressure which could cause one I saw. Yeah if you squeezed your head without actually physically with hands is the best way I can say it lol. 

But I’ve tried heat and ice nothing seems to be working really well",,False,5,W05_2025-11-03_to_2025-11-09,2026-04-28T22:25:18.898904+00:00,2025-11-03 01:23:14+00:00,2025-11-03,2025-W44,nmt17mp,True,False,True
nmt85pr,1omyfwz,AskDocs,t1_nmt6sgz,Aggravating_Ease7961,1762135352,I might have explained this wrong haha I wasn’t using the bathroom but I was squeezing my head like you would squeezing to go to the bathroom if that makes sense ahha,,False,5,W05_2025-11-03_to_2025-11-09,2026-04-28T22:25:18.898904+00:00,2025-11-03 02:02:32+00:00,2025-11-03,2025-W44,nmt6sgz,True,False,True
nmt8eej,1omyfwz,AskDocs,t1_nmsz4cx,Aggravating_Ease7961,1762135440,"Also sorry for spam but to be clear I wasn’t actually using the bathroom, I was squeezing like you would using the bathroom but with my head lol if that makes sense 😭",,False,5,W05_2025-11-03_to_2025-11-09,2026-04-28T22:25:18.898904+00:00,2025-11-03 02:04:00+00:00,2025-11-03,2025-W44,nmsz4cx,True,False,True
nmt8mmu,1omyfwz,AskDocs,t1_nmt8g8v,Aggravating_Ease7961,1762135522,Yeah ahaha all good,,False,5,W05_2025-11-03_to_2025-11-09,2026-04-28T22:25:18.898904+00:00,2025-11-03 02:05:22+00:00,2025-11-03,2025-W44,nmt8g8v,True,False,True
nro4x9l,1pb5bdn,AskDocs,t1_nro4ugi,Aggressive_Fig6744,1764570063,sorry. blood smear? when they actually looks at blood cells under a microscope to see what shapes they form etc.,,False,9,W09_2025-12-01_to_2025-12-07,2026-04-28T22:25:18.898904+00:00,2025-12-01 06:21:03+00:00,2025-12-01,2025-W48,nro4ugi,True,False,True
nro50nq,1pb5bdn,AskDocs,t3_1pb5bdn,Aggressive_Fig6744,1764570113,"https://preview.redd.it/dz8i7eavcj4g1.jpeg?width=1170&format=pjpg&auto=webp&s=89003ff21141c1590ebfd5652d844d7d8678653b

this is FBC for the past few days",,False,9,W09_2025-12-01_to_2025-12-07,2026-04-28T22:25:18.898904+00:00,2025-12-01 06:21:53+00:00,2025-12-01,2025-W48,,False,True,True
nro53u3,1pb5bdn,AskDocs,t3_1pb5bdn,Aggressive_Fig6744,1764570160,"https://preview.redd.it/ly003pzycj4g1.jpeg?width=1170&format=pjpg&auto=webp&s=fa8cf50deb26824dc5182a706af388b35c5dbf4b

BLOOD FILM. they have notes just for today but they have different ones for the previous days as well.",,False,9,W09_2025-12-01_to_2025-12-07,2026-04-28T22:25:18.898904+00:00,2025-12-01 06:22:40+00:00,2025-12-01,2025-W48,,False,True,True
nro5ldo,1pb5bdn,AskDocs,t1_nro548o,Aggressive_Fig6744,1764570422,"that’s fair enough, i haven’t a clue either! haha",,False,9,W09_2025-12-01_to_2025-12-07,2026-04-28T22:25:18.898904+00:00,2025-12-01 06:27:02+00:00,2025-12-01,2025-W48,nro548o,True,False,True
nro5naq,1pb5bdn,AskDocs,t3_1pb5bdn,Aggressive_Fig6744,1764570450,https://preview.redd.it/m603zvgwdj4g1.jpeg?width=1170&format=pjpg&auto=webp&s=e0eea5c2afa4be7fbbd89201f9159f5163e79390,,False,9,W09_2025-12-01_to_2025-12-07,2026-04-28T22:25:18.898904+00:00,2025-12-01 06:27:30+00:00,2025-12-01,2025-W48,,False,True,True
nro5nuh,1pb5bdn,AskDocs,t3_1pb5bdn,Aggressive_Fig6744,1764570458,https://preview.redd.it/pdp5hbdxdj4g1.jpeg?width=1170&format=pjpg&auto=webp&s=0c62af2cf055672e397e1f81eadaff6d0049418c,,False,9,W09_2025-12-01_to_2025-12-07,2026-04-28T22:25:18.898904+00:00,2025-12-01 06:27:38+00:00,2025-12-01,2025-W48,,False,True,True
nro5ofr,1pb5bdn,AskDocs,t3_1pb5bdn,Aggressive_Fig6744,1764570466,https://preview.redd.it/9ae8cf8ydj4g1.jpeg?width=1170&format=pjpg&auto=webp&s=9c68f8436a081ccad817c1a636ca4a8359367152,,False,9,W09_2025-12-01_to_2025-12-07,2026-04-28T22:25:18.898904+00:00,2025-12-01 06:27:46+00:00,2025-12-01,2025-W48,,False,True,True
nro5p4k,1pb5bdn,AskDocs,t3_1pb5bdn,Aggressive_Fig6744,1764570477,https://preview.redd.it/xrblvwezdj4g1.jpeg?width=1170&format=pjpg&auto=webp&s=25eb984ea2a632d987bf7103313f7b0778a7a4a5,,False,9,W09_2025-12-01_to_2025-12-07,2026-04-28T22:25:18.898904+00:00,2025-12-01 06:27:57+00:00,2025-12-01,2025-W48,,False,True,True
nro5prm,1pb5bdn,AskDocs,t3_1pb5bdn,Aggressive_Fig6744,1764570487,https://preview.redd.it/jilkh1e0ej4g1.jpeg?width=1170&format=pjpg&auto=webp&s=723609562ea67d5f5014ef4d7324ebccf511dbe1,,False,9,W09_2025-12-01_to_2025-12-07,2026-04-28T22:25:18.898904+00:00,2025-12-01 06:28:07+00:00,2025-12-01,2025-W48,,False,True,True
nro6xpn,1pb5bdn,AskDocs,t1_nro6lv6,Aggressive_Fig6744,1764571151,thank you! do u think i should push for a specialist to have a look at it?,,False,9,W09_2025-12-01_to_2025-12-07,2026-04-28T22:25:18.898904+00:00,2025-12-01 06:39:11+00:00,2025-12-01,2025-W48,nro6lv6,True,False,True
nro7l3v,1pb5bdn,AskDocs,t1_nro79w0,Aggressive_Fig6744,1764571505,"i’m always ill though, in one way or another, whether it’s fatigue, pain, it’s always something.. that’s why i’m being extra careful about my results and nothing being missed",,False,9,W09_2025-12-01_to_2025-12-07,2026-04-28T22:25:18.898904+00:00,2025-12-01 06:45:05+00:00,2025-12-01,2025-W48,nro79w0,True,False,True
nro7v09,1pb5bdn,AskDocs,t1_nro7qsf,Aggressive_Fig6744,1764571656,"i really appreciate ur opinion, thank you. i’ll keep that in mind. i just want to get to the bottom of it",,False,9,W09_2025-12-01_to_2025-12-07,2026-04-28T22:25:18.898904+00:00,2025-12-01 06:47:36+00:00,2025-12-01,2025-W48,nro7qsf,True,False,True
nj78w44,1o56ivh,AskDocs,t3_1o56ivh,AgreeableHeart672,1760318794,https://preview.redd.it/1sc49haj7suf1.jpeg?width=3024&format=pjpg&auto=webp&s=4fba9b416e5890941d7e86c2aeb849cabb313e0c,,False,2,W02_2025-10-13_to_2025-10-19,2026-04-28T22:25:18.898904+00:00,2025-10-13 01:26:34+00:00,2025-10-13,2025-W41,,False,True,True
nj78xka,1o56ivh,AskDocs,t3_1o56ivh,AgreeableHeart672,1760318809,https://preview.redd.it/kclout8l7suf1.jpeg?width=4032&format=pjpg&auto=webp&s=b50d860585799d346fa0d2e6fb23bdf76864436c,,False,2,W02_2025-10-13_to_2025-10-19,2026-04-28T22:25:18.898904+00:00,2025-10-13 01:26:49+00:00,2025-10-13,2025-W41,,False,True,True
nmtbsci,1omyvif,AskDocs,t1_nmt97s1,Agreeable_Cow_7230,1762136657,Can the dose they took cause serotonin syndrome?,,False,5,W05_2025-11-03_to_2025-11-09,2026-04-28T22:25:18.898904+00:00,2025-11-03 02:24:17+00:00,2025-11-03,2025-W44,nmt97s1,True,False,True
nu3j1o8,1pmwnl9,AskDocs,t1_nu3i1sz,AllSurvivorNoGuilt,1765769908,Can yall explain this to a 5 year old lol,,False,11,W11_2025-12-15_to_2025-12-21,2026-04-28T22:25:18.898904+00:00,2025-12-15 03:38:28+00:00,2025-12-15,2025-W50,nu3i1sz,True,False,True
no1xnnv,1os84fp,AskDocs,t1_no1wcjg,Alone-Koala9204,1762747752,What tests did they run?,,False,6,W06_2025-11-10_to_2025-11-16,2026-04-28T22:25:18.898904+00:00,2025-11-10 04:09:12+00:00,2025-11-10,2025-W45,no1wcjg,True,False,True
no1y4l9,1os84fp,AskDocs,t1_no1y06r,Alone-Koala9204,1762747945,"That seems like bad care to be honest. Did they do MRI or anything to check ur brain, or blood tests?",,False,6,W06_2025-11-10_to_2025-11-16,2026-04-28T22:25:18.898904+00:00,2025-11-10 04:12:25+00:00,2025-11-10,2025-W45,no1y06r,True,False,True
no1ze9w,1os84fp,AskDocs,t1_no1yq51,Alone-Koala9204,1762748476,"wait do u go to college on the east coast (va) by chance ? Cuz then I know what hospital this is . It is a bad hospital , but only hospital in area for miles",,False,6,W06_2025-11-10_to_2025-11-16,2026-04-28T22:25:18.898904+00:00,2025-11-10 04:21:16+00:00,2025-11-10,2025-W45,no1yq51,True,False,True
nj7935w,1o56jqx,AskDocs,t3_1o56jqx,AlternativeEven7773,1760318868,https://preview.redd.it/7sdr9mmr7suf1.jpeg?width=1205&format=pjpg&auto=webp&s=234ceff85cd8838c14f3fef4ebd8c0476b0d00db,,False,2,W02_2025-10-13_to_2025-10-19,2026-04-28T22:25:18.898904+00:00,2025-10-13 01:27:48+00:00,2025-10-13,2025-W41,,False,True,True
nj794qg,1o56jqx,AskDocs,t3_1o56jqx,AlternativeEven7773,1760318885,https://preview.redd.it/i75iktgt7suf1.jpeg?width=942&format=pjpg&auto=webp&s=2f9cf26bea31baee4e43e0bc3c377f58604d0618,,False,2,W02_2025-10-13_to_2025-10-19,2026-04-28T22:25:18.898904+00:00,2025-10-13 01:28:05+00:00,2025-10-13,2025-W41,,False,True,True
nj797w9,1o56jqx,AskDocs,t3_1o56jqx,AlternativeEven7773,1760318919,https://preview.redd.it/jdn8en1x7suf1.jpeg?width=1206&format=pjpg&auto=webp&s=d3989e3dc3e0b7e3e0daf60c4e0539782192d50f,,False,2,W02_2025-10-13_to_2025-10-19,2026-04-28T22:25:18.898904+00:00,2025-10-13 01:28:39+00:00,2025-10-13,2025-W41,,False,True,True
nj798zz,1o56jqx,AskDocs,t3_1o56jqx,AlternativeEven7773,1760318931,https://preview.redd.it/b6e86zay7suf1.jpeg?width=1206&format=pjpg&auto=webp&s=708c59922a5f95e632f05975ade248964d4f6aaf,,False,2,W02_2025-10-13_to_2025-10-19,2026-04-28T22:25:18.898904+00:00,2025-10-13 01:28:51+00:00,2025-10-13,2025-W41,,False,True,True
ni155mn,1nzcmt3,AskDocs,t3_1nzcmt3,Altruistic-Size-3288,1759735884,"https://preview.redd.it/iwmbi4j82gtf1.jpeg?width=3024&format=pjpg&auto=webp&s=6f3132b3ead8a4be119fb8575517e98982c3f412

Poop with blood.",,False,1,W01_2025-10-06_to_2025-10-12,2026-04-28T22:25:18.898904+00:00,2025-10-06 07:31:24+00:00,2025-10-06,2025-W40,,False,True,True
nu38k7p,1pgf4ph,AskDocs,t3_1pgf4ph,Ambitious-Ant8336,1765765906,"Update: For those that worry like me and have the same question, I took OTC probiotics and everything went back to normal 2 weeks after finishing the course of antibiotics, which meant I had to endure the diarrhea for almost a month. It took a while so I was worried that something else was wrong, but since I didn't have a fever or anything else aside from the diarrhea, the doctor just gave me probiotics to take.",,False,11,W11_2025-12-15_to_2025-12-21,2026-04-28T22:25:18.898904+00:00,2025-12-15 02:31:46+00:00,2025-12-15,2025-W50,,False,True,True
nmt9x40,1omw7fn,AskDocs,t3_1omw7fn,Ananvil,1762135990,"Two reasons, firstly if fertility is important to the patient, which it is in many patients, then treatment should be focused on optimizing that.

Secondly, unfortunately, in the US, we have to practice in a legally defensible fashion.  Treatment that doesn't optimize fertility might be dug up umpteen years later and used as the basis of a lawsuit.",,False,5,W05_2025-11-03_to_2025-11-09,2026-04-28T22:25:18.898904+00:00,2025-11-03 02:13:10+00:00,2025-11-03,2025-W44,,False,True,True
nmtjow8,1omznhu,AskDocs,t3_1omznhu,Ananvil,1762139679,"Hi, the literature does not usefully describe how to deal with this sort of situation as it is very infrequently encountered.  

Unless your pediatrician feels that they've encountered this enough to feel confident in course of treatment in a child this young, I recommend that you visit a pediatric emergency room.  Depending on where in Vermont you are, this might be Albany Medical Center in New York or Burlington.",,False,5,W05_2025-11-03_to_2025-11-09,2026-04-28T22:25:18.898904+00:00,2025-11-03 03:14:39+00:00,2025-11-03,2025-W44,,False,True,True
nqgp6bw,1p54v05,AskDocs,t3_1p54v05,Ananvil,1763950564,"Look up the CENTOR criteria. 

Are you coughing? Do you have a fever? Any swollen lymph nodes in your neck? 

Your photo did not load for me.",,False,8,W08_2025-11-24_to_2025-11-30,2026-04-28T22:25:18.898904+00:00,2025-11-24 02:16:04+00:00,2025-11-24,2025-W47,,False,True,True
nu3hyn1,1pmuyro,AskDocs,t1_nu34e51,Ananvil,1765769484,I really can't emphasize this enough.,,False,11,W11_2025-12-15_to_2025-12-21,2026-04-28T22:25:18.898904+00:00,2025-12-15 03:31:24+00:00,2025-12-15,2025-W50,nu34e51,True,False,True
nro3v8i,1pb4b9x,AskDocs,t1_nro17ix,Ancient-Fan-2636,1764569512,OP do we trust the step-dad fully and completely...? this seems very very concerning to me,,False,9,W09_2025-12-01_to_2025-12-07,2026-04-28T22:25:18.898904+00:00,2025-12-01 06:11:52+00:00,2025-12-01,2025-W48,nro17ix,True,False,True
nro4cer,1pb4b9x,AskDocs,t1_nro43iw,Ancient-Fan-2636,1764569761,Oh absolutely im not arguing that point at all and theres no amount of trust that makes a guy not a pedo. I was just wondering if OP knows of any weird/off putting behavior from stepdad or anything the daughter has stated that may have seemed pretty hirmal without other signs like this.,,False,9,W09_2025-12-01_to_2025-12-07,2026-04-28T22:25:18.898904+00:00,2025-12-01 06:16:01+00:00,2025-12-01,2025-W48,nro43iw,True,False,True
