comment_id,post_id,subreddit,parent_id,author,created_utc,text,distinguished,stickied,collection_week_idx,collection_week_label,pulled_at_utc,date,week_start,year_week,parent_comment_id,has_parent_in_window,is_direct_reply,parent_post_found
nmtmbp2,1on1672,AskDocs,t3_1on1672,gorebello,1762140743,"Not possible for you to be low IQ with that education and capable writing skills.

The online tests are just click bait. But I'm surprised, I thought they just said everyone was above 100 so people would be happy",,False,5,W05_2025-11-03_to_2025-11-09,2026-04-28T22:25:18.898904+00:00,2025-11-03 03:32:23+00:00,2025-11-03,2025-W44,,False,True,True
nvaa35u,1pshydt,AskDocs,t3_1pshydt,gostodepipoca,1766361661,"I get really worried because my health insurance isn't very good (I live in Brazil) and I already have a history of misdiagnosis at this same hospital. I didn't mention anything about the groin pain during the consultation because it wasn't hurting before. Anyway, it might be paranoia, I'm just apprehensive.",,False,12,W12_2025-12-22_to_2025-12-28,2026-04-28T22:25:18.898904+00:00,2025-12-22 00:01:01+00:00,2025-12-22,2025-W51,,False,True,True
nqhj985,1p55bum,AskDocs,t1_nqh21cs,gotlactose,1763963481,"Healthcare workers of all kinds have to get histories of patients’ illnesses and also use families as allies in patient care. This can make or break A LOT of patient care. Unfortunately, a lot of family members are….uncooperative. I will refrain from using a certain five letter word beginning with B in this professional capacity.",,False,8,W08_2025-11-24_to_2025-11-30,2026-04-28T22:25:18.898904+00:00,2025-11-24 05:51:21+00:00,2025-11-24,2025-W47,nqh21cs,True,False,True
nu31yne,1pmuyro,AskDocs,t1_nu2z1wl,granitebasket,1765763522,"I-2 stamped pills are Ibuprofen. This shape of Ibuprofen does come in white, but given the colourant still visible in the stamped I-2, I have the suspicious this is a coated one that got wet and the coating dissolved.

White: [https://www.drugs.com/imprints/i-2-13596.html](https://www.drugs.com/imprints/i-2-13596.html)

Red-brown: [https://www.drugs.com/imprints/i-2-13506.html](https://www.drugs.com/imprints/i-2-13506.html)",,False,11,W11_2025-12-15_to_2025-12-21,2026-04-28T22:25:18.898904+00:00,2025-12-15 01:52:02+00:00,2025-12-15,2025-W50,nu2z1wl,True,False,True
nj6xikm,1o53f2y,AskDocs,t1_nj6wt8x,hanni2003,1760314550,Okay thank you and  I’ve  had ECGs and an echocardiogram,,False,2,W02_2025-10-13_to_2025-10-19,2026-04-28T22:25:18.898904+00:00,2025-10-13 00:15:50+00:00,2025-10-13,2025-W41,nj6wt8x,True,False,True
nu2zrdt,1pmtp6n,AskDocs,t1_nu2y8ho,headkickhook,1765762724,Pretty sure yeah. Never got surgery to remove anything,,False,11,W11_2025-12-15_to_2025-12-21,2026-04-28T22:25:18.898904+00:00,2025-12-15 01:38:44+00:00,2025-12-15,2025-W50,nu2y8ho,True,False,True
nj7vzbg,1o59mqg,AskDocs,t3_1o59mqg,helpwanted6-7,1760327989,https://preview.redd.it/qch2jnxvysuf1.jpeg?width=3024&format=pjpg&auto=webp&s=4a1e756d522e0d897f09db145175f69ff8f7feae,,False,2,W02_2025-10-13_to_2025-10-19,2026-04-28T22:25:18.898904+00:00,2025-10-13 03:59:49+00:00,2025-10-13,2025-W41,,False,True,True
nj7y11c,1o59mqg,AskDocs,t1_nj7xlqb,helpwanted6-7,1760328970,I know :/ like usually I am more careful. It was darker though and I wasn’t thinking. I’m gonna put all the Tylenol in its own bag,,False,2,W02_2025-10-13_to_2025-10-19,2026-04-28T22:25:18.898904+00:00,2025-10-13 04:16:10+00:00,2025-10-13,2025-W41,nj7xlqb,True,False,True
nj7z3yy,1o59mqg,AskDocs,t1_nj7yvml,helpwanted6-7,1760329502,Yeah a couple of them are in their bottles if the bottles are small. Some of them were in bags too but then my mom needed the bags for other things. Or the bottles. And so they ended up getting dumped out,,False,2,W02_2025-10-13_to_2025-10-19,2026-04-28T22:25:18.898904+00:00,2025-10-13 04:25:02+00:00,2025-10-13,2025-W41,nj7yvml,True,False,True
nj7zerl,1o59mqg,AskDocs,t1_nj7yvni,helpwanted6-7,1760329650,I didn’t realize that :/ honestly the vodka kind of helps take the edge off too so I felt like it just made the Tylenol work better,,False,2,W02_2025-10-13_to_2025-10-19,2026-04-28T22:25:18.898904+00:00,2025-10-13 04:27:30+00:00,2025-10-13,2025-W41,nj7yvni,True,False,True
nj801c8,1o59mqg,AskDocs,t1_nj7zoj8,helpwanted6-7,1760329964,Not dizzy but I feel like I’m going to puke,,False,2,W02_2025-10-13_to_2025-10-19,2026-04-28T22:25:18.898904+00:00,2025-10-13 04:32:44+00:00,2025-10-13,2025-W41,nj7zoj8,True,False,True
nj81s2s,1o59mqg,AskDocs,t1_nj81lmg,helpwanted6-7,1760330844,I user the online one. They said go to the Er :/,,False,2,W02_2025-10-13_to_2025-10-19,2026-04-28T22:25:18.898904+00:00,2025-10-13 04:47:24+00:00,2025-10-13,2025-W41,nj81lmg,True,False,True
nj81yvw,1o59mqg,AskDocs,t1_nj80rvm,helpwanted6-7,1760330941,"I know :/ like I see now. I did the poison control messager thing. They said er too. But my mom is working so I’m just gonna go and not wait for her. 

But are they gonna call the police if they find out I was drinking?",,False,2,W02_2025-10-13_to_2025-10-19,2026-04-28T22:25:18.898904+00:00,2025-10-13 04:49:01+00:00,2025-10-13,2025-W41,nj80rvm,True,False,True
nj820sj,1o59mqg,AskDocs,t1_nj81h2w,helpwanted6-7,1760330967,I’m gonna out all the Tylenol in its own bag after this,,False,2,W02_2025-10-13_to_2025-10-19,2026-04-28T22:25:18.898904+00:00,2025-10-13 04:49:27+00:00,2025-10-13,2025-W41,nj81h2w,True,False,True
nj82657,1o59mqg,AskDocs,t1_nj81v38,helpwanted6-7,1760331043,I get that was stupid. It just really hurts. It hurt less when I drank a little. I know it was stupid I’m sorry,,False,2,W02_2025-10-13_to_2025-10-19,2026-04-28T22:25:18.898904+00:00,2025-10-13 04:50:43+00:00,2025-10-13,2025-W41,nj81v38,True,False,True
nj82do7,1o59mqg,AskDocs,t1_nj81kjg,helpwanted6-7,1760331150,Really nauseous. I’m gonna go to the er bc that’s what poison control said,,False,2,W02_2025-10-13_to_2025-10-19,2026-04-28T22:25:18.898904+00:00,2025-10-13 04:52:30+00:00,2025-10-13,2025-W41,nj81kjg,True,False,True
nj83s72,1o59mqg,AskDocs,t1_nj82ztc,helpwanted6-7,1760331877,Idk it was the online thing they have and it said go to the er,,False,2,W02_2025-10-13_to_2025-10-19,2026-04-28T22:25:18.898904+00:00,2025-10-13 05:04:37+00:00,2025-10-13,2025-W41,nj82ztc,True,False,True
nj83tw4,1o59mqg,AskDocs,t1_nj83cxq,helpwanted6-7,1760331903,That’s a good idea too. I didn’t think of that,,False,2,W02_2025-10-13_to_2025-10-19,2026-04-28T22:25:18.898904+00:00,2025-10-13 05:05:03+00:00,2025-10-13,2025-W41,nj83cxq,True,False,True
nj83zfr,1o59mqg,AskDocs,t1_nj82s5m,helpwanted6-7,1760331981,In an uber,,False,2,W02_2025-10-13_to_2025-10-19,2026-04-28T22:25:18.898904+00:00,2025-10-13 05:06:21+00:00,2025-10-13,2025-W41,nj82s5m,True,False,True
nj8abfd,1o59mqg,AskDocs,t3_1o59mqg,helpwanted6-7,1760335492,I walked in to the waiting room and got suuuuper sweaty and thought I was gonna puke but then I actually fainted. I’m okay though. I’m hooked up to some stuff now and just being monitored,,False,2,W02_2025-10-13_to_2025-10-19,2026-04-28T22:25:18.898904+00:00,2025-10-13 06:04:52+00:00,2025-10-13,2025-W41,,False,True,True
nj8aqgx,1o59mqg,AskDocs,t1_nj8a9cm,helpwanted6-7,1760335730,I’m okay. The burns are getting a lot better. Plus I’m getting an xray of my fingers. A nurse noticed them pretty much right away putting an iv in. I’m okay though,,False,2,W02_2025-10-13_to_2025-10-19,2026-04-28T22:25:18.898904+00:00,2025-10-13 06:08:50+00:00,2025-10-13,2025-W41,nj8a9cm,True,False,True
nkf0uqy,1ob5mrq,AskDocs,t1_nkelvy6,hemkersh,1760927662,"It's hard to know what this doc is actually recommending since you are hearing it all from your sister. 

She started taking the enzymes because she was having GI symptoms. These worsening is likely cause of blood in GI tract.",,False,3,W03_2025-10-20_to_2025-10-26,2026-04-28T22:25:18.898904+00:00,2025-10-20 02:34:22+00:00,2025-10-20,2025-W42,nkelvy6,True,False,True
nro2ujz,1pb4b9x,AskDocs,t1_nro26kb,hemkersh,1764568989,"Yeast infection, allergic reaction, bacterial infection are all possibilities. As well as criminal behavior... 

Wiping back to front could be a cause of infection. Contact of underwear material with skin can trigger an allergy that may not be triggered by looser contact with other skin or different material. 

Pediatric ER seems most appropriate based on risk of what is wrong and her discomfort level.",,False,9,W09_2025-12-01_to_2025-12-07,2026-04-28T22:25:18.898904+00:00,2025-12-01 06:03:09+00:00,2025-12-01,2025-W48,nro26kb,True,False,True
nkfhjzt,1ob74er,AskDocs,t1_nkf6woy,hercoffee,1760934837,"Wow, yikes, ok. I normally don’t see the NP but I think Doc was out of town. I’ll try to see if I can get in with him or find another physician in town/ER if I need to.",,False,3,W03_2025-10-20_to_2025-10-26,2026-04-28T22:25:18.898904+00:00,2025-10-20 04:33:57+00:00,2025-10-20,2025-W42,nkf6woy,True,False,True
nkfi659,1ob5mrq,AskDocs,t1_nkeilof,hibizcus,1760935121,"NAD, but do you know what brand of digestive enzymes she was taking? I once took soil based enzymes and they had an ingredient in it that turned stool black. I also got severe gastritis from it. I believe the brand started with a C but have to look at my purchase history. Never again. ",,False,3,W03_2025-10-20_to_2025-10-26,2026-04-28T22:25:18.898904+00:00,2025-10-20 04:38:41+00:00,2025-10-20,2025-W42,nkeilof,True,False,True
nj7x8ae,1o59mm1,AskDocs,t3_1o59mm1,hogancheveippoff,1760328585,"In canada, treatment is free but not thinking anything can be done? 

Feel dumb going to hospital, dont want to setup dr appt if there is nothing to be done.

  
\*\* long weekend in canada",,False,2,W02_2025-10-13_to_2025-10-19,2026-04-28T22:25:18.898904+00:00,2025-10-13 04:09:45+00:00,2025-10-13,2025-W41,,False,True,True
nj7i092,1o57ha4,AskDocs,t3_1o57ha4,iAmReprisal,1760322204,"Image links seem to not work so here’s another sites. 

https://postimg.cc/gallery/JnqVr7W",,False,2,W02_2025-10-13_to_2025-10-19,2026-04-28T22:25:18.898904+00:00,2025-10-13 02:23:24+00:00,2025-10-13,2025-W41,,False,True,True
nu323pl,1pmvb88,AskDocs,t3_1pmvb88,iEatsChildren,1765763573,https://preview.redd.it/9g7qalqnx97g1.jpeg?width=3024&format=pjpg&auto=webp&s=059afaeb761e9782e5f80e39e4e792d324e86223,,False,11,W11_2025-12-15_to_2025-12-21,2026-04-28T22:25:18.898904+00:00,2025-12-15 01:52:53+00:00,2025-12-15,2025-W50,,False,True,True
nu326p8,1pmvb88,AskDocs,t3_1pmvb88,iEatsChildren,1765763603,https://preview.redd.it/guaca5yqx97g1.jpeg?width=3024&format=pjpg&auto=webp&s=44f118db0aee4eec0b1034cf3ec1ca89a069ebd1,,False,11,W11_2025-12-15_to_2025-12-21,2026-04-28T22:25:18.898904+00:00,2025-12-15 01:53:23+00:00,2025-12-15,2025-W50,,False,True,True
nlmvptp,1oh9mba,AskDocs,t1_nlmoy9w,ichibanyogi,1761566555,As someone who had one spread to kidneys: super painful. Do not recommend. Treat ASAP and avoid that torture!,,False,4,W04_2025-10-27_to_2025-11-02,2026-04-28T22:25:18.898904+00:00,2025-10-27 12:02:35+00:00,2025-10-27,2025-W43,nlmoy9w,True,False,True
nu2wijb,1pmt23y,AskDocs,t1_nu2mmd1,ihb4l,1765761528,"NAD - I’m in my 30s and haven’t vomited since I was 12. I have definitely felt nauseous and had a super upset stomach, just no throwing up. I’ve had several types of chest and abdominal imaging over the years (for completely unrelated reasons) and nothing abnormal has ever been flagged. I say all this to hopefully offer a little reassurance. If it is something that concerns you, you can always talk to your doctor about it. If it causes you a lot of anxiety then you can also speak to a therapist.",,False,11,W11_2025-12-15_to_2025-12-21,2026-04-28T22:25:18.898904+00:00,2025-12-15 01:18:48+00:00,2025-12-15,2025-W50,nu2mmd1,True,False,True
nlln99w,1oh0cv1,AskDocs,t1_nlkj7p4,imgunnamaketoast,1761540710,"As a vet tech who's lanced MANY abscesses - that baby is ready to blow. Keep a hot cloth (as hot as you can stand without burning yourself) on it for twenty minutes, or you can try an Epsom salt soak in the tub. 

It will leave an open wound after it's drained - make sure to keep the area as clean as possible while still giving it room to breathe. Follow your doctor's instructions for aftercare and DON'T squeeze it or fuss with the area in any way while it's healing. It may be tempting to try and hide the area with high collars or extra clothing, but it will drag bacteria back into the area making it take much longer to heal. 

If urgent care still won't drain it, try reaching out to your local vet 🤣 good luck!",,False,4,W04_2025-10-27_to_2025-11-02,2026-04-28T22:25:18.898904+00:00,2025-10-27 04:51:50+00:00,2025-10-27,2025-W43,nlkj7p4,True,False,True
nkg7knp,1obdzuj,AskDocs,t1_nkg63mi,imoksoon,1760950759,How long does it take to kill you?,,False,3,W03_2025-10-20_to_2025-10-26,2026-04-28T22:25:18.898904+00:00,2025-10-20 08:59:19+00:00,2025-10-20,2025-W42,nkg63mi,True,False,True
nkg7ljo,1obdzuj,AskDocs,t1_nkg4xfx,imoksoon,1760950777,How long does it take to kill you?,,False,3,W03_2025-10-20_to_2025-10-26,2026-04-28T22:25:18.898904+00:00,2025-10-20 08:59:37+00:00,2025-10-20,2025-W42,nkg4xfx,True,False,True
nkg8txe,1obdzuj,AskDocs,t1_nkg80h5,imoksoon,1760951672,I haven't even taken them yet so that would kinda defeat the purpose lol,,False,3,W03_2025-10-20_to_2025-10-26,2026-04-28T22:25:18.898904+00:00,2025-10-20 09:14:32+00:00,2025-10-20,2025-W42,nkg80h5,True,False,True
nkg8wpv,1obdzuj,AskDocs,t1_nkg8gsx,imoksoon,1760951736,Dw I haven't taken them yet,,False,3,W03_2025-10-20_to_2025-10-26,2026-04-28T22:25:18.898904+00:00,2025-10-20 09:15:36+00:00,2025-10-20,2025-W42,nkg8gsx,True,False,True
nkg9fat,1obdzuj,AskDocs,t1_nkg97cc,imoksoon,1760952344,Nope I'm gonna do it in a sec dw,,False,3,W03_2025-10-20_to_2025-10-26,2026-04-28T22:25:18.898904+00:00,2025-10-20 09:25:44+00:00,2025-10-20,2025-W42,nkg97cc,True,False,True
nkg9m5d,1obdzuj,AskDocs,t1_nkg9km3,imoksoon,1760952608,Nope I mean the pills lol I was just confirming I would die and not js go blind or smth,,False,3,W03_2025-10-20_to_2025-10-26,2026-04-28T22:25:18.898904+00:00,2025-10-20 09:30:08+00:00,2025-10-20,2025-W42,nkg9km3,True,False,True
nj7rr8w,1o58i33,AskDocs,t3_1o58i33,improbsable,1760326067,"https://preview.redd.it/2urm8x45tsuf1.jpeg?width=643&format=pjpg&auto=webp&s=7c1f0f5a8bd6e036617a4eb3de4e2493df876c24

The issue I’m having",,False,2,W02_2025-10-13_to_2025-10-19,2026-04-28T22:25:18.898904+00:00,2025-10-13 03:27:47+00:00,2025-10-13,2025-W41,,False,True,True
nvc5rvl,1pstzqj,AskDocs,t3_1pstzqj,inferual,1766390229,"https://preview.redd.it/ijutqm80pp8g1.jpeg?width=3024&format=pjpg&auto=webp&s=2943471b542a42340d26358e80ab302f4ea31602

This is the wound for reference",,False,12,W12_2025-12-22_to_2025-12-28,2026-04-28T22:25:18.898904+00:00,2025-12-22 07:57:09+00:00,2025-12-22,2025-W51,,False,True,True
nmtqvbb,1on1s8i,AskDocs,t3_1on1s8i,iosx324,1762142608,"If this is new onset afib and he was sent home, then it’s inappropriate. What were his diagnosis prior to the ED?",,False,5,W05_2025-11-03_to_2025-11-09,2026-04-28T22:25:18.898904+00:00,2025-11-03 04:03:28+00:00,2025-11-03,2025-W44,,False,True,True
nu2ogsf,1pmt23y,AskDocs,t1_nu2mmd1,iputmytrustinyou,1765758717,"I can assure you, not every person who sticks their fingers down their throat can vomit.  My eating disorder is restrictive for a reason.  🤣",,False,11,W11_2025-12-15_to_2025-12-21,2026-04-28T22:25:18.898904+00:00,2025-12-15 00:31:57+00:00,2025-12-15,2025-W50,nu2mmd1,True,False,True
nqgy1cy,1p55bum,AskDocs,t1_nqgslk2,isat_u_steve,1763953930,"Soooo true.  As a mom (56) I have high blood pressure and depression and the list goes on and on.  I would hate that one of my adult kids (one who has BPD and who can be hurtful and very confrontational) think that something she could say could be the sole cause for a heart attack.  My heart health is my responsibility (as much as it can be so).

I’m sorry OP, for you and for your dad.  Your mom is wrong.",,False,8,W08_2025-11-24_to_2025-11-30,2026-04-28T22:25:18.898904+00:00,2025-11-24 03:12:10+00:00,2025-11-24,2025-W47,nqgslk2,True,False,True
no1vdmp,1ot3s1m,AskDocs,t3_1ot3s1m,itlookssad,1762746832,"Just to add sorry I forgot to mention, the dog is walked on private fields which are booked daily for him. Family are lucky enough to be able to afford and travel (2min drive) to accommodate dog. He is also being trained, however this is evidently very early on and dog is still currently reactive.",,False,6,W06_2025-11-10_to_2025-11-16,2026-04-28T22:25:18.898904+00:00,2025-11-10 03:53:52+00:00,2025-11-10,2025-W45,,False,True,True
no26jy8,1ot3s1m,AskDocs,t1_no1yz5t,itlookssad,1762751739,"Thank you so much, i'm so sorry to hear about your dog </3 you did what was best for you and your family x",,False,6,W06_2025-11-10_to_2025-11-16,2026-04-28T22:25:18.898904+00:00,2025-11-10 05:15:39+00:00,2025-11-10,2025-W45,no1yz5t,True,False,True
no26rl0,1ot3s1m,AskDocs,t1_no23fnf,itlookssad,1762751842,thank you so much for your comment i really appreciate your advice. I havent been able to sleep since it happened. I have immense guilt but also every time I close my eyes I see the dog going for me. I'm really upset :(,,False,6,W06_2025-11-10_to_2025-11-16,2026-04-28T22:25:18.898904+00:00,2025-11-10 05:17:22+00:00,2025-11-10,2025-W45,no23fnf,True,False,True
nlmow4z,1oh9mba,AskDocs,t1_nlmomyr,ive_been_up_allnight,1761563474,Because you should start antibiotics as soon as possible.,,False,4,W04_2025-10-27_to_2025-11-02,2026-04-28T22:25:18.898904+00:00,2025-10-27 11:11:14+00:00,2025-10-27,2025-W43,nlmomyr,True,False,True
nu3n5ek,1pms5qa,AskDocs,t1_nu2uw5e,jaiagreen,1765771511,I wonder if something tart might be more tolerable with your nausea. Cranberry juice? Water with lemon juice? Ginger ale might also help with nausea.,,False,11,W11_2025-12-15_to_2025-12-21,2026-04-28T22:25:18.898904+00:00,2025-12-15 04:05:11+00:00,2025-12-15,2025-W50,nu2uw5e,True,False,True
nu3nw1j,1pms5qa,AskDocs,t1_nu2q4xp,jaiagreen,1765771807,"I just googled that kind of Mucinex and it contains dextrometorphan, which is a cough suppressant. Not sure if it's enough to make a difference, but cough suppression is not what you want right now.",,False,11,W11_2025-12-15_to_2025-12-21,2026-04-28T22:25:18.898904+00:00,2025-12-15 04:10:07+00:00,2025-12-15,2025-W50,nu2q4xp,True,False,True
nj7c5i9,1o5485p,AskDocs,t1_nj7bs9l,jhendricks31,1760320011,"That was my thought, but most everything I see says “any possible” exposure should be considered. Looking at the flow sheets doesn’t help because of the nuances of my specific case.",,False,2,W02_2025-10-13_to_2025-10-19,2026-04-28T22:25:18.898904+00:00,2025-10-13 01:46:51+00:00,2025-10-13,2025-W41,nj7bs9l,True,False,True
nj8b0jy,1o59mqg,AskDocs,t1_nj8abfd,jinalaska,1760335890,"I am so proud of you for going to the er. It may be good to mention any other medical concerns you may be having as well. I saw your other post about the burns, they can help you with those (if still bothering you) or any other issues you may have that you have been unable to address with a doctor yet. You’re young, but not invincible. Take care of yourself 💛",,False,2,W02_2025-10-13_to_2025-10-19,2026-04-28T22:25:18.898904+00:00,2025-10-13 06:11:30+00:00,2025-10-13,2025-W41,nj8abfd,True,False,True
no1jewl,1ot0cqq,AskDocs,t1_no1he6i,jmillerdev,1762742297,"Thank you for your expertise. 

I will reach out to my PCP in the morning",,False,6,W06_2025-11-10_to_2025-11-16,2026-04-28T22:25:18.898904+00:00,2025-11-10 02:38:17+00:00,2025-11-10,2025-W45,no1he6i,True,False,True
nvanl0h,1pslpi3,AskDocs,t1_nvamjug,joeynnj,1766366322,She said nothing about her urine is odd.  She did say she didn't have a bowel movement today.  She couldn't remember if she had one yesterday or not.,,False,12,W12_2025-12-22_to_2025-12-28,2026-04-28T22:25:18.898904+00:00,2025-12-22 01:18:42+00:00,2025-12-22,2025-W51,nvamjug,True,False,True
nqhtaud,1p55bum,AskDocs,t1_nqgslk2,jperl1992,1763969051,"I agree with this entire statement. 

u/TaroOwn2269 don't listen to your mom here. It is not your fault that your dad had a heart attack. Likely, his previous risk factors that caused him to get the other two are what caused this one. This is not your fault, and your mom should be ashamed of herself for blaming you, a 17-year-old.",,False,8,W08_2025-11-24_to_2025-11-30,2026-04-28T22:25:18.898904+00:00,2025-11-24 07:24:11+00:00,2025-11-24,2025-W47,nqgslk2,True,False,True
nsvhp85,1ph16su,AskDocs,t3_1ph16su,jsolex,1765162659,"You can take a deep breath - two pills is not enough time to result in diabetes.

Abilify takes about 2 weeks just to reach a steady level in your system. Metabolic changes (like insulin resistance) take weeks to months to develop and are almost always driven by long-term weight gain. It physically cannot happen in 48 hours. 

The clear urine is likely because you are following your doctor's advice and drinking water - that is a sign of good hydration, not diabetes (which would cause dehydration/thirst). The frequent urination is likely because Abilify creates a mild blockade at ""alpha-1"" receptors; this relaxes your bladder muscles slightly and makes you feel the urge to go more often.

Abilify is one of the safer meds regarding diabetes risk because it doesn't block the insulin-regulating receptors in the pancreas as much as some older drugs do.

You are just well-hydrated and your bladder is adjusting to the new med. We typically check blood sugar labs (A1c) at 3 months just to be standard, but you are likely fine for now.",,False,10,W10_2025-12-08_to_2025-12-14,2026-04-28T22:25:18.898904+00:00,2025-12-08 02:57:39+00:00,2025-12-08,2025-W49,,False,True,True
nhzh4zd,1nz37lu,AskDocs,t1_nhzguwp,justanxietythings,1759709188,i def have anxiety that i see a therapist and psychiatrist for but i wanted to post here to get a medical professional opinion,,False,1,W01_2025-10-06_to_2025-10-12,2026-04-28T22:25:18.898904+00:00,2025-10-06 00:06:28+00:00,2025-10-06,2025-W40,nhzguwp,True,False,False
nmt30ry,1omsts0,AskDocs,t3_1omsts0,k471,1762133482,"MRSA is no more serious than a normal staff infections - it just needs specifically targeted antibiotics, which you are now on.",,False,5,W05_2025-11-03_to_2025-11-09,2026-04-28T22:25:18.898904+00:00,2025-11-03 01:31:22+00:00,2025-11-03,2025-W44,,False,True,True
nmtd5z0,1omys4n,AskDocs,t3_1omys4n,k471,1762137155,"Neither of the cultures is indicative of a UTI - most likely skin contamination in the sample.


These symptoms in this age group are highly suspicious for vaginitis, which is an irritant reaction that causes frequent peeing, pain, burning and itching. Frequent culprits are scented shampoos, detergents and especially bubble baths/bath bombs.


https://obgyn.coloradowomenshealth.com/health-info/teens/pediatric-vulvovaginitis",,False,5,W05_2025-11-03_to_2025-11-09,2026-04-28T22:25:18.898904+00:00,2025-11-03 02:32:35+00:00,2025-11-03,2025-W44,,False,True,True
no1gul4,1ot0z1v,AskDocs,t3_1ot0z1v,k471,1762741372,"30-40% of the Caucasian population are positive for HLA-DQ2  but only 0.1-3 percent of the population will get celiac. The highest risk in that population is having multiple at-risk HLAs, which you do not. It's a great rule-out test (high negative predictive value) but terrible risk assessor for acrual disease (positive predictive value).


Deciding to change your diet on a ~1% chance of developing Celiac in the future is your choice.",,False,6,W06_2025-11-10_to_2025-11-16,2026-04-28T22:25:18.898904+00:00,2025-11-10 02:22:52+00:00,2025-11-10,2025-W45,,False,True,True
no1he6i,1ot0cqq,AskDocs,t3_1ot0cqq,k471,1762741568,"Your CRP is mildly elevated which is expected in the setting of an acute illness (and symtpoms could be viral or bacterial - without fever viral is significantly more likely). With your other conditions, a check in with your PCP is reasonable.",,False,6,W06_2025-11-10_to_2025-11-16,2026-04-28T22:25:18.898904+00:00,2025-11-10 02:26:08+00:00,2025-11-10,2025-W45,,False,True,True
nrnr5ec,1pb1qr6,AskDocs,t3_1pb1qr6,k471,1764563723,"""Baby class"" is effectively a daycare level exposure to other kids.",,False,9,W09_2025-12-01_to_2025-12-07,2026-04-28T22:25:18.898904+00:00,2025-12-01 04:35:23+00:00,2025-12-01,2025-W48,,False,True,True
nsvfavt,1pgu9aw,AskDocs,t3_1pgu9aw,k471,1765161798," I'll speak from the baby end.


What I would want to make sure is there are NRP certified providers on staff who can manage any type of typical baby situation. If the hospital has a Level II or higher NICU that's pretty much a given.  For a Level I NICU or no NICU you'll have to ask. Most babies are fine and a term repeat section is low risk, but up to 10% of babies need some resuscitation  beyond warm/dry/stim and birth, and a very small percentage need significant intervention like a breathing tube. 


If they have the people and tools for stabilization/transfer should you need it (someone in house who can intubate a baby, place emergency IV lines, knows neonatal resuscitation guidelines) then I'd feel fine. But if they dont have that Id probably go somewhere else. The issue with needing resuscitation is you usually dont need it but every once In a while it's lifesaving, and you can't predict when it will be needed. A term repeat c/s is very low risk, but any birth has at least a tiny bit of risk. If that risk comes up, you want to be in a situation where someone knows what to do.",,False,10,W10_2025-12-08_to_2025-12-14,2026-04-28T22:25:18.898904+00:00,2025-12-08 02:43:18+00:00,2025-12-08,2025-W49,,False,True,True
npaapqc,1oyt21n,AskDocs,t1_np8o4zw,kaikai472,1763367015,okay thanks for your input!! and what can i expect as the consequences of onycholysis ? and so do you recommend that i soak the nail in vinegar for how long ? just to see if anything changes,,False,7,W07_2025-11-17_to_2025-11-23,2026-04-28T22:25:18.898904+00:00,2025-11-17 08:10:15+00:00,2025-11-17,2025-W46,np8o4zw,True,False,True
