comment_id,post_id,subreddit,parent_id,author,created_utc,text,distinguished,stickied,collection_week_idx,collection_week_label,pulled_at_utc,date,week_start,year_week,parent_comment_id,has_parent_in_window,is_direct_reply,parent_post_found
nj7p6wg,1o57i04,AskDocs,t1_nj7mvwc,Intelligent_Mallard,1760324977,"I honestly found it so difficult with shared food that I attempted to do food that was exclusively for me, but my family kept eating all my food when they ran out of their snacks and I had snacks left. I eventually just made my whole household go gluten free, but it was my husband and kids so a lot more ideal than a roommate situation.",,False,2,W02_2025-10-13_to_2025-10-19,2026-04-28T22:25:18.898904+00:00,2025-10-13 03:09:37+00:00,2025-10-13,2025-W41,nj7mvwc,True,False,True
nkft2gk,1oapjx3,AskDocs,t3_1oapjx3,Internal_Butterfly81,1760940882,Sounds like a form of anorexia! I think you need help OP and I mean that with love and care.,,False,3,W03_2025-10-20_to_2025-10-26,2026-04-28T22:25:18.898904+00:00,2025-10-20 06:14:42+00:00,2025-10-20,2025-W42,,False,True,True
nln6d0f,1oh0cv1,AskDocs,t3_1oh0cv1,Internal_Butterfly81,1761570653,If I  were you I would have some other place look at it and get that drained.,,False,4,W04_2025-10-27_to_2025-11-02,2026-04-28T22:25:18.898904+00:00,2025-10-27 13:10:53+00:00,2025-10-27,2025-W43,,False,True,True
nsupjrk,1pgwp6q,AskDocs,t3_1pgwp6q,Internal_Butterfly81,1765152649,Don’t drink. It’s not worth it.,,False,10,W10_2025-12-08_to_2025-12-14,2026-04-28T22:25:18.898904+00:00,2025-12-08 00:10:49+00:00,2025-12-08,2025-W49,,False,True,True
nsuxjhe,1pgoj0p,AskDocs,t3_1pgoj0p,Internal_Butterfly81,1765155367,"You should probably tell your primary care provider and maybe get a referral to a spine doc, like a neuro surgeon. Maybe an ortho doc?",,False,10,W10_2025-12-08_to_2025-12-14,2026-04-28T22:25:18.898904+00:00,2025-12-08 00:56:07+00:00,2025-12-08,2025-W49,,False,True,True
nsvc6vz,1ph071c,AskDocs,t3_1ph071c,Internal_Butterfly81,1765160683,It’s hard to say. Everyone is different. I don’t think anyone can say one way or another. I’m so sorry,,False,10,W10_2025-12-08_to_2025-12-14,2026-04-28T22:25:18.898904+00:00,2025-12-08 02:24:43+00:00,2025-12-08,2025-W49,,False,True,True
nvavku6,1psmwsl,AskDocs,t3_1psmwsl,Internal_Butterfly81,1766369269,"Please get off SickTok. And I mean that with genuine care. I think you need to look into having your doctor treat your GAD and finding the root cause of that. Were you actually diagnosed by a real physician with the above issues? What testing have you had? As far as being nauseous for one day, what else is so terrible that you feel you’re having a medical emergency? Have you actually vomited? Are you able to tolerate fluids? Urinating ok? I’m sorry you feel bad today. Truly I am.",,False,12,W12_2025-12-22_to_2025-12-28,2026-04-28T22:25:18.898904+00:00,2025-12-22 02:07:49+00:00,2025-12-22,2025-W51,,False,True,True
nsuxhrt,1pgwp6q,AskDocs,t1_nsuvt86,International_Sea285,1765155350,"I see you got the answer you wanted. I guess when 4 out of 5 doctors agree, you should definitely take the advice of the one doctor that doesn’t… I of course am not a doctor, just a social worker who has spent a lot of time dealing with people who have addictions. 

I still think that you are playing a stupid game and should be prepared to win stupid prizes.",,False,10,W10_2025-12-08_to_2025-12-14,2026-04-28T22:25:18.898904+00:00,2025-12-08 00:55:50+00:00,2025-12-08,2025-W49,nsuvt86,True,False,True
nsuzelz,1pgwp6q,AskDocs,t1_nsuz1vx,International_Sea285,1765156048,Your comments suggest otherwise.,,False,10,W10_2025-12-08_to_2025-12-14,2026-04-28T22:25:18.898904+00:00,2025-12-08 01:07:28+00:00,2025-12-08,2025-W49,nsuz1vx,True,False,True
nsv0o2c,1pgwp6q,AskDocs,t1_nsuz2yu,International_Sea285,1765156516,"“Harm reduction” is a misnomer. It still implies that harm is being done. It is a hotly contested issue in the mental health field, and is primarily applied to substance abuse. Hence we are still talking about some kind of addiction. Rather than saying it’s ok to continue to abuse substances, just make sure you abuse them less than you abused them before” we should be focusing on actually treating the addiction, identifying the root causes of the addiction, and preventing the harm from occurring in the first place. It’s not about being self righteous. Focusing on “harm reduction” rather than treatment is a cop out. Plain and simple.",,False,10,W10_2025-12-08_to_2025-12-14,2026-04-28T22:25:18.898904+00:00,2025-12-08 01:15:16+00:00,2025-12-08,2025-W49,nsuz2yu,True,False,True
nsv2df5,1pgwp6q,AskDocs,t1_nsuwtpm,International_Sea285,1765157150,"Play stupid games, win stupid prizes. There is nothing “normal” about what you are describing",,False,10,W10_2025-12-08_to_2025-12-14,2026-04-28T22:25:18.898904+00:00,2025-12-08 01:25:50+00:00,2025-12-08,2025-W49,nsuwtpm,True,False,True
nsv624z,1pgwp6q,AskDocs,t1_nsv24qe,International_Sea285,1765158503,"I know exactly what harm or reduction is. Everything from wearing helmets on a bicycle to giving an addict a clean needle falls under harm reduction. But harm reduction only works if it’s not used flippantly. I have read plenty of peer reviewed research papers on both sides of the debate when harm reduction concepts are applied to substance use and alcohol use disorder. 

Giving an addict a clean needle so they don’t get HIV is worthless if they still use enough of the substance to overdose. That’s not really harm reduction. 

Telling someone that it’s OK to drink while taking a medication that says you should not drink while taking it is setting this person up for failure, not harm reduction. This person has also admitted that they have experienced side effects of this medication and increased side effects after having just one drink in a previous incident. So it’s really tough to rationalize giving permission to drink with these statements in play.",,False,10,W10_2025-12-08_to_2025-12-14,2026-04-28T22:25:18.898904+00:00,2025-12-08 01:48:23+00:00,2025-12-08,2025-W49,nsv24qe,True,False,True
nsv90yq,1pgwp6q,AskDocs,t1_nsv4pc9,International_Sea285,1765159558,"Let me break it down…. Fact 1. Leg spasms are a known side effect that you have.  Fact 2. Your side effects got worse on at least one occasion after drinking a single alcoholic drink - you yourself described it as a “whole body spasm” Fact 3. Your actual psychiatrist told you not to drink at all on this medication. Fact 4. You have openly stated your intent to get “buzzed” which is no different whatsoever than being drunk.

What is not normal is the combination of these facts. You have a problem. You knowingly want to engage in dangerous activities. This would’ve been an entirely different conversation if your question was “is it safe to have one drink?” But that wasn’t your question. Everything you have stated in this thread points to an alcohol use disorder.",,False,10,W10_2025-12-08_to_2025-12-14,2026-04-28T22:25:18.898904+00:00,2025-12-08 02:05:58+00:00,2025-12-08,2025-W49,nsv4pc9,True,False,True
nrml3om,1pau8g7,AskDocs,t3_1pau8g7,Intrepid_Employ_9962,1764547975,"I’m definitely not an expert but I think the key with ocd is why you have the compulsion and fear of what happens if you don’t do it. This to me sounds more like you get anxious if something disrupts your plans and you like to stick to a daily routine. That could be a sign of other underlying issues, particularly if it is causing you a lot of distress or impacting your life significantly.",,False,9,W09_2025-12-01_to_2025-12-07,2026-04-28T22:25:18.898904+00:00,2025-12-01 00:12:55+00:00,2025-12-01,2025-W48,,False,True,True
no1zbu1,1ot0gz4,AskDocs,t1_no1md2v,InvestigatorShot4488,1762748447,Colorado?,,False,6,W06_2025-11-10_to_2025-11-16,2026-04-28T22:25:18.898904+00:00,2025-11-10 04:20:47+00:00,2025-11-10,2025-W45,no1md2v,True,False,True
nhztytz,1nyvxv8,AskDocs,t3_1nyvxv8,Itchdoc,1759713878,"You likely have some type of dermatitis, but not enough information is provided to determine the exact type.",,False,1,W01_2025-10-06_to_2025-10-12,2026-04-28T22:25:18.898904+00:00,2025-10-06 01:24:38+00:00,2025-10-06,2025-W40,,False,True,False
nhzusc3,1nyvlux,AskDocs,t3_1nyvlux,Itchdoc,1759714182,"You don't seem to provide any information about the spot, so no opinion is appropriate. Very few of us can see through garments. There is no reason to have the spot evaluated if you will not show it to your doctor.",,False,1,W01_2025-10-06_to_2025-10-12,2026-04-28T22:25:18.898904+00:00,2025-10-06 01:29:42+00:00,2025-10-06,2025-W40,,False,True,False
nhzv8rf,1nyujzv,AskDocs,t3_1nyujzv,Itchdoc,1759714353,Consider aquagenic pruritus.,,False,1,W01_2025-10-06_to_2025-10-12,2026-04-28T22:25:18.898904+00:00,2025-10-06 01:32:33+00:00,2025-10-06,2025-W40,,False,True,False
nhzvj4u,1nz0eec,AskDocs,t3_1nz0eec,Itchdoc,1759714460,"Please let us know if you have shown the entire rash. If not, consider showing it.",,False,1,W01_2025-10-06_to_2025-10-12,2026-04-28T22:25:18.898904+00:00,2025-10-06 01:34:20+00:00,2025-10-06,2025-W40,,False,True,False
nhzvvco,1nz2efb,AskDocs,t3_1nz2efb,Itchdoc,1759714584,I want to examine dermoscopically to help decide if a biopsy is needed.,,False,1,W01_2025-10-06_to_2025-10-12,2026-04-28T22:25:18.898904+00:00,2025-10-06 01:36:24+00:00,2025-10-06,2025-W40,,False,True,False
nhzw6mc,1nz5d74,AskDocs,t3_1nz5d74,Itchdoc,1759714700,"Without examining your entire scalp, a meaningful opinion is not possible.",,False,1,W01_2025-10-06_to_2025-10-12,2026-04-28T22:25:18.898904+00:00,2025-10-06 01:38:20+00:00,2025-10-06,2025-W40,,False,True,True
nhzwaz0,1nz5hhn,AskDocs,t3_1nz5hhn,Itchdoc,1759714745,I suspect arthropod assault.,,False,1,W01_2025-10-06_to_2025-10-12,2026-04-28T22:25:18.898904+00:00,2025-10-06 01:39:05+00:00,2025-10-06,2025-W40,,False,True,True
ni1370x,1nz5d74,AskDocs,t3_1nz5d74,Itchdoc,1759734701,Consider adding high-quality images of your scalp in this area.,,False,1,W01_2025-10-06_to_2025-10-12,2026-04-28T22:25:18.898904+00:00,2025-10-06 07:11:41+00:00,2025-10-06,2025-W40,,False,True,True
ni13blw,1nyvxv8,AskDocs,t1_nhzz2tq,Itchdoc,1759734777,You can try using topical hydrocortisone and a fragrance-free moisturizer for two weeks. Seek medical care if you do not see any improvement or are concerned.,,False,1,W01_2025-10-06_to_2025-10-12,2026-04-28T22:25:18.898904+00:00,2025-10-06 07:12:57+00:00,2025-10-06,2025-W40,nhzz2tq,True,False,False
ni13ft5,1nz5hhn,AskDocs,t1_ni048mz,Itchdoc,1759734847,"Exaggerated bite reactions do occur and may not need treatment. Taking a daily dose (before the bite) of a second-generation antihistamine (loratadine, levocetirizine...) can decrease the intensity of the itch and swelling response. 

Although not evidence-based, the application of a high-potency topical corticosteroid (clobetasol, halobetasol...) to the bite site usually rapidly decreases the inflammation and itch.",,False,1,W01_2025-10-06_to_2025-10-12,2026-04-28T22:25:18.898904+00:00,2025-10-06 07:14:07+00:00,2025-10-06,2025-W40,ni048mz,True,False,True
ni1jmkz,1nz72sw,AskDocs,t3_1nz72sw,Itchdoc,1759744888,"This could be herpes, but the appearance is not diagnostic. Herpesvirus PCR testing is highly sensitive and specific.",,False,1,W01_2025-10-06_to_2025-10-12,2026-04-28T22:25:18.898904+00:00,2025-10-06 10:01:28+00:00,2025-10-06,2025-W40,,False,True,True
ni1k6m7,1nzduv4,AskDocs,t3_1nzduv4,Itchdoc,1759745206,"Unless the spot lasts more than 8-12 weeks, it is unlikely to be cancer.",,False,1,W01_2025-10-06_to_2025-10-12,2026-04-28T22:25:18.898904+00:00,2025-10-06 10:06:46+00:00,2025-10-06,2025-W40,,False,True,True
nj7tb9i,1o3dwvx,AskDocs,t3_1o3dwvx,Itchdoc,1760326770,"You likely have some type of dermatitis, but not enough information is provided to determine the exact type. You can try using topical hydrocortisone and a fragrance-free moisturizer for two weeks. Seek medical care if you do not see any improvement or are concerned. I suspect that you are also dermatographic.",,False,2,W02_2025-10-13_to_2025-10-19,2026-04-28T22:25:18.898904+00:00,2025-10-13 03:39:30+00:00,2025-10-13,2025-W41,,False,True,True
nj7timg,1o50dds,AskDocs,t3_1o50dds,Itchdoc,1760326865,Likely talon noir.,,False,2,W02_2025-10-13_to_2025-10-19,2026-04-28T22:25:18.898904+00:00,2025-10-13 03:41:05+00:00,2025-10-13,2025-W41,,False,True,True
nj7tnul,1o4zx50,AskDocs,t3_1o4zx50,Itchdoc,1760326931,It looks like an annular erythema to me—too little visual and other information for more insight.,,False,2,W02_2025-10-13_to_2025-10-19,2026-04-28T22:25:18.898904+00:00,2025-10-13 03:42:11+00:00,2025-10-13,2025-W41,,False,True,True
nj7u15a,1o4yqsb,AskDocs,t3_1o4yqsb,Itchdoc,1760327098,"Yes, there are many alternatives, and talking with your psychiatrist is the best way to go.",,False,2,W02_2025-10-13_to_2025-10-19,2026-04-28T22:25:18.898904+00:00,2025-10-13 03:44:58+00:00,2025-10-13,2025-W41,,False,True,True
nj7ukuj,1o4xsxr,AskDocs,t3_1o4xsxr,Itchdoc,1760327346,All the visible changes are typical of trauma. There is not enough information for more insight.,,False,2,W02_2025-10-13_to_2025-10-19,2026-04-28T22:25:18.898904+00:00,2025-10-13 03:49:06+00:00,2025-10-13,2025-W41,,False,True,True
nj7uqg9,1o4wrek,AskDocs,t3_1o4wrek,Itchdoc,1760327419,"Consider adding medical history, BMI...",,False,2,W02_2025-10-13_to_2025-10-19,2026-04-28T22:25:18.898904+00:00,2025-10-13 03:50:19+00:00,2025-10-13,2025-W41,,False,True,True
nj7vc9a,1o50h8t,AskDocs,t3_1o50h8t,Itchdoc,1760327693,Likely an inflammatory tinea.,,False,2,W02_2025-10-13_to_2025-10-19,2026-04-28T22:25:18.898904+00:00,2025-10-13 03:54:53+00:00,2025-10-13,2025-W41,,False,True,True
nj7w250,1o55huk,AskDocs,t3_1o55huk,Itchdoc,1760328025,This is not enough information for meaningful insight. Consider visiting a dermatologist or podiatrist.,,False,2,W02_2025-10-13_to_2025-10-19,2026-04-28T22:25:18.898904+00:00,2025-10-13 04:00:25+00:00,2025-10-13,2025-W41,,False,True,True
nj7w72d,1o55jwe,AskDocs,t3_1o55jwe,Itchdoc,1760328090,Consider showing all affected skin.,,False,2,W02_2025-10-13_to_2025-10-19,2026-04-28T22:25:18.898904+00:00,2025-10-13 04:01:30+00:00,2025-10-13,2025-W41,,False,True,True
nj7wknx,1o56ivh,AskDocs,t3_1o56ivh,Itchdoc,1760328270,Consider adding medical history and showing the entire rash.,,False,2,W02_2025-10-13_to_2025-10-19,2026-04-28T22:25:18.898904+00:00,2025-10-13 04:04:30+00:00,2025-10-13,2025-W41,,False,True,True
nj7xfeb,1o57ha4,AskDocs,t3_1o57ha4,Itchdoc,1760328678,How long do the spots last after they have arisen?,,False,2,W02_2025-10-13_to_2025-10-19,2026-04-28T22:25:18.898904+00:00,2025-10-13 04:11:18+00:00,2025-10-13,2025-W41,,False,True,True
nj7xkd0,1o58i33,AskDocs,t3_1o58i33,Itchdoc,1760328745,I suspect an ingrown nail with some granulation tissue. Consider seeking care.,,False,2,W02_2025-10-13_to_2025-10-19,2026-04-28T22:25:18.898904+00:00,2025-10-13 04:12:25+00:00,2025-10-13,2025-W41,,False,True,True
nj85v64,1o55jwe,AskDocs,t1_nj7x4pr,Itchdoc,1760332985,"You state, ""brown spots appearing on my sides."" You appear to show one side.",,False,2,W02_2025-10-13_to_2025-10-19,2026-04-28T22:25:18.898904+00:00,2025-10-13 05:23:05+00:00,2025-10-13,2025-W41,nj7x4pr,True,False,True
nlmc4zt,1ogxzns,AskDocs,t3_1ogxzns,Itchdoc,1761556221,This is a nonspecific appearance that could be hundreds of conditions. It is not likely to be worrisome.,,False,4,W04_2025-10-27_to_2025-11-02,2026-04-28T22:25:18.898904+00:00,2025-10-27 09:10:21+00:00,2025-10-27,2025-W43,,False,True,True
nlmc8wg,1ogyrbk,AskDocs,t3_1ogyrbk,Itchdoc,1761556291,Symptoms?,,False,4,W04_2025-10-27_to_2025-11-02,2026-04-28T22:25:18.898904+00:00,2025-10-27 09:11:31+00:00,2025-10-27,2025-W43,,False,True,True
nlmcdig,1ogz8cn,AskDocs,t3_1ogz8cn,Itchdoc,1761556374,"The result of trauma, among hundreds of other conditions, could appear this way.",,False,4,W04_2025-10-27_to_2025-11-02,2026-04-28T22:25:18.898904+00:00,2025-10-27 09:12:54+00:00,2025-10-27,2025-W43,,False,True,True
nlmcnwt,1oh1imp,AskDocs,t3_1oh1imp,Itchdoc,1761556557,Consider first addressing this as chronic paronychia.,,False,4,W04_2025-10-27_to_2025-11-02,2026-04-28T22:25:18.898904+00:00,2025-10-27 09:15:57+00:00,2025-10-27,2025-W43,,False,True,True
nlmczkc,1oh3ywg,AskDocs,t3_1oh3ywg,Itchdoc,1761556763,Duration?,,False,4,W04_2025-10-27_to_2025-11-02,2026-04-28T22:25:18.898904+00:00,2025-10-27 09:19:23+00:00,2025-10-27,2025-W43,,False,True,True
nlmd7lp,1oh5uzn,AskDocs,t3_1oh5uzn,Itchdoc,1761556905,"Subungual hematomas are common, and many do not remember the traumatic incident. The easy way to confirm is to measure the distance in mm from the cuticle to the closest area of the spot. Toenails grow at about 0.5mm per week, and fingernails grow at 1 mm per week. So in a month, toenails should grow out 2mm and fingernails 4 mm. If in 2 months, you are not convinced the spot is growing out, seek care.",,False,4,W04_2025-10-27_to_2025-11-02,2026-04-28T22:25:18.898904+00:00,2025-10-27 09:21:45+00:00,2025-10-27,2025-W43,,False,True,True
nlmd9a7,1oh6043,AskDocs,t3_1oh6043,Itchdoc,1761556935,no,,False,4,W04_2025-10-27_to_2025-11-02,2026-04-28T22:25:18.898904+00:00,2025-10-27 09:22:15+00:00,2025-10-27,2025-W43,,False,True,True
nmsoic0,1omwh4o,AskDocs,t3_1omwh4o,Itchdoc,1762128273,Many viral exanthems could appear this way.,,False,5,W05_2025-11-03_to_2025-11-09,2026-04-28T22:25:18.898904+00:00,2025-11-03 00:04:33+00:00,2025-11-03,2025-W44,,False,True,True
nmsp1ot,1omvvo2,AskDocs,t3_1omvvo2,Itchdoc,1762128458,"To help it heal faster, cover with petrolatum and a nonstick dressing.",,False,5,W05_2025-11-03_to_2025-11-09,2026-04-28T22:25:18.898904+00:00,2025-11-03 00:07:38+00:00,2025-11-03,2025-W44,,False,True,True
nmspjdv,1omulul,AskDocs,t3_1omulul,Itchdoc,1762128626,Non-functional link and not much information here. There is good evidence that treating every 3 weeks with cantharidin speeds resolution. Other destructive treatments likely do the same.,,False,5,W05_2025-11-03_to_2025-11-09,2026-04-28T22:25:18.898904+00:00,2025-11-03 00:10:26+00:00,2025-11-03,2025-W44,,False,True,True
nmsqj58,1omt0up,AskDocs,t3_1omt0up,Itchdoc,1762128972,"Consider including the text of your pathology report, including the microscopic description.",,False,5,W05_2025-11-03_to_2025-11-09,2026-04-28T22:25:18.898904+00:00,2025-11-03 00:16:12+00:00,2025-11-03,2025-W44,,False,True,True
nmsqu9c,1omrtyr,AskDocs,t3_1omrtyr,Itchdoc,1762129079,I suspect a melanocytic nevus.,,False,5,W05_2025-11-03_to_2025-11-09,2026-04-28T22:25:18.898904+00:00,2025-11-03 00:17:59+00:00,2025-11-03,2025-W44,,False,True,True
nmsrp0o,1omqpio,AskDocs,t3_1omqpio,Itchdoc,1762129376,"Finding a ""cause"" for most chronic urticaria in most patients is not a reasonable expectation. Laboratory and other evaluations are not evidence-based. Following the evidence-based treatment approach in Figure 2 will greatly improve most patients: [https://onlinelibrary.wiley.com/doi/10.1111/all.13397](https://onlinelibrary.wiley.com/doi/10.1111/all.13397)

No evidence-based guidelines recommend first-generation antihistamines, such as hydroxyzine, for chronic urticaria. Second-generation antihistamines are considered safe and effective for long-term use: [https://en.wikipedia.org/wiki/H1\_antagonist#Second-generation](https://en.wikipedia.org/wiki/H1_antagonist#Second-generation)",,False,5,W05_2025-11-03_to_2025-11-09,2026-04-28T22:25:18.898904+00:00,2025-11-03 00:22:56+00:00,2025-11-03,2025-W44,,False,True,True
nmssthv,1ompf87,AskDocs,t3_1ompf87,Itchdoc,1762129771,"Measles, among many other exanthems, could appear this way. Examining his entire skin surface and oral mucous membranes may help narrow the number of diagnoses.",,False,5,W05_2025-11-03_to_2025-11-09,2026-04-28T22:25:18.898904+00:00,2025-11-03 00:29:31+00:00,2025-11-03,2025-W44,,False,True,True
nmst1yf,1omo143,AskDocs,t3_1omo143,Itchdoc,1762129851,"The spot that you show is likely benign. Note that without examining all of your skin, it is difficult to know whether this is normal or fulfills the ""ugly duckling sign."" Moreover, most people who post on this site do not use high-resolution macro lenses or dermoscopic photography. If you are concerned, seek care.",,False,5,W05_2025-11-03_to_2025-11-09,2026-04-28T22:25:18.898904+00:00,2025-11-03 00:30:51+00:00,2025-11-03,2025-W44,,False,True,True
nmstmig,1omamz3,AskDocs,t3_1omamz3,Itchdoc,1762130052,"This is too little history and visual information for a diagnosis. A variety of types of dermatitis, scabies, and many other conditions could appear this way. Consider dermatology care.",,False,5,W05_2025-11-03_to_2025-11-09,2026-04-28T22:25:18.898904+00:00,2025-11-03 00:34:12+00:00,2025-11-03,2025-W44,,False,True,True
nmsuy4p,1omik0s,AskDocs,t3_1omik0s,Itchdoc,1762130528,"The images do indeed show many morphologies, including targetoid and annular erythema. The images and your description provide little insight into the locations and orientations of spots. If there are differently appearing spots that have not been sampled, this may help, and your doctor likely feels the same. You seem to have a laboratory evaluation that was not shared.",,False,5,W05_2025-11-03_to_2025-11-09,2026-04-28T22:25:18.898904+00:00,2025-11-03 00:42:08+00:00,2025-11-03,2025-W44,,False,True,True
nmsv9pg,1omdujh,AskDocs,t3_1omdujh,Itchdoc,1762130644,I suspect [https://dermnetnz.org/topics/anogenital-warts](https://dermnetnz.org/topics/anogenital-warts),,False,5,W05_2025-11-03_to_2025-11-09,2026-04-28T22:25:18.898904+00:00,2025-11-03 00:44:04+00:00,2025-11-03,2025-W44,,False,True,True
nmsw8fd,1omuyfe,AskDocs,t3_1omuyfe,Itchdoc,1762130991,"She has no visible evidence of herpes labialis. Asymptomatic HSV shedding is universal, but you are at risk of this only if your partner was shedding at the time. No comment is possible on other STI risk.",,False,5,W05_2025-11-03_to_2025-11-09,2026-04-28T22:25:18.898904+00:00,2025-11-03 00:49:51+00:00,2025-11-03,2025-W44,,False,True,True
no11f70,1osulgr,AskDocs,t3_1osulgr,Itchdoc,1762735748,"Sunburns are associated with skin cancer, but are unlikely to be causally related. Most skin cancer is related to nonburning exposure. Your images are of poor quality and provide no information.",,False,6,W06_2025-11-10_to_2025-11-16,2026-04-28T22:25:18.898904+00:00,2025-11-10 00:49:08+00:00,2025-11-10,2025-W45,,False,True,True
no129rb,1oss79e,AskDocs,t3_1oss79e,Itchdoc,1762736050,Sedating antihistamines are not recommended by any evidence-based guidelines for chronic urticaria. Lesser sedating antihistamines such as levocetirizine or loratadine in doses up to four times the recommended dose is much better tolerated and equally effective.,,False,6,W06_2025-11-10_to_2025-11-16,2026-04-28T22:25:18.898904+00:00,2025-11-10 00:54:10+00:00,2025-11-10,2025-W45,,False,True,True
no135qk,1osqe8o,AskDocs,t3_1osqe8o,Itchdoc,1762736369,"You likely have some type of dermatitis, but not enough information is provided to determine the exact type. You can try using topical hydrocortisone and a fragrance-free moisturizer for two weeks. Seek medical care if you do not see any improvement or are concerned.",,False,6,W06_2025-11-10_to_2025-11-16,2026-04-28T22:25:18.898904+00:00,2025-11-10 00:59:29+00:00,2025-11-10,2025-W45,,False,True,True
no13mbm,1oso6ex,AskDocs,t3_1oso6ex,Itchdoc,1762736536,"Many conditions could appear this way. If you are concerned, consider a dermatology evaluation.",,False,6,W06_2025-11-10_to_2025-11-16,2026-04-28T22:25:18.898904+00:00,2025-11-10 01:02:16+00:00,2025-11-10,2025-W45,,False,True,True
no14san,1osxr5u,AskDocs,t3_1osxr5u,Itchdoc,1762736964,You likely have [https://dermnetnz.org/topics/seborrhoeic-dermatitis](https://dermnetnz.org/topics/seborrhoeic-dermatitis) and there are many potentially effective treatments.,,False,6,W06_2025-11-10_to_2025-11-16,2026-04-28T22:25:18.898904+00:00,2025-11-10 01:09:24+00:00,2025-11-10,2025-W45,,False,True,True
no1561u,1ot0a8i,AskDocs,t3_1ot0a8i,Itchdoc,1762737106,"I suspect some type of cyst, such as an epidermoid cyst.",,False,6,W06_2025-11-10_to_2025-11-16,2026-04-28T22:25:18.898904+00:00,2025-11-10 01:11:46+00:00,2025-11-10,2025-W45,,False,True,True
np8muhf,1oypw9i,AskDocs,t3_1oypw9i,Itchdoc,1763340602,Likely a type of [https://dermnetnz.org/cme/dermatitis/hand-dermatitis](https://dermnetnz.org/cme/dermatitis/hand-dermatitis),,False,7,W07_2025-11-17_to_2025-11-23,2026-04-28T22:25:18.898904+00:00,2025-11-17 00:50:02+00:00,2025-11-17,2025-W46,,False,True,True
np8n225,1oyq50q,AskDocs,t3_1oyq50q,Itchdoc,1763340675,Patch testing makes no sense to me for potential respiratory problems.,,False,7,W07_2025-11-17_to_2025-11-23,2026-04-28T22:25:18.898904+00:00,2025-11-17 00:51:15+00:00,2025-11-17,2025-W46,,False,True,True
np8nkxa,1oysorb,AskDocs,t3_1oysorb,Itchdoc,1763340852,"This is likely an epidermoid cyst, and it can be excised.",,False,7,W07_2025-11-17_to_2025-11-23,2026-04-28T22:25:18.898904+00:00,2025-11-17 00:54:12+00:00,2025-11-17,2025-W46,,False,True,True
np8o4zw,1oyt21n,AskDocs,t3_1oyt21n,Itchdoc,1763341045,"You have onycholysis complicated by Pseudomonas nail pyoderma. For the former, there is no known effective treatment. For the latter, soaking in vinegar will likely clear.",,False,7,W07_2025-11-17_to_2025-11-23,2026-04-28T22:25:18.898904+00:00,2025-11-17 00:57:25+00:00,2025-11-17,2025-W46,,False,True,True
np8ofke,1oyu077,AskDocs,t3_1oyu077,Itchdoc,1763341148,"Persistent bite reactions can last months to years. Potent topical corticosteroids (clobetasol, halobetasol...) or intralesional corticosteroid injections often help.",,False,7,W07_2025-11-17_to_2025-11-23,2026-04-28T22:25:18.898904+00:00,2025-11-17 00:59:08+00:00,2025-11-17,2025-W46,,False,True,True
