comment_id,post_id,subreddit,parent_id,author,created_utc,text,distinguished,stickied,collection_week_idx,collection_week_label,pulled_at_utc,date,week_start,year_week,parent_comment_id,has_parent_in_window,is_direct_reply,parent_post_found
nsvc97s,1pgwp6q,AskDocs,t1_nsuntca,QueenofCats28,1765160706,I agree.  Do NOT drink while taking this drug.  I have too much experience with this one and others to tell you it is such a bad idea.  The way it counteracts and interacts with it is bad.  And do NOT stop taking it.  It's dangerous to go cold turkey on it.  I also have too much experience on these things.,,False,10,W10_2025-12-08_to_2025-12-14,2026-04-28T22:25:18.898904+00:00,2025-12-08 02:25:06+00:00,2025-12-08,2025-W49,nsuntca,True,False,True
nj84o2z,1o59mqg,AskDocs,t1_nj83zfr,Quirky_Breakfast_574,1760332343,"Please keep us updated. And from someone who was young and dumb once - NEVER again take pills with alcohol unless you know for sure that they don’t interact. A simple drug interaction checker can do this for you. Most don’t work well with alcohol. 

Also, I know people have told you, but the pill drawer has to go. Even if your parents vote to keep it, get your own bottles and keep them in your room. It’s very dangerous and I am glad you are getting help! You made the right choice",,False,2,W02_2025-10-13_to_2025-10-19,2026-04-28T22:25:18.898904+00:00,2025-10-13 05:12:23+00:00,2025-10-13,2025-W41,nj83zfr,True,False,True
nj7n5td,1o582ch,AskDocs,t3_1o582ch,RCPCFRN,1760324160,"You blood glucose would be abnormal on your bloodwork if you were diabetic. 

It sounds like you’re in ketosis. This can happen when your body burns fat, like you are taking in too few carbs. You see this in low carb, keto, and carnivore type diets very often.",,False,2,W02_2025-10-13_to_2025-10-19,2026-04-28T22:25:18.898904+00:00,2025-10-13 02:56:00+00:00,2025-10-13,2025-W41,,False,True,True
nqgza0b,1p55bum,AskDocs,t1_nqgslk2,RadEmily,1763954423,"yeah no one is their best under this type of stress but this is incredibly immature and abusive thing to say to a child, geezus.",,False,8,W08_2025-11-24_to_2025-11-30,2026-04-28T22:25:18.898904+00:00,2025-11-24 03:20:23+00:00,2025-11-24,2025-W47,nqgslk2,True,False,True
nmtn8b3,1on1672,AskDocs,t1_nmtl2ak,Radiant-Sector1258,1762141118,Thank you!,,False,5,W05_2025-11-03_to_2025-11-09,2026-04-28T22:25:18.898904+00:00,2025-11-03 03:38:38+00:00,2025-11-03,2025-W44,nmtl2ak,True,False,True
nmtn8vs,1on1672,AskDocs,t1_nmtmbp2,Radiant-Sector1258,1762141124,Thank you!,,False,5,W05_2025-11-03_to_2025-11-09,2026-04-28T22:25:18.898904+00:00,2025-11-03 03:38:44+00:00,2025-11-03,2025-W44,nmtmbp2,True,False,True
nmtng2k,1on1672,AskDocs,t1_nmtl2ak,Radiant-Sector1258,1762141204,"You are right, who cares about a number.  If I have an IQ of 81, so be it!",,False,5,W05_2025-11-03_to_2025-11-09,2026-04-28T22:25:18.898904+00:00,2025-11-03 03:40:04+00:00,2025-11-03,2025-W44,nmtl2ak,True,False,True
np8ynw6,1oz3r9q,AskDocs,t1_np8xtps,Realistic_Key_6334,1763344900,"Is it possible to speak to people in a telepathic way yes or no, for example: If I am upstairs and my family is downstairs can I communicate with them and have full conversations with them telepathic my?",,False,7,W07_2025-11-17_to_2025-11-23,2026-04-28T22:25:18.898904+00:00,2025-11-17 02:01:40+00:00,2025-11-17,2025-W46,np8xtps,True,False,True
np8zt6n,1oz3r9q,AskDocs,t1_np8zhay,Realistic_Key_6334,1763345321,"You’re telling me that I cannot send any type of message through to someone without speaking to them, So I cannot speak to someone with my mind? And again I am not talking about eye contact or looking at them. Are you absolutely sure of this",,False,7,W07_2025-11-17_to_2025-11-23,2026-04-28T22:25:18.898904+00:00,2025-11-17 02:08:41+00:00,2025-11-17,2025-W46,np8zhay,True,False,True
np9ol23,1oz3r9q,AskDocs,t1_np9m1i1,Realistic_Key_6334,1763354940,So you can town to people in a telepathic way,,False,7,W07_2025-11-17_to_2025-11-23,2026-04-28T22:25:18.898904+00:00,2025-11-17 04:49:00+00:00,2025-11-17,2025-W46,np9m1i1,True,False,True
nmsppca,1omwh4o,AskDocs,t1_nmsoic0,Reddread13,1762128681,The rash is no where else and has lasted a week. We have not had a viral rash last this long before.,,False,5,W05_2025-11-03_to_2025-11-09,2026-04-28T22:25:18.898904+00:00,2025-11-03 00:11:21+00:00,2025-11-03,2025-W44,nmsoic0,True,False,True
nj6vxi0,1o54sh4,AskDocs,t3_1o54sh4,RemarkablePlenty3903,1760313950,"Also: I’m going to add that another reason they admitted me was because I would be relaxing and it would go to 170, show A-fib or SVT for a few and they couldn’t get it stable.",,False,2,W02_2025-10-13_to_2025-10-19,2026-04-28T22:25:18.898904+00:00,2025-10-13 00:05:50+00:00,2025-10-13,2025-W41,,False,True,True
nsvovfj,1ph22cf,AskDocs,t3_1ph22cf,RenaH80,1765165409,You should always talk to your providers when there has been a significant change in symptoms. It’s ok to reach out early.,,False,10,W10_2025-12-08_to_2025-12-14,2026-04-28T22:25:18.898904+00:00,2025-12-08 03:43:29+00:00,2025-12-08,2025-W49,,False,True,True
nqgdyn3,1p53heq,AskDocs,t3_1p53heq,Rishiku,1763946354,"[It has gotten more red today, but it does kind of go away then come back](https://imgur.com/a/5wli65T)",,False,8,W08_2025-11-24_to_2025-11-30,2026-04-28T22:25:18.898904+00:00,2025-11-24 01:05:54+00:00,2025-11-24,2025-W47,,False,True,True
nqgmurl,1p53heq,AskDocs,t1_nqghliz,Rishiku,1763949693,[Sorry Imgur is being stupid apparently](https://ibb.co/3yjkFN4x),,False,8,W08_2025-11-24_to_2025-11-30,2026-04-28T22:25:18.898904+00:00,2025-11-24 02:01:33+00:00,2025-11-24,2025-W47,nqghliz,True,False,True
nu3ugbe,1pmuyro,AskDocs,t1_nu34e51,RockKandee,1765774525,"Agreed.  AI tried to tell me that Kurt Cobain voiced a character on a Simpsons episode in 1996.  Kinda hard to do that when you’ve already been dead 2 years.  If AI could mess up something as objectively factual as a date of death of a very famous person, what the hell can it accurately tell you about anything?",,False,11,W11_2025-12-15_to_2025-12-21,2026-04-28T22:25:18.898904+00:00,2025-12-15 04:55:25+00:00,2025-12-15,2025-W50,nu34e51,True,False,True
nu35qnj,1pmuyro,AskDocs,t1_nu354s1,RomulaFour,1765764890,And the bottle.,,False,11,W11_2025-12-15_to_2025-12-21,2026-04-28T22:25:18.898904+00:00,2025-12-15 02:14:50+00:00,2025-12-15,2025-W50,nu354s1,True,False,True
nlmd0au,1oh9mba,AskDocs,t3_1oh9mba,RoronoaZorro,1761556776,"...have you had an UTI before?  
Does this feel the same or different?",,False,4,W04_2025-10-27_to_2025-11-02,2026-04-28T22:25:18.898904+00:00,2025-10-27 09:19:36+00:00,2025-10-27,2025-W43,,False,True,True
nj7n91k,1o582ch,AskDocs,t3_1o582ch,Rosselman,1760324195,"Yeah, you have good reason to be frustrated. You are describing the absolute classic, textbook presentation of new-onset, uncontrolled diabetes, very likely progressing towards or already in a state of Diabetic Ketoacidosis. You have polydipsia, polyuria, and tell me if I’m right, but probably you also have weight loss.
I suspect you are developing LADA diabetes, a rare, slower, more gradual onset type of autoimmune diabetes. Ketones in urine are not normal.

Your plan to get a full insulin panel is correct, but the situation may be more urgent than that. I’d recommend you go to the ER if you are feeling at all unwell (nauseous, vomiting, have abdominal pain, are breathing rapidly, or feel confused or excessively drowsy). And I mean go immediately if you have any of those.",,False,2,W02_2025-10-13_to_2025-10-19,2026-04-28T22:25:18.898904+00:00,2025-10-13 02:56:35+00:00,2025-10-13,2025-W41,,False,True,True
nqgb1yw,1p52n51,AskDocs,t3_1p52n51,Rosselman,1763945310,"You’re fine. Bread mold is usually Penicillium or Aspergillus, both are decimated by stomach acid. Do not induce vomit, there’s no need to do that.",,False,8,W08_2025-11-24_to_2025-11-30,2026-04-28T22:25:18.898904+00:00,2025-11-24 00:48:30+00:00,2025-11-24,2025-W47,,False,True,True
nqgqrmm,1p52n51,AskDocs,t1_nqgp688,Rosselman,1763951164,"Not a problem. Penicillium doesn’t always produce penicillin, it has to meet certain criteria to induce production, and even if it did, the trace amounts wouldn’t trigger an allergic reaction, or only a mild one.",,False,8,W08_2025-11-24_to_2025-11-30,2026-04-28T22:25:18.898904+00:00,2025-11-24 02:26:04+00:00,2025-11-24,2025-W47,nqgp688,True,False,True
nsv1kaj,1pgxdfk,AskDocs,t3_1pgxdfk,Rosselman,1765156849,"Yeah, that’s something called anisocoria, and requires prompt medical evaluation. In the best of cases, you accidentally rubbed some medication in your eye, like the antihistamines, and it’ll pass. But it can also be the manifestation of a neurological condition and I wouldn’t risk it.",,False,10,W10_2025-12-08_to_2025-12-14,2026-04-28T22:25:18.898904+00:00,2025-12-08 01:20:49+00:00,2025-12-08,2025-W49,,False,True,True
nu3mjzu,1pmvzaa,AskDocs,t1_nu3kdf2,RoughPea7252,1765771267,For studying but when it wears off my mood drops and I have to take another one,,False,11,W11_2025-12-15_to_2025-12-21,2026-04-28T22:25:18.898904+00:00,2025-12-15 04:01:07+00:00,2025-12-15,2025-W50,nu3kdf2,True,False,True
nqhxrxm,1p54j9r,AskDocs,t1_nqh2r6b,RuntBananaforScale2,1763971705,Thank you so very much for your time and thoughtful answer. I hope you have a great evening.,,False,8,W08_2025-11-24_to_2025-11-30,2026-04-28T22:25:18.898904+00:00,2025-11-24 08:08:25+00:00,2025-11-24,2025-W47,nqh2r6b,True,False,True
nrmkiiy,1pau864,AskDocs,t3_1pau864,SMLgFlorality,1764547774,"https://preview.redd.it/kj5285wdih4g1.jpeg?width=3024&format=pjpg&auto=webp&s=559c259b254e9b0b8f06c0bce8b39d23f8332d5e

For people who want a picture",,False,9,W09_2025-12-01_to_2025-12-07,2026-04-28T22:25:18.898904+00:00,2025-12-01 00:09:34+00:00,2025-12-01,2025-W48,,False,True,True
nmszyye,1omvvo2,AskDocs,t1_nmsp1ot,Sashimiak,1762132358,Thank you!,,False,5,W05_2025-11-03_to_2025-11-09,2026-04-28T22:25:18.898904+00:00,2025-11-03 01:12:38+00:00,2025-11-03,2025-W44,nmsp1ot,True,False,True
no1azih,1oszxec,AskDocs,t3_1oszxec,Saturnine_sunshines,1762739252,Is this post too long?,,False,6,W06_2025-11-10_to_2025-11-16,2026-04-28T22:25:18.898904+00:00,2025-11-10 01:47:32+00:00,2025-11-10,2025-W45,,False,True,True
nro17ix,1pb4b9x,AskDocs,t1_nro0rxg,SauceCoveredSparrow,1764568165,"Absolutely agree, the moment it happens again straight to the er. Dont know the full story so I can’t judge but honestly getting real bad vibes.",,False,9,W09_2025-12-01_to_2025-12-07,2026-04-28T22:25:18.898904+00:00,2025-12-01 05:49:25+00:00,2025-12-01,2025-W48,nro0rxg,True,False,True
nkg80h5,1obdzuj,AskDocs,t1_nkg7ljo,SealToothNecklace,1760951072,"Forget those questions, call an ambulance immediately, they can answer your questions",,False,3,W03_2025-10-20_to_2025-10-26,2026-04-28T22:25:18.898904+00:00,2025-10-20 09:04:32+00:00,2025-10-20,2025-W42,nkg7ljo,True,False,True
nkg9km3,1obdzuj,AskDocs,t1_nkg9fat,SealToothNecklace,1760952556,Do what in a second? I really hope you don't mean pop those pills. Please talk to someone. Please.,,False,3,W03_2025-10-20_to_2025-10-26,2026-04-28T22:25:18.898904+00:00,2025-10-20 09:29:16+00:00,2025-10-20,2025-W42,nkg9fat,True,False,True
nkg9prw,1obdzuj,AskDocs,t1_nkg9m5d,SealToothNecklace,1760952726,"Yeah well that's the problem, best case scenario they kill you, however it's just as likely you have a seizure and get brain damage and become a vegetable for the rest of your life. That won't make anything better. Talking to someone will. Talk to me. Tell me what's happening. I want to hear from you.",,False,3,W03_2025-10-20_to_2025-10-26,2026-04-28T22:25:18.898904+00:00,2025-10-20 09:32:06+00:00,2025-10-20,2025-W42,nkg9m5d,True,False,True
np8h2kc,1oys4fs,AskDocs,t3_1oys4fs,Secure-Solution4312,1763338644,Call Poison Control 1-800-222-1222,,False,7,W07_2025-11-17_to_2025-11-23,2026-04-28T22:25:18.898904+00:00,2025-11-17 00:17:24+00:00,2025-11-17,2025-W46,,False,True,True
nu3cdcb,1pmtrer,AskDocs,t1_nu2ro7v,Shadoo_Knight,1765767318,"I haven’t thought about it, I didn’t think it was serious back then. Maybe I should see one.",,False,11,W11_2025-12-15_to_2025-12-21,2026-04-28T22:25:18.898904+00:00,2025-12-15 02:55:18+00:00,2025-12-15,2025-W50,nu2ro7v,True,False,True
nkfk3j2,1obauzr,AskDocs,t3_1obauzr,ShamelesslySimple,1760936044,"I’m sorry are you saying this happens to this exact same finger several times before? 

Do you work in a kitchen or with cleaner chemicals etc?",,False,3,W03_2025-10-20_to_2025-10-26,2026-04-28T22:25:18.898904+00:00,2025-10-20 04:54:04+00:00,2025-10-20,2025-W42,,False,True,True
nmtbvh4,1omvsif,AskDocs,t3_1omvsif,ShamelesslySimple,1762136689,Agree with ED visit. Hope all goes well.,,False,5,W05_2025-11-03_to_2025-11-09,2026-04-28T22:25:18.898904+00:00,2025-11-03 02:24:49+00:00,2025-11-03,2025-W44,,False,True,True
nmsyuh6,1omdujh,AskDocs,t1_nmsv9pg,Shanghighmonkkkkk,1762131941,Thank you. Could the coming from the bumps not indicate something else as well?,,False,5,W05_2025-11-03_to_2025-11-09,2026-04-28T22:25:18.898904+00:00,2025-11-03 01:05:41+00:00,2025-11-03,2025-W44,nmsv9pg,True,False,True
no1wcjg,1os84fp,AskDocs,t3_1os84fp,Sharp_Tumbleweed4628,1762747219,"Update: I went to the ER last night (finally) and they did a bunch of tests, and were very concerned. They didn’t find anything majorly wrong, except that my vision in that eye is basically shot right now. They referred me to both an ophthalmologist and a neurologist for more testing, and sent me home with pain meds. Would appreciate any insight in what could have happened ?",,False,6,W06_2025-11-10_to_2025-11-16,2026-04-28T22:25:18.898904+00:00,2025-11-10 04:00:19+00:00,2025-11-10,2025-W45,,False,True,True
no1y06r,1os84fp,AskDocs,t1_no1xnnv,Sharp_Tumbleweed4628,1762747896,"They did a bunch of eye exams to check for my eye pressure, and like damage to my eye. There was no damage to my eye that they saw. And they where like nothing wrong with eye go home. They never did a neuro exam, or like even cared about my headache. They where like here is pain meds and go home.",,False,6,W06_2025-11-10_to_2025-11-16,2026-04-28T22:25:18.898904+00:00,2025-11-10 04:11:36+00:00,2025-11-10,2025-W45,no1xnnv,True,False,True
no1yah5,1os84fp,AskDocs,t1_no1y4l9,Sharp_Tumbleweed4628,1762748012,"No. I had bad headache there to, and they where like here are pain meds and go home. My friend was like wtf, like they where like your eye looks fine go home.",,False,6,W06_2025-11-10_to_2025-11-16,2026-04-28T22:25:18.898904+00:00,2025-11-10 04:13:32+00:00,2025-11-10,2025-W45,no1y4l9,True,False,True
no1yq51,1os84fp,AskDocs,t1_no1yah5,Sharp_Tumbleweed4628,1762748192,The hospital didn’t have an ophthalmologist or neurologist on call too. I mean it’s a rural hospital in middle of know where so u don’t expect great care. The hospital once misdiagnosed my friend and she ended up have meningitis  ://,,False,6,W06_2025-11-10_to_2025-11-16,2026-04-28T22:25:18.898904+00:00,2025-11-10 04:16:32+00:00,2025-11-10,2025-W45,no1yah5,True,False,True
no1zwes,1os84fp,AskDocs,t1_no1ze9w,Sharp_Tumbleweed4628,1762748692,Yes lol - it is quite a interesting hospital lol,,False,6,W06_2025-11-10_to_2025-11-16,2026-04-28T22:25:18.898904+00:00,2025-11-10 04:24:52+00:00,2025-11-10,2025-W45,no1ze9w,True,False,True
no211kn,1os84fp,AskDocs,t1_no1zwes,Sharp_Tumbleweed4628,1762749192,"I am now just laying in bed with my ears ringing and a new headache, with a horrible cough and I am like nothing was really helped expect pain during that visit to the ER",,False,6,W06_2025-11-10_to_2025-11-16,2026-04-28T22:25:18.898904+00:00,2025-11-10 04:33:12+00:00,2025-11-10,2025-W45,no1zwes,True,False,True
nlleuw2,1oh3r7h,AskDocs,t3_1oh3r7h,ShrmpHvnNw,1761536604,"There isn’t a ton of interaction information with supplements overall.

From what I can find there isn’t any direct interactions, although Aloe Vera can interfere with absorption of medications, so separate when you take them by at least 2 hours before or after just to be safe.",,False,4,W04_2025-10-27_to_2025-11-02,2026-04-28T22:25:18.898904+00:00,2025-10-27 03:43:24+00:00,2025-10-27,2025-W43,,False,True,True
nqi28m4,1p54y1z,AskDocs,t3_1p54y1z,ShrmpHvnNw,1763974454,"So there are 2 interactions that get classified as major, the first is serotonin syndrome, at those doses (and frankly up to max doses) it would be extremely rare, at the doses you’re taking it wouldn’t be an issue.

The other is a possibility for a heart arrhythmia called prolonged QT.  This only shows up becuase the 2 individually can cause prolonged QT, so in theory the 2 together increase the risk.  The doses you are on it’s really not a risk, and in most cases it’s only theoretical.

You should be good to take both of them.",,False,8,W08_2025-11-24_to_2025-11-30,2026-04-28T22:25:18.898904+00:00,2025-11-24 08:54:14+00:00,2025-11-24,2025-W47,,False,True,True
nmtkauu,1omppam,AskDocs,t3_1omppam,Significant_Arm9650,1762139922,"Any chance his nap was shorter than usual (like it took him longer to fall asleep or he had an awake period in the middle)? Didn't sleep well last night? This sounds almost exactly like what my toddler and preschool aged kid do when the alarm goes off at the wrong moment in their sleep cycle. I don't find their behavior strange at all, as it mimics how I feel when I'm woken up and would prefer to still be sleeping.

The leg thing does sound a bit odd to me, but I would also not be particularly concerned unless both of these behaviors recur and/or cause significant distress or impairment to the child. If one of my patients were sharing this incident with me, I would be more curious about why they were so upset by the incident than I would be concerned for the child developmentally.",,False,5,W05_2025-11-03_to_2025-11-09,2026-04-28T22:25:18.898904+00:00,2025-11-03 03:18:42+00:00,2025-11-03,2025-W44,,False,True,True
nj81kjg,1o59mqg,AskDocs,t1_nj801c8,Silent_County9707,1760330739,How are you doing now?,,False,2,W02_2025-10-13_to_2025-10-19,2026-04-28T22:25:18.898904+00:00,2025-10-13 04:45:39+00:00,2025-10-13,2025-W41,nj801c8,True,False,True
nlmsew5,1oh9mba,AskDocs,t1_nlmomyr,Similar_Medium_5307,1761565133,Bladder infections can just get worse if not seen but the pain and the uncomfortable feeling is enough to make you want to go.,,False,4,W04_2025-10-27_to_2025-11-02,2026-04-28T22:25:18.898904+00:00,2025-10-27 11:38:53+00:00,2025-10-27,2025-W43,nlmomyr,True,False,True
nqhnw06,1p55bum,AskDocs,t3_1p55bum,Single_Principle_972,1763965971,"U/TheDuke-99 answered the first part of your question so perfectly it deserved a mic drop and the rest of us should just stfu!

However, I did want to respond to the second part of your question. The physicians on here have no way of knowing whether your Dad is going to wake up, honey, I’m really sorry. Without having any information as to his status (meaning the history of this event and what his diagnostic testing looks like), there simply is no way to answer you on that. I did spend a couple of decades as a cardiac nurse, though, and if what you are saying is that he is unconscious and has been since his heart attack, that would certainly be of great concern. Especially since he has a history of 2 prior events. He *may* have a very poor outcome, we simply don’t know.

I would encourage you however, to visit him if you are able to get there and if your Mom will let you. Since you are a minor, this might become a tricky situation. But let’s say there are no roadblocks to you being able to sit with him for a while: I strongly encourage you to do so. Go sit, hold his hand, and tell him the things that you would like to say to him just in case it’s your last opportunity to do so, I think your soul would feel lighter if you have the chance to speak to him from your heart about your relationship, and tell him that you love him.

Teenagers all over the world throughout history have given their parents a hard time. Using a little gentle humor: Fortunately, this isn’t “the thing” that gets us, or there wouldn’t be very many parents around! Your Dad knows this, and your Mom does too, when she’s not feeling overwhelmed and spiteful. I sincerely hope she apologizes for saying such a wicked thing to you, and I beg you to not let it eat at your mind. In the meantime, try to connect with your Dad just in case this is your last opportunity to do so.

Hugs.",,False,8,W08_2025-11-24_to_2025-11-30,2026-04-28T22:25:18.898904+00:00,2025-11-24 06:32:51+00:00,2025-11-24,2025-W47,,False,True,True
nsvj7kg,1pgwp6q,AskDocs,t1_nsves40,SkarbOna,1765163229,"Alcohol is cancerous and it’s basically a poison. Your brain craving it to be able to “have fun” is psychological problem on its own. It’s a shame there’s no healthy way for ppl to relax and have fun. But it’s your life, your brain, and your risk at the end so…good luck.",,False,10,W10_2025-12-08_to_2025-12-14,2026-04-28T22:25:18.898904+00:00,2025-12-08 03:07:09+00:00,2025-12-08,2025-W49,nsves40,True,False,True
nvcfkb5,1prxio0,AskDocs,t3_1prxio0,SnooCats7279,1766396146,"Thinks total speculation but it sounds like he likely coded as a result of that glucose, Presumably due to seizures that they weren’t able to control. Alcohol withdrawal seizures can be extreme and difficult to control if not taken care of quickly and appropriately. It’s easy to underdose those meds or not be aggressive enough. The blood glucose makes it a little difficult to discern the two as to can seize from low glucose and from alcohol withdrawal. It would be very easy to not notice the sugar right away because of the focus on the alcohol. Not saying this did happen but I could see how it would. Regardless of all the above, so very sorry for your loss.",,False,12,W12_2025-12-22_to_2025-12-28,2026-04-28T22:25:18.898904+00:00,2025-12-22 09:35:46+00:00,2025-12-22,2025-W51,,False,True,True
nlmomyr,1oh9mba,AskDocs,t1_nlmhsws,SnoopysRoof,1761563348,"Forgive my ignorance, but why would a bladder infection be urgent care? Just curious.",,False,4,W04_2025-10-27_to_2025-11-02,2026-04-28T22:25:18.898904+00:00,2025-10-27 11:09:08+00:00,2025-10-27,2025-W43,nlmhsws,True,False,True
nlmt3ky,1oh9mba,AskDocs,t1_nlmoy9w,SnoopysRoof,1761565439,"Oh wow, had no idea. Thank you.",,False,4,W04_2025-10-27_to_2025-11-02,2026-04-28T22:25:18.898904+00:00,2025-10-27 11:43:59+00:00,2025-10-27,2025-W43,nlmoy9w,True,False,True
nqhvbu4,1p5b1hs,AskDocs,t3_1p5b1hs,Snow_Queen87,1763970255,https://preview.redd.it/ltcjsyn7t53g1.jpeg?width=1179&format=pjpg&auto=webp&s=eaebf0211e53cf5774ecac8a5a9a7eeb82975cc4,,False,8,W08_2025-11-24_to_2025-11-30,2026-04-28T22:25:18.898904+00:00,2025-11-24 07:44:15+00:00,2025-11-24,2025-W47,,False,True,True
nsv0i96,1pgz30y,AskDocs,t3_1pgz30y,Soft-Orchid-9538,1765156456,"https://preview.redd.it/2ti36w3dsv5g1.jpeg?width=1206&format=pjpg&auto=webp&s=824c3c0f34eabe5ff0e36589b243a22f73cf8f87

Photo of inside his nose on the right side of",,False,10,W10_2025-12-08_to_2025-12-14,2026-04-28T22:25:18.898904+00:00,2025-12-08 01:14:16+00:00,2025-12-08,2025-W49,,False,True,True
ni06e78,1nz6niw,AskDocs,t1_ni05vp8,Some_Importance_2251,1759718579,"Thank you . Is it that people who do get it have extremely low sodium to begin with ?
Thank you ",,False,1,W01_2025-10-06_to_2025-10-12,2026-04-28T22:25:18.898904+00:00,2025-10-06 02:42:59+00:00,2025-10-06,2025-W40,ni05vp8,True,False,True
no1ab2g,1ot0gz4,AskDocs,t3_1ot0gz4,SpaceballsDoc,1762739004,"Report to:

Store Manager

Corporate

Provincial board 


Fucking pharmacists need to learn to stay in their lane. Got problems? Call the doc. Don’t antagonize the patient. Go to med school for that privilege.",,False,6,W06_2025-11-10_to_2025-11-16,2026-04-28T22:25:18.898904+00:00,2025-11-10 01:43:24+00:00,2025-11-10,2025-W45,,False,True,True
no1dz8w,1ot0gz4,AskDocs,t1_no1dg7r,SpaceballsDoc,1762740337,"I don’t mind if they called. But they don’t. They antagonize patients first and doctors never. 

Again, go to med school if you want to play doctor and dictate care plans. Either fill or refuse to fill - the lecturing and belittling that they give patients is insane. 

They’re not smart enough to know WHY things are prescribed. Yea. I went there. Knowing CYP450 interactions doesn’t make you clinically gifted.",,False,6,W06_2025-11-10_to_2025-11-16,2026-04-28T22:25:18.898904+00:00,2025-11-10 02:05:37+00:00,2025-11-10,2025-W45,no1dg7r,True,False,True
no1jrtz,1ot0gz4,AskDocs,t1_no1ifbg,SpaceballsDoc,1762742425,"I am a bastard. 

I’ll drive over to my hospitals scheduling department and hit them with a “you fucking what?” When I get told something can’t be done. 

Over the years I’ve earned my reputation as the doctor who will show up and be a piece of shit if I get told something that doesn’t pass the sniff test. 

My mouth has time for everyone even if I have a packed day.",,False,6,W06_2025-11-10_to_2025-11-16,2026-04-28T22:25:18.898904+00:00,2025-11-10 02:40:25+00:00,2025-11-10,2025-W45,no1ifbg,True,False,True
no1nrqb,1ot0gz4,AskDocs,t1_no1md2v,SpaceballsDoc,1762743889,I’m not allowed in Vegas due to…reasons,,False,6,W06_2025-11-10_to_2025-11-16,2026-04-28T22:25:18.898904+00:00,2025-11-10 03:04:49+00:00,2025-11-10,2025-W45,no1md2v,True,False,True
nrnjaeb,1pb1zvt,AskDocs,t3_1pb1zvt,SpaceballsDoc,1764560526,"DuoNebs aren’t first line for asthma rescue. It’s just Albuterol. 

Modern standards is using a combination inhaler as your rescuer and your controller. So I’d get one. Or piecemeal with albuterol and a ICS. Better results. Nebs should be truly last resort.",,False,9,W09_2025-12-01_to_2025-12-07,2026-04-28T22:25:18.898904+00:00,2025-12-01 03:42:06+00:00,2025-12-01,2025-W48,,False,True,True
nrnjih3,1pb28nr,AskDocs,t3_1pb28nr,SpaceballsDoc,1764560613,"Spine ortho. 

They do more in the spine than neurosurgeons ever will.",,False,9,W09_2025-12-01_to_2025-12-07,2026-04-28T22:25:18.898904+00:00,2025-12-01 03:43:33+00:00,2025-12-01,2025-W48,,False,True,True
