comment_id,post_id,subreddit,year_week,author,text
nqh7k1n,1p4qeer,askscience,2025-W47,Groomulch,"That is one idea that can not be proven, at this point nobody has anything but a guess. Some guesses are from a more educated point of view but still guesses. The current research is showing that the whole universe is spinning so what I imagine happening was a very large (galaxy sized) spinning black hole disintegrated. My guess is as likely as any."
nqi4vdy,1p4qeer,askscience,2025-W47,jeffjefforson,"Well we don't necessarily know that time began at that point.

The CMBR is the furthest back we can see, but it doesn't mean that nothing existed before that or that time didn't exist.

It's just where we usually set as 0 for the time axis since there's no way of us measuring anything that could have happened before that. Kind of how us only being able to see the ""observable"" universe doesn't mean there aren't more stars and galaxies beyond our observable horizon."
nqj3gk6,1p4qeer,askscience,2025-W47,teffarf,"He's not just talking about expansion, he's also talking about inflation. 

And afaik, inflation is a popular hypothesis that is unproven (I wouldn't go as far as saying unprovable though)."
nqjowi5,1p4qeer,askscience,2025-W47,dalnot,">The big bang didn’t start as a point

Well, it did… it’s just the everywhere was just a single point, according to the math"
nqk1jer,1p4qeer,askscience,2025-W47,sphafer,"Think of it like the spacetime between all matter is increasing at a certain rate. objects can move against this expanding spacetime to interact and orbit one another. But the fabric is increasing nonetheless. 
This means that the general trend of the universe is that distances will increase and it will become more sparse."
nqlghi5,1p51yua,askscience,2025-W47,deviantbono,"Is that still a ""central"" nervous system then?"
nqm8xtg,1p4qeer,askscience,2025-W47,commiecomrade,"This is what boggles my mind about it. I understand that all points of space are expanding and that the universe isn't expanding into anything. But surely there must be an ""edge"" at where you have gone so far in one direction that you can reach a galaxy at a point where all the others are behind you, no?

It isn't an edge where there is infinite more space matter doesn't occupy, nor is it a brick wall you'd slam into, but such a point would be reached. And if there is a bounded universe, there would be a ""center"" as well."
nqo341i,1p4qeer,askscience,2025-W47,DeathCIoud,"You're still assuming some things here. The universe has no shape or boundary that we know of. The actual distance the galaxies are apart is growing, while not traveling faster than light speed. You're also assuming an end to the scale of infinite in all directions. Or a possible finite amount of galaxies. 

I mean what if all the galaxies are headed in the same direction, and we suddenly find galaxies moving in the opposite direction, or what if we finally discover, using Ai, that all the local clusters of galaxies are actually revolving around something even bigger, but couldn't even tell that because of the scale of the universe."
nqqkjol,1p4qeer,askscience,2025-W47,Blokshibe,"The big bang is quite misunderstood. A lot of people think it means that there was nothing, that exposed and created our universe from an infinitesimal point. The big bang is a bit of a misnomer. What we know is that the universe is expanding, or that everything very far away is moving away from us. The further away we look, the faster it is moving away from us. If you run back the clock, that means that earlier in time, things were closer together, and if you go far back enough, this distance should reduce to zero. This point in time is about 13 billion years ago. But we don't know the actual real size of the universe. It could be extremely large and finite in size, but it could also be infinite, we don't know. We at least know that we can't see the edges of the universe, because everywhere we look, we can see so far back in time that we can see the afterglow of the 'big bang', the so called cosmic microwave background. Our eyes can't see this radiation, but during the night, everywhere you look that is dark (so everything that is not a star, galaxy, nebula, etc) , you're actually seeing the birth of our universe. I find that quite satisfying.

Note that I made quite some simplifications and assumptions, like not mentioning inflation, dark energy and acceleration of the expansion."
nrsklg1,1pb9jq8,askscience,2025-W48,Joshau-k,"It does according to the IAU definition - double planets aren't planets, rogue planets aren't planets, dwarf planets aren't planets. 


But the IAU definition is flawed and you don't have to recognize it


I prefer the geophysical definition ignores orbit. The main issue for most people is that our moon would likely be classed as a planet"
nrsvr6r,1pb9jq8,askscience,2025-W48,a_cute_epic_axis,">  I'm quite surprised that, as part of a 3-body (pluto, charon, sun) system, they remain stable in this configuration

But not surprised by the Earth, moon, and sun?"
nrt2xps,1pb9jq8,askscience,2025-W48,grahampositive,The earth and moon have much more different masses compared to Pluto and charon. The barycenter of the earth moon system is inside the earth.
nrtegdd,1pb9jq8,askscience,2025-W48,tashkiira,"Saturn has a couple of pairs of shepherd moons, so close that they might as well be in the same orbit.  They chase each other around the planet, and when the inner one catches up, it gets pulled faster by the outer moon, and the outer moon gets pulled back towards the inner moon, and they switch orbits, to do it all again.  but you're right, I don't think there are any examples of binary moons in the solar system--such an orbit would probably devolve into either a moon collision or a shepherd moon pair, depending on size."
nrtvwfs,1pbafk5,askscience,2025-W48,series-hybrid,"There is a big bump in usable power when water boils from a liquid to a gas, because the expansion is so great. However, once H2O is a gas, it can be heated more, called ""superheated steam"".

So, the short answer is...it costs a lot no matter what altitude you have the plant located. One of the biggest location concerns is that you need a LOT of water nearby, like a major river or the ocean."
nrujo9i,1p9zhqg,askscience,2025-W48,TapThatYak,"To put it simply, mutations can happen from a stressful environment, inbreeding, exposure to dangerous chemicals, radiation and, sometimes yes, random.

What's interesting is, some mutations have an unfortunate ability to pass down and sometimes depend whether you yourself are a male or female. The world is wild isn't it?!"
nrv2m84,1pbafk5,askscience,2025-W48,Squirrelking666,"Damn, yes.

Thinking about it the higher temps will result in uncondensed steam carry over to the condenser space which will result in higher pressure and thus degraded vacuum. I had it the wrong way round."
nsviu5b,1pgzycw,askscience,2025-W49,ellindsey,"The problem is that editing DNA with radiation is a bit like editing a book by shooting it with a shotgun. Sure, you make changes, but they're completely random and mostly destructive.

There have been deliberate projects where plant seeds were exposed to radiation and then germinated to see if any interesting new traits have developed. And there have been some interesting results, but only in a small and random fraction of the seeds treated."
nt0c0ts,1phn6xb,askscience,2025-W49,fixermark,"The term for it is the ""ergosphere"" (https://en.wikipedia.org/wiki/Ergosphere). I believe the Kurzgesagt YouTube channel also did a video on it.

The basic premise is you take advantage of the fact that a rotating black hole is doing a *hell* of a lot of relativistic frame-dragging to toss something at it and get that something back with more energy than you tossed it at (Kurzgesagt suggested you could use low-frequency light and get high-frequency light out). This does pull energy out of the black hole system, but the system has so much energy bundled up in it that a civilization really wouldn't have to care over a pretty long practical timespan."
nt0gngv,1ph1rdr,askscience,2025-W49,NotJimmy97,"Small note: the last paper you cite is from the University of Tennessee. It is just electronically housed on PubMed, a website provided by the NIH."
nt0t5v7,1ph1rdr,askscience,2025-W49,Alblaka,"> One last note for your last comment - we’ve lucked out (again) that most of the climate on earth is viable for human life, but not all.

I feel like the far more plausible explanation is that we've evolved exactly this way *because* it makes us capable of living in most of the climates on Earth. I mean, the very basic advantage of endothermic metabolism is exactly that the organism can adapt to more broad temperature condition, increasing odds of survival and ability to expand into more climate niches.

Earth didn't happen to fit our needs, we have those needs because everything else that had unfitting needs didn't make it."
nt0vuvd,1phqgb9,askscience,2025-W49,Black_Moons,"So organic content doesn't matter at all to clay being clay? 

For some reason, I was always under the impression that clay was very rich in organics (decaying plants, poop, etc)"
nt12u2z,1ph1rdr,askscience,2025-W49,Mutex70,"Obligatory:

""Imagine a puddle waking up one morning and thinking, ‘This is an interesting world I find myself in — an interesting hole I find myself in — fits me rather neatly, doesn't it? In fact it fits me staggeringly well, must have been made to have me in it!’"" 

- Douglas Adams"
nt9vo7b,1piyvjm,askscience,2025-W49,holsteiners,"After collecting 1.5 gig of data, images, and court documents, and interviewing 40 victims and family members,  I am confident that one particular family who victimized me, and others around the world with their gene, pass a psychopath gene to 50% of their progeny.  They all abuse drugs, and they severely traumatize the rest of the family members who have to grow up with them. They shoot at, bankrupt, and destroy the lives of everyone they touch, from classmates, to employers, to landlords, and combined with adderall induced paranoid rage, are obvious to me as the source of school shootings by young adult males who recently lost their (usually schoolmate) Adderall sources. The single worst thing our country ever did was to stop sterilizing them in the 1970s. There are now enough of them that they noticeably affect our economy, and have infiltrated all levels of society, including our president, crushing and snorting Adderall, which is also causing heart attacks in healthy 37 year old construction workers with no family history of heart issues. 

One of the family members started with a criminal record at age 7 by burning down his step mother's garage and spinning her 2 dogs by their tails. Every year after he turned 18, he accumulated another mug shot, until the web was no longer allowed to post them.  His mother and grandmother deftly avoid jail, but are absolute monsters with their path of destruction. Dozens of my friends and coworkers no longer rent out rooms or spare buildings because of the trauma renting to monsters like these. This gene, run rampant, is a major contributor to our housing crisis, with so many people removing housing options from bankrupting trauma experiences. 

How can we best structure a trial to prove that we need to sterilize psychopaths and remove their (and others') access to Adderall, resulting in a huge positive impact on our country's economy and health?"
ntau7ha,1piyvjm,askscience,2025-W49,asksrandomstuff,"What is your opinion on the widespread usage of psychotropic medications to treat ADHD and other psychiatric disorders in children, adolescents, and college-aged individuals?  Given your findings that the brain keeps maturing until age 25, does the benefit of using medications to regulate the maladaptive mood/behavior outweigh their potential risk to the developing brain?  

Are there specific stages in brain development where certain psychotropic medications should be avoided?"
nu7nxg1,1pmpuzp,askscience,2025-W50,susugam,"to be fair, almost anyone's would be wrong after 10 years, but it is hilarious to think that it was also wrong day 1."
nu7qoqa,1pn06e8,askscience,2025-W50,Vonneguts_Ghost,"The universe is set up with in a way that in keeps its scales separate for such a very long time.

The 'vacuum energy' or 'dark energy' that is driving expansion requires incredibly large distances to work. At scales smaller than galactic it holds virtually no sway whatsoever. 

Below the galactic scale, gravity is king. And pulls things together. There isn't enough empty space for the vacuum energy to push apart that which gravity would hold together. 

Interestingly, as you look at teeny tiny scales, you see the opposite, gravity has almost no effect at such tiny masses, and quantum forces dominate."
nu8fwjp,1pn3xej,askscience,2025-W50,ThirdSunRising,Yes it’s a lot like air speed vs ground speed except there’s no ground
nu8ucay,1pn3xej,askscience,2025-W50,primalbluewolf,"> I start both stopwatches at the same time. 


Well there's your first problem. You can't. Relativity reckons there is no such thing as simultaneity at a distance. There's no way to guarantee both stop watches are started at exactly the same time - moreover, special relativity suggests the very concept of ""the same time"" *doesn't actually exist* for observers that are separated by distance. 


> Since I know that speed of light is constant in any medium


Specifically, its the same in every reference frame. 


MM experiment attempted to do exactly what you proposed, back in 1887, and found results they couldn't initially explain. Similar experiments have been repeated since at greater and greater precision with the same outcome. Morley was convinced he just needed a better test setup, and its his efforts to disprove his original experimental results that have significantly improved our ability to measure accurately the speed of light. 


To whit; your results will calculate that your ship is stationary. "
nu8x3hu,1pn3xej,askscience,2025-W50,ProffS,"Yes, that's where my confusion lies.  You can fly west coast to east coast in 3.5 hours, but east coast to west coast takes 4 hours.   If ether was similar to wind, then it should be different depending on direction.   But a experiment based on the sum of both directions yields the average."
nu94kyj,1pn06e8,askscience,2025-W50,fuseboy,"Mostly no. The universe is expanding in the same way a crowd disperses: the people are all separating so it makes sense to talk about the crowd expanding, but the _humans_ aren't inflating, nor overcoming a local pressure to inflate that is just too weak to overcome their molecular bonds. They're not inflating at all.

Now, there is dark energy that is a small (but cumulatively very significant) part of this. We don't know what that is yet  as i understand, so we presumably don't know if it has a local effect as well as cosmological."
nua0gwx,1pn06e8,askscience,2025-W50,Aseyhe,"If you try to rescue some physical concept of ""space expanding"", indeed that leads to a lot of inappropriate complexity. The solution, as I've said, is that there is no physical concept of space expanding."
nua1xv0,1pmpuzp,askscience,2025-W50,SteveWin1234,"Funny you guys focus on the ""crystalline"" lens when most of the refractive power of the eye comes from the tear-air interface, which follows the shape of your cornea. The ""lens"" only accounts for roughly 1/3rd of the eye's focusing power. Many patients also don't have a crystalline lens at all, due to having cataract surgery or refractive lens exchange. 

But yeah, most eye docs aren't reaching for a calculator to get your glasses Rx. IOL calculations are a different matter."
nua4m6m,1pkjhsq,askscience,2025-W50,DrsofDoom1,"I think you might be asking if the baby can get an anti Rh antibody from exposure to the mother's Rh positive RBCs. To answer that question, the baby doesnt develop an immune response just quite yet in time to start becoming sensitized to the mother's blood which will be removed as the RBCs die off."
nua864m,1pn06e8,askscience,2025-W50,noplace_ioi,"Wait I thought gravitational force is universal, that even a small object on earth affects the furthest stars, is my assumption wrong or did I not understand you?"
nuaijf5,1pnj8n3,askscience,2025-W50,KJ6BWB,So big predators can have bright colors as long as their prey is colorblind to some extent?
nubuks5,1pn06e8,askscience,2025-W50,OverJohn,"The gravity of matter decelerates expansion. Imagine if you had a big ball of homogenous and isotropic massive particles, using Newtonian gravity,  a quick bit of integration shows you that the force on each particle is directly proportional to the radial coordinate and will decelerate the expansion of the ball of particles. If we let the radius of the ball go to infinity, the total Newtonian force becomes undefined as the integral is no longer absolutely convergent, but GR, being a local theory, can handle that.

Of course our observations strongly suggest expansion for the last few billion years have been accelerating, but this is easily explained by a homogenous and isotropic source with repulsive gravity. In GR a positive density source is repulsive if it has sufficient negative pressure, or more specifically:

c^(2)\*(density of dark energy) < -3\*(pressure of dark energy)"
nucf3y1,1pnj8n3,askscience,2025-W50,signalpath_mapper,"The feather part is pretty solid for a lot of theropods, but color is where things get fuzzy fast. We can infer some patterns from melanosomes in a few fossils, mostly blacks, browns, and reddish tones, but bright purples and greens need structural coloration and we have no direct evidence for that in non avian dinosaurs. Environment and display behavior matter too, and huge animals like adult T. rex probably had less plumage overall than smaller relatives. So Barney is fun, but the evidence points more toward muted, functional colors than full tropical bird vibes."
nvaaizr,1psj9ol,askscience,2025-W51,bdog143,"NSAIDs (ibuprofen and similar drugs) are usually associated with renal and GI toxicity rather than liver toxicity. Liver toxicity is the hallmark of paracetamol/acetaminophen, which is not an NSAID.

NSAIDs affect the kidneys through a couple of mechanisms:

1. NSAIDs block enzymes that produce prostaglandins, a proinflammatory signalling pathway. Prostaglandins play a role in controlling blood flow in the kidneys (or to be technically accurate, help to maintain flow of plasma in the glomerulus, the structures in the kidney that filters plasma from the blood, which will ultimately become urine). Blocking prostaglandin synthesis production can reduce plasma flow in the glomerulus, leading to a short-term reduction in renal function
2. NSAIDs can cause interstitial nephritis - an inflammatory immune response in the space around the nephron (the individual functional units in the kidney that turn the filtered plasma into urine). Depending on how severe the inflammation is (inflammation = swelling and movement of immune cells into the tissue), it can cause anything from temporary reduced function to permanent destruction.  At an organ level, the impact on function depends on how widespread and severe the inflammation is.

For paracetamol/acetaminophen, the liver damage is caused at a cellular/molecular level by a highly reactive toxic intermediate (NAPQI) that is formed during metabolic breakdown of the drug.  At normal doses, only a small amount of of NAPQI is formed and the liver  is able to immediately neutralise it by linking it to an antioxidant compound called glutathione. At high doses, the amount of NAPQI formed exceeds liver cells ability to detoxify it (they run out of glutathione), and free NAPQI accumulates and reacts with important enzymes instead. Unless there is timely intervention with acetylcysteine, the destruction of vital enzymes eventually causes cell death, ultimately leading to irreversible liver failure."
nvdl66u,1psj9ol,askscience,2025-W51,FollowingTough6500,"14 days and up to 1200mg is short term, safe dosage.

This changes of course depending on diagnosis etc.

But without further information that would be an information you get from a pharmacist."
nvdsvov,1ps6nlb,askscience,2025-W51,signalpath_mapper,"There is not really a single light switch moment you can point to. As a gas cloud collapses, the core heats up gradually and fusion reactions start trickling in before they dominate the energy output. For a while the object is still mostly powered by gravitational contraction, so fusion turning on does not cause a sudden flare you would notice from far away. From the outside the brightness changes slowly over thousands to millions of years, not seconds or days. By the time it looks like a stable star, fusion has already been ramping up quietly for a long time. This is why we talk about protostars and pre main sequence phases instead of a clean ignition event."
nvkxgb7,1pstd4o,askscience,2025-W51,444cml,"What you stumbled on was likely a meme or pop science article (there is seldom a difference) about how genome size generally doesn’t correlate with organism complexity. This is called the c value paradox. 

In these instances, it’s likely recoded as #of basepairs per cell/genome 

There are many possible explanations for this (polyploids are common in both plants and fish, ervs and transposons and other noncoding elements), but ultimately genome size is generally uninformative, and other commenters analogizing it to the weight of a car are making a decent comparison. I will note that the weight of a car tends to have more functional utility than the “size” of a genome"
nvm6ufr,1ptfy8j,askscience,2025-W51,noodlyman,"A lot of the things DNA does is to do with regulation. Genes can be turned on or off in response to all sorts of things sometimes a simple response to a thing being present or absent, and sometimes incredibly complex cascades and webs of regulation. 

So in this case, I don't know the details, but we could guess that physical damage to skin results in the release of some chemical which somehow results in more keratin by turning up the knob on genes involved in it's production, or in cells sticking together more.. I'm only guessing the exact details of your example."
nvmvkq9,1pu20gm,askscience,2025-W51,horsetuna,"I follow several snake catchers on YouTube and they all will say that venomous snakes are usually loathe to actually bite and inject. 

They will strike the air as a warning, nose punch (essentially closed mouth strike), and some will nip before they go all the way, or bite and release before the full dose goes in.  Plus all the other warning signs like hissing, hooding, rattling... 

But not always and giving them a respectful distance is always the safest way to avoid being bit.  

Venom as you said, takes energy to make and if a snake uses it on you it may not have it for something more important later."
nvn08p4,1pu20gm,askscience,2025-W51,DangerBlack,"rats are very difficult to kill, and can adapt very fast to poison. so probably this is the reason!"
nvn756w,1pu20gm,askscience,2025-W51,horsetuna,I know the lack of motor control has been debunked. Not sure about the second.
nvp2mxu,1pu20gm,askscience,2025-W51,Baguetterekt,"Yeah, you're saying the reason why the taipan is deadlier than you think it should be is random selection. 

Splitting hairs about how much you think is necessary and how much is best explained by pure random chance is irrelevant to my criticism.

I'm trying to explain tangible and real reasons why being deadlier than the minimum to quickly kill prey can be beneficial and you're just ignoring all that because you just think I'm ""moving the bar around""."
nvpb8mb,1pu20gm,askscience,2025-W51,ansible,"Yes. To the OP's original question, it is more important that the venom be deadly to the target prey, than necessarily humans. 


And secondarily for defense against likely predators of the snake."
nvqiye9,1pu20gm,askscience,2025-W51,rufuckingkidding,"I would argue that venom is not the defensive weapon we’re giving it credit for here. The strike is the deterrent, as it is with non venomous snakes. Venomous snakes most often die from predation before their venom could have been a benefit. Camouflage, and stealth are the snake’s primary defenses. 

The venom itself I just a good way to get prey without being harmed in a prolonged fight…so it doesn’t need to be any more powerful."
