comment_id,post_id,subreddit,year_week,author,text
ni4ixyx,1nzk1tr,askscience,2025-W40,Vizth,People without a full 1 atmosphere on the inside are the reason we have midgets.
ni4rhk6,1nzk1tr,askscience,2025-W40,Hufschmid,"We aren't crushed because we're at equilibrium with the pressure of the air. Our bodies compensate for this, this is why your ears pop when you move to a higher or lower elevation and the air pressure changes.

Imagine an empty bottle with a closed lid. Inside the bottle and outside the bottle is 1 atmosphere of pressure and so nothing happens because pressure on the outside of the bottle and on the inside of the bottle are equal and opposite, effectively canceling out. 

Now move that closed bottle to the bottom of the ocean. The inside of the bottle is still 1 atmosphere of pressure, but outside is an enormous amount of pressure, and so the bottle is crushed. Now, if you simply open the bottle before moving it to the bottom of the ocean, water fills in and the pressure inside the bottle will stay equal to the pressure outside the bottle as it goes down and the bottle will not be crushed. 
 
So being crushed by the pressure of a fluid depends more on the difference in pressure between the inside and outside of something than it does the total force present. 

If you suddenly change pressure very bad things can happen - scuba divers have to plan for this and be careful to not return to the surface too quickly, and avoid flying in an airplane for a certain amount of time after diving. 

So you're not going to be crushed by changes in atmospheric air pressure, but you can be seriously injured or killed in certain cases if you experience rapid pressure changes. 

At the end of the day, there's not really enough force from air to crush someone. A liter of water is 1kg, and a liter of air is about 1.3 grams, so water is about 1000x more dense. Water pressure can absolutely crush a person or worse."
ni4tzvy,1nzk1tr,askscience,2025-W40,Sohn_Jalston_Raul,"your internal pressure inside your body balances against the external pressure from the atmosphere above. Same reason deep-sea fish don't get crushed by the million tons of water pressing down on them. And just like if you pulled a deep-sea fish to the surface too fast, you'd get hurt if you were suddenly exposed to a vacuum."
ni5cmgb,1nzk1tr,askscience,2025-W40,nocRAGE,"What really blows your mind is when you realize vacuum cleaners don’t actually ‘suck’ dirt and air in, its the atmosphere pushing into the vacuum cleaner the try to equalize the lower pressure inside the vacuum."
ni5cwm3,1nzk1tr,askscience,2025-W40,fliberdygibits,Because we've evolved not to.  Just like certain deep sea fish who are fine at dozens of atmospheres (more?) but if they are brought up to sea level it can kill them because their bodies are so used to pushing back against the crushing pressure.
ni5jxbx,1nzk1tr,askscience,2025-W40,jawshoeaw,and if you go up about 6 kilometers most of the air is gone. it’s almost all down low
ni7ypr7,1nzk1tr,askscience,2025-W40,Jazzlike-Sky-6012,This was a autocorrect weirdness i am afraid. Never meant to insult anyone.
ni825zs,1o09tql,askscience,2025-W40,electric_ionland,Most helicopters don't fly as high as airliners so they are not pressurized. Pressurized aircraft need to be stronger to resist the pressure and can't have large fragile windows.
ni8go44,1nzk1tr,askscience,2025-W40,YamahaRyoko,"I like to explain this using the pop can analogy

An empty pop can doesn't get crushed by atmosphere because its the same inside and out

However, if you suck all the air out of the pop can, it will implode from pressure on the outside"
niaxctm,1nzk1tr,askscience,2025-W40,Riseonfire,"I always say we’re like fish in an invisible ocean. 

More like lobsters at the bottom,  it still. We’re IN the atmosphere."
nj7zcq0,1o3fczz,askscience,2025-W41,Double-Lemon3021,"A guy in my lab created cancer cells from mouse cells and we would inject them directly into the mice. This way the mouse's immune system didn't recognize the cells as foreign. We were able to study how the immune system would recreate when we treat the cancer with different drugs. 

I would culture the cells in dishes and mix them with a gel to keep the cells clumped together. Then I'd knock the mice out with anesthesia, create an incision, and inject the cells into their lungs to mimic lung cancer. Let the cells grow for a week or two and they'd have tumors we'd then treat."
nja9he2,1o3w91f,askscience,2025-W41,jetpacksforall,"You can easily see it in real life. Watch ants in the rain - water is completely different for ants than it is for us. To us water is insubstantial, we move theough it fairly easily, it rolls off our back etc. For ants, a raindrop is a huge glob of sticky stuff that they can get trapped in. They can’t just walk through water, they have to walk around it or moonwalk over it or risk getting stuck. 

The reason is that surface tension, van der waals forces and other quantum properties of H2O molecules create a slightly elastic, slightly adhesive effect at the water-air surface and in contact with other surfaces - including ants’ feet. Surface tension can be described as the tendency of a liquid’s surface to shrink into the minumum possible surface area. Also, water has viscosity. At the size of a human being these properties of water are negligible and most of will never have to worry about getting trapped in a water droplet like tiny ants. 

So even in daily life you can see examples of physics behaving differently at different scales. 

> The viscosity of water is approximately 1.002 mPa·s (millipascal-seconds). This value decreases as temperature increases, meaning hot water is less viscous (flows more easily) than cold water."
njaf2ca,1o5bows,askscience,2025-W41,nerdguy1138,You don't dream in a coma? Have we confirmed that?
njhhcqv,1o5bows,askscience,2025-W41,redstoneman877,Do you at least have the name?
njlsr60,1o5bows,askscience,2025-W41,Catqueen25,"One can, but it’s most often seen in long term comas. 

My own coma experience was a medically induced coma so I could be placed on a ventilator. I got super sick from whooping cough, most likely caught from a cousins kid. My situation scared the antivax out of her at least. 

The confusion is unreal. There were moments when I didn’t recognize my own family. My days got mixed up. I’m told I threw a fit over Thursday, not Tuesday, being the day after Wednesday."
njm2ba1,1o6z2ss,askscience,2025-W41,BluetoothXIII,"but those had quite some time to form compared to all the others. you example had a lot of time ""at an extremely slow rate over the course of at least 500,000 years, forming the enormous crystals found today""

under ideal circunstances any mineral crystal can reach quite the astonishing size. but keeping the conditions ideal is a science in itself, some happen natural under the right circnstances, but those are rare."
njpjhhe,1o7hqqi,askscience,2025-W41,SignalDifficult5061,"As others have said, it just varies too wildly for a definitive answer.    There just isn't a definitive answer to that at all, and it isn't possible.  You have to go look up each virus and the mode of infection.  
  
 Like, how man years does it take for mountains to become topologically flat.    Which mountains, when where?   Some ranges last a couple millions years, some have been around for over a billion (like the Appalachains).   There just isn't a way to answer your question that will satisfy you and the person that answers your question.   I'm very sorry.  
  
  Even for the same virus a different strain/hanful of mutations could very by orders of magnitude.

Anyway, it sounds like you had an exposure with HIV,  so you could read something like this:

[https://pubmed.ncbi.nlm.nih.gov/19948896/](https://pubmed.ncbi.nlm.nih.gov/19948896/)"
nkn8jb2,1oc7bet,askscience,2025-W42,CleanYeastFounder,"It does affect things in a few ways. Firstly, govt. funding is a key source of early capital for start-ups, as are scale up grants and loans. With targeted support this can make a big difference. It also sets the tone sometimes for what investors want to invest in, as they believe there will be govt. support for the product / service in the future. The UK has a pretty good track record of demonstrating that there is support for certain key areas and supporting start-ups in those areas (food tech, AI, biomaterials)

However, if you are addressing a real problem with your technology, such as not just making something more sustainable but cheaper, or just plain better or addressing real food shortages – then the political noise above this foundation doesn’t matter as much, the consumer will choose your products, as you are genuinely solving a problem they recognise, and investment will follow.  

I think it is a lot about really being very honest with yourself about your process and product, and making sure it is solving an issue that people are really having and understanding they are having. For example, creating easy quick foods, which are far less processed, would only be impactful if people are truly linking processed food to their health problems.

The good news is that in my experience you tend to have a whole host of benefits to creating novel sustainable tech, maybe it reduces energy usage as well, is better for the engine of the car, is a more readily available source of a favourite food, whatever it is, if it solves a problem, people and investment will follow."
nkqobuz,1od0145,askscience,2025-W42,electric_ionland,It's 0. The force applied by gravity is counteracted by the ground.
nkrddl6,1oc9h4r,askscience,2025-W42,piejesus,"Same basic principle yes, but with your own, or donated, healthy harvested bone marrow stem cells rather than genetically modified cells."
nkt8tqu,1oc18hp,askscience,2025-W42,FrakNutz,"O- is 6.6% of the population including me and my kids. O- is the Universal Donor, nearly everybody can take our blood and it's always in need. If that includes you, please donate regularly. Even if it's not your type, please donate."
nllbz18,1oe1yxq,askscience,2025-W43,just_in_before,"IMO -there are a lot of overly complicated replies here.

1. Anything that your body cannot digest is going to provide negative calories, simply due to the effort of moving it through your body and it taking some of your body temperature.  
2. Anything that contains bacteria (probiotic) or increases your bacteria populations (prebiotic) - will rob you of calories, because they will steal calories from other things you eat.

Lactulose is probably the most simple compound for you to start with..."
nlnfbxy,1ogqo80,askscience,2025-W43,the_honest_asshole,"Well, that block of text you typed was entirely discounted in my mind. Ypu sounded like you knew what ypu were talking about, but nicotine..... yeah not even remotely an issue."
nlnsprg,1oh9or7,askscience,2025-W43,IllBiteYourLegsOff,Might want to add for the uninitiated that gauge works backwards ie smaller gauge number means bigger needle 
nlo7b7x,1ogqo80,askscience,2025-W43,wasmic,"Why would it? Kosher meat is just a matter of what animal it comes from, and in what manner it has been slaughtered. The difference is spiritual, not material. It offers no health benefits.


A rib-eye steak will, on average, contain the same compounds in the same amounts regardless of whether it is kosher or not."
nlo8m5r,1ogqo80,askscience,2025-W43,Chaos_Slug,"Afaik, the classification you are mentioning does not tell us how ""potent"" a carcinogenic is, but how sure we are that it is indeed carcinogenic. 

Sunlight in in group 1. Of course, that does not mean everyone who goes outside during the day will have cancer, just that we are 100% sure that UV light can indeed cause cancer.

So, the classification of red meat (or anything else) on that scale is not saying how high the risk of getting cancer is. Just how sure we are that red meat consumption could increase the chance of getting cancer."
nloaqnv,1ogqo80,askscience,2025-W43,chatte__lunatique,"Yes, and the other person was saying that em dashes aren't necessarily indicative of AI. I def use them sometimes. I do agree that that reply was AI tho, for the reasons you stated"
nlohx4k,1ogqo80,askscience,2025-W43,Cuff_,"“How is it that something we’ve been eating for millennia has been possibly killing us the whole time?”

As some have said the dose makes the poison. For thousands of years meat was only eaten on occasion and was relatively hard to come by. Meat was hard to preserve and hunts often went unsuccessful. What was a stable income of calories were the fruits, nuts, and root vegetables that could be harvested reliably daily that made up the bulk of what humans were eating.

Also, evolution does not care for longevity as much as it cares for results. A human can easily live 30 years eating carcinogenic foods while being able to produce several offspring which is all evolution cares about. We evolved the ability to eat meat, which most other animals in our lineage did not, so we have another option for calorie intake - that has nothing to do with whether or not it’s good for us."
nlp03m0,1ogqo80,askscience,2025-W43,kwibu,I'm from the Netherlands. We do have big meat eaters here but it's not the norm to eat massive steaks. Too expensive here 😂
nlpbbdd,1ogqo80,askscience,2025-W43,Youknowimtheman,"There's different opinions on the definition. ""Processed"" can mean anything from ratios of fats, sugars, etc or it can be as narrow as containing certain additives and preservatives. 

Often it's muddy.

Side note as someone who has been trying to reduce processed foods in their diet: I've recently learned that now that some preservatives are getting bad press, companies are using ""natural"" methods to get the same chemicals in the food and calling them preservative-free and even nitrate-free (in the states.)

So instead of adding nitrates to jerky, bacon, pepperoni or ham, you boil down a vegetable juice that contains small amounts of the same substance into a concentrate and put that in the food. Boom. ""Nitrate-free"" ""Plant derived preservatives"" ""uncured"" (Even though it literally is still nitrates.)

[https://www.webmd.com/diet/foods-high-in-nitrates](https://www.webmd.com/diet/foods-high-in-nitrates)

It contains the same amount of the same bad stuff. The ingredients that prevent nitrates in vegetables from creating the nitrosamines that give you cancer are removed and it's just nitrates derived from plants instead of synthesized.

Watch out for ""celery juice"" ""celery powder"" ""celery extract."" The same methods are use parsley, beets, kale and arugula. Radishes and carrots are can also be used this way but I haven't seen in a product in the wild as a concentrated preservative yet.

If it is a food that is typically highly processed, calls itself ""uncured"", ""preservative-free"" or ""nitrate free"", and it has a shelf life longer than three weeks (ESPECIALLY without refrigeration). Be suspicious and check the packaging.

More references:

[https://www.health.harvard.edu/heart-health/nitrates-in-food-and-medicine-whats-the-story](https://www.health.harvard.edu/heart-health/nitrates-in-food-and-medicine-whats-the-story)

[https://health.clevelandclinic.org/what-are-nitrates](https://health.clevelandclinic.org/what-are-nitrates)"
nlpr5mf,1ohhjkt,askscience,2025-W43,Kolbin8tor,"It doesn’t have as much to do with your distance to each other as it does your speed relative to each other. 

Your watch on the spaceship would *appear* to be ticking at the speed you are accustomed to, but in reality, relative to earth, it would be ticking much slower. Time is a river and at relativistic speeds you move through the river more slowly, because the speed of light must be constant for all observers. That is the rule that Einstein discovered.

Speed through space changes speed through time because the speed of light in a vacuum is an immutable constant. In order for that to be true, the speed of time must fluctuate (and it does, wildly, the closer you get to C). 

It is, literally, time travel in the forward direction. It fundamentally doesn’t make intuitive sense, but that is how it do."
nlq8mo8,1ogqo80,askscience,2025-W43,Erathen,">It includes leather, ginger, and sawdust.

Huh? Ginger isn't a carcinogen lol

And by leather I assume you mean inhaled leather dust"
nlqpk0f,1ohhjkt,askscience,2025-W43,mfb-,"For you, time always passes at 1 second per second. What else could happen?

You only get time dilation if you watch something that's moving fast relative to you. We see time on the spacecraft go slower, the spacecraft sees our time go slower. Doesn't matter how the spacecraft got there."
nmx1kox,1omogx8,askscience,2025-W44,ksriram,"The relative position of stars don't change. You can think of all stars stuck on a big sphere in the sky. We are at the centre of that sphere and the only thing that happens is the rotation of this sphere. This makes tracking the stars quite easy. This sphere is called the celestial sphere.


This works because all the stars are too far away. Hence any motion that they may have is negligible compared to that. The only reason the celestial sphere rotates is because the Earth rotates on its axis.


There is a class of objects which are harder to track. These are the planets. Since they are so close to us, there position does change relative to other stars. There are entire systems of astrology dedicated to tracking these planets."
nn1z5us,1ont9ca,askscience,2025-W44,Thismyrealnameisit,"2600km is a lot more than I imagined in my head, but then again the earth is substantially large and 23 degrees is a lot. I have fallen off hills that steep."
nn912xp,1oowaow,askscience,2025-W44,its_a_me_andy,"There's a launch site in Norway, how does that work out when it's so far from the equator?"
nn963sz,1oowaow,askscience,2025-W44,AlbaneinCowboy,UAF in Fairbanks has a rocket launch facility like that called Poker Flats. They send up rockets to study the Aurora.
nobirz1,1otq9qr,askscience,2025-W45,umd-science,"(Nirupam) There are some relationships between them. For instance, some of the generative techniques attempt to reduce the error between its output and the real contents. A family of detection techniques can rely on this error to detect fake content. However, the available generative techniques and detection measures are too diverse to have any necessary correlation between them."
noboud2,1otq9qr,askscience,2025-W45,truth14ful,"1. Since deepfakes can be used for bullying and harassment even if they're known to be fakes, are you concerned that verifying an image or video's provenance isn't enough to stop the threat of harm from them? Do you see any viable means of making it harder to generate deepfakes to begin with, like maybe a Nightshade-like system of poisoning datasets?

2. Now that the amount of good training data available has become a limiting factor in training new models, are there some new sources that companies are exploring to get the data they need? I always suspected that was why everyone was recently pushing VR headsets, which fortunately (mostly) never caught on. What's next after that?

Thanks for the work you do! We need more people doing it"
nocqvb2,1ou8u9u,askscience,2025-W45,rabbledabble,"For the same reason that some medications ONLY work as injections. Some medications can be destroyed by your stomach acids and must be injected into your body (usually either intramuscular or intravenous, but there are other types). Conversely, and to answer your question, some drugs could damage your vascular or muscle tissue by being directly injected and need to be absorbed by your digestive tract first or need to be metabolized in some way before absorption (some “prodrugs” for example). 

The reason many drugs aren’t made into injectables is far more pedestrian however, in that most pill mediations are tough enough to survive the stomach and still be effective, and pills are far easier to administer to people safely than any type of injection, and people can be more or less entrusted to take them safely on their own without medical supervision. "
noddyq1,1oq7xl9,askscience,2025-W45,Fun-Hat6813,Yeah so we can measure the cosmic microwave background radiation and it shows we're moving about 370 km/s relative to it.. mostly towards the constellation Leo i think. But that's just our motion relative to the CMB reference frame - there's no way to know if the entire observable universe is moving within something larger since we can't see beyond what's observable to us.
nodw6um,1otx6m8,askscience,2025-W45,KriosDaNarwal,How is it i can never get sunburned?
noe9tfh,1otx6m8,askscience,2025-W45,speciesR48,They also eat their own feces to reintroduce bacteria back into their gut.
nok494e,1ov0wxc,askscience,2025-W45,s-haddock,"Interesting way to look at it — usually people think of it as an evolutionary long shot rather than inevitable.
I do agree it is easier to evolve than one would predict, based on the number of times it has convergently appeared, even multiple times apparently independently in the same lineage, as with ostracods.  However it is still pretty special and takes the right mix of evolutionary opportunity and selective pressure. The ocean has a lot of properties that make it suited to bioluminescence more than other low-light environments.  Even in caves on land, I only can think of one luminous species (glow worms) that uses it for predation. Why are there no luminous mammals, herps, amphibians, birds, or plants?  
It is fun to think about and I appreciate your “flipped” point of view.  
—- 
About the spectral distortion, we don’t really have an issue with measuring the spectra, but certainly it is hard to take photos or decent videos of dim, moving, transient light sources. Some of the pics in the book are long exposures of stationary organisms, and a few are frame grabs of moving animals extracted from 4k videos, some even taken with our submersibles in the deep sea. Fortunately camera technology has improved significantly in recent years, offering us resolution, color, and sensitivity unlike ever before."
nol8pxu,1ovt218,askscience,2025-W45,Esc777,"Cameras are sensitive to light frequencies beyond the frequencies are retinas are sensitive to. 

A classic example is some near infrared. For a long time you could see TV remote LEDs with a digital camera. 

I would not be surprised that modern cellphones do a lot of trickery to see things in low light, such as infer images from infrared to build a low light picture as if it was in light. But even if it isn’t, it would be par for the course for the cameras to see beyond our vision. "
npg81y7,1ozs5kc,askscience,2025-W46,stevevdvkpe,"Deuterium is preferentially consumed in the proton-proton chain (the most basic form of hydrogen fusion).  Alpha particles are frequently produced by photodisintegration so they are abundant when heavier nuclei and higher temperatures are present, and of course plenty of 4He can still be around from earlier proton-proton chain and CNO cycle hydrogen fusion.  Photodisintegration also largely prevents production of nuclei heavier than 56Ni.

The Wikipedia article can explain this more accurately and in more detail than I can:

[https://en.wikipedia.org/wiki/Silicon-burning\_process](https://en.wikipedia.org/wiki/Silicon-burning_process)"
npiwq0f,1ozpcir,askscience,2025-W46,naptastic,"that sounds like a plausible plotline for an episode of Red Dwarf, maybe..."
npkhoik,1oznlnt,askscience,2025-W46,vctrmldrw,"We have a sample size of one for how life can work. So, it is impossible to know in what other ways it might work.

Logically, some mechanism to preserve and replicate data would seem necessary for self-reproducing life. Some way to vary it would be necessary for evolution. But whether this is the only feasible mechanism is hard to know without discovering another."
nplm5e2,1ozpcir,askscience,2025-W46,Empty-Exam-5594,"Yes.... But. 


While we have found some organisms that can survive relatively high radiation (both man-made sources on Earth and in near-Earth space environments), we are talking many orders of magnitude higher near red dwarf stars: we have never found life in those environments because we can't even make them here on Earth."
npogm8c,1ozpcir,askscience,2025-W46,Mouse-Keyboard,Would it also be more difficult for an organism to survive being 'thrown in at the deep end' than starting in a low radiation area and then evolving to move gradually closer to a high radiation area?
npq1q4p,1p19xul,askscience,2025-W46,justinhieno,Cramp is caused by an excess of lactate in the muscle. Lactate is formed when not enough oxygen is available to metabolize glucose.
nqh5udt,1p4qeer,askscience,2025-W47,occurious,"The tunnel diagram can be confusing.

Instead, think about a partially inflated balloon. Using a marker, make two dots.  Now inflate the balloon more. 

The dots move farther apart.  But the dots themselves haven’t moved.  The balloon expanded. 

The balloon is spacetime and the dots are galaxies. 

All points in the universe are always expanding.  The further away a galaxy is, the more points there are, and therefore more expansion.  From our perspective the further away a galaxy is the faster it is moving away from us. 

The mind-bending bit is that means that there is a distance at which we stop being able to see anything at all because everything beyond it is moving away from us faster than light.  That distance decreases over time as other galaxies get farther away.  The observable universe is shrinking."
