comment_id,post_id,subreddit,year_week,author,text
nhzhf50,1nywi6y,todayilearned,2025-W40,CarlJustCarl,Avg height and BMI?  Weight means nothing without one of those other two.
nhzhm0g,1nywi6y,todayilearned,2025-W40,Chortney,Crazy that at my heaviest I wasn't even at the US average lol. Now I'm ~140-150 so I stick out in Alabama
nhzidol,1nywi6y,todayilearned,2025-W40,flyover_liberal,Woo!  I'm above average!
nhzjyvd,1nyym8r,todayilearned,2025-W40,sassergaf,CNN opt out for tracking requires you to give them your email address. Wth
nhzkew8,1nywi6y,todayilearned,2025-W40,AlbertaAcreageBoy,"Wow, I've been 175 since I've been like 16 at 6'."
nhzl7ur,1nyue1w,todayilearned,2025-W40,sadcheeseballs,"I always like to remind people that a huge percentage of the great pacific garbage patch is fishing waste— for instance, large nets. The solution involves better reduction of waste getting into waterways (mostly in a handful of nations) but also reformed sea fishing rules and accountability."
nj6w0lr,1o546ls,todayilearned,2025-W41,aaron_judgement,JD Vance will be #5. Democrats offer nothing to the average voter
nj6w7yl,1o53s0f,todayilearned,2025-W41,chathrowaway67,"""private... Did you just pass me without a belly rub??"""
nj6wedq,ojt22,todayilearned,2025-W41,Odd-Idea9151,i know this is 13 years old but he was 18 and she was 14. literally a child. so gross
nj6wgjo,1o53s0f,todayilearned,2025-W41,gumboking,Most of those dogs are Belgian Malinois. You better give them respect! They can outdo you on any non written category.
nj6wolp,1o53jwb,todayilearned,2025-W41,ShyElf,Most estimates of have marine primary production at closer to <50%>(https://oceanservice.noaa.gov/facts/ocean-oxygen.html).
nj6xb61,1o53jwb,todayilearned,2025-W41,___daddy69___,this doesn’t seem that shocking when 70% of the earth is water
nj6y6lq,1o4u1pk,todayilearned,2025-W41,Lensmaster75,They will jail someone for an internet post over there but this attempted homicide is just two year break from the plane WTF
nj6ye2z,1o546ls,todayilearned,2025-W41,Al_Tilly_the_Bum,What exactly does the GOP offer? Cutting healthcare and tax cuts for billionaires?
nj6ysgk,1o557m3,todayilearned,2025-W41,hotelrwandasykes,"3. French Broad River, Tennessee
4. New River (lol), West Virginia
5. Susquehanna River, Pennsylvania

Estimated between 200- 340 million years old. The Susquehanna at 444 miles is the longest river that drains into the US east coast, and offers excellent chill kayaking around Harrisburg."
nj6z24f,1o557m3,todayilearned,2025-W41,tidymaze,"The Appalachian mountains are older than fossils. Seriously, there are no fossils in those rocks. They also share the same composition as the Scottish highlands."
nj6zat9,1o54yiq,todayilearned,2025-W41,SirBananaOrngeCumber,"Indeed, an interlanguage pun!"
nj6zaws,1o4p4v2,todayilearned,2025-W41,Ok-disaster2022,"There were also secret landings well ahead of the invasion to take sand samples to figure out the load bearing of the sand for beach landing craft. 


Imagine being a frogman or other well trained soldiers and your pivotal too secret mission is to land on a beach and take engineering core samples for miles of beaches"
nj6zeuf,1o546ls,todayilearned,2025-W41,Sandrockwing04,Probably should be more specific a single vote from a national election that was on the ticket for vp and president
nj6ziqx,1o54yiq,todayilearned,2025-W41,dubbzy104,These settlements are in a specific spot because that’s where the aliens landed!
nj6zpnk,1o557m3,todayilearned,2025-W41,jar1967,Apalacia has the most species of trees. Suggesting that is where trees first evolved
nj6zrlc,1o4y0au,todayilearned,2025-W41,winthroprd,"""Here we are at my favorite New Jersey gabagool place.""

*Camera pans to reveal Sbarro's*"
nked2t8,1oao2zu,todayilearned,2025-W42,Zestyclose_Humor3362,"That's such a weird coincidence. I remember reading that Matt Groening named a bunch of characters after his own family - Homer was his dad, Marge and Lisa were his mom and sister. Even the street they live on, Evergreen Terrace, was the name of the street he grew up on in Portland.

The whole Simpsons naming thing is full of these little stories. Like how Bart was supposed to reveal he was an alien in the series finale that Groening planned when he thought the show would only last a few seasons. And Milhouse got his name from Richard Nixon's middle name because they thought it was the most unfortunate name for a kid to have."
nkeenar,1ob0vvo,todayilearned,2025-W42,theogmamapowpow,"Just read the lyrics for the first time. All he says is the world is a ducked up place (autocorrect 😂) over and over, inserting NIN titles throughout. WTAF? 🤣🤣🤣"
nkeevow,1ob523x,todayilearned,2025-W42,Johnny-Cash-Facts,"If grammar was a competition, you would *lose*."
nkejnor,1ob0vvo,todayilearned,2025-W42,LoudDistribution3473,Limp bizkit sucks anyway
nkekb24,1ob523x,todayilearned,2025-W42,DetectiveTrapezoid,"“Grammar” is a singular noun, so I believe that should be “was” not “were.”"
nkel6y2,1ob523x,todayilearned,2025-W42,Johnny-Cash-Facts,"In hypothetical or unreal conditional sentences, we use the subjunctive mood → “If [something] were…” rather than “was.”"
nkellg4,1ob5z03,todayilearned,2025-W42,Morgue724,"I  wondering why the person that misheard the name didn't  make the name as poooooooot, that is how I interpreted the name, just me I guess."
nkemjqt,1ob0vvo,todayilearned,2025-W42,nkaka,i always thought it was an homage!
nkemkv4,1ob0vvo,todayilearned,2025-W42,MagicOrpheus310,Lol never knew that until now so... Guess that was a fucken waste Fred haha
nlkh2ni,1ogyxfu,todayilearned,2025-W43,bergein,I want cool TIL wish reddit would be non political for one day.
nlki15u,1ogzolb,todayilearned,2025-W43,Kelseycutieee,Would the water be cold enough to preserve the bodies? I can’t imagine how harrowing it must’ve been to see your friends corpse bloated and rotting under water for almost 2 months.
nlkil5i,1ogyuzi,todayilearned,2025-W43,cumberlandbeggar,There's a great novel written about this called the Wake. It's written in a constructed shadow language.
nlkioa2,1ogzmes,todayilearned,2025-W43,Iggy_Arbuckle,Lewisssss .... Lew... isssss
nlkix3y,1ogyxfu,todayilearned,2025-W43,notwhoyouthinkmaybe,"Nearly 30% of the shutdown days in that chart were Trump's.

Goes up to 40% if you include the current one."
nlkldvp,1ogzolb,todayilearned,2025-W43,ReticulatedPasta,"There’s a great documentary about this, forget the name, Into the Abyss or something?"
nlkldxb,1ogyxfu,todayilearned,2025-W43,anillop,Say what you will about Regan he had class.
nmso4dx,1omt021,todayilearned,2025-W44,Samtyang,"1. My grandpa officiated high school wrestling for 45 years and only stopped at 79 because his knees gave out.. not his eyesight or anything, just couldn't kneel down for the mat work anymore

2. The crazy part is these older refs usually know every single rule better than the young guys. Like they've seen literally every weird situation that can happen in a game

3. I wonder if he started when he was like 20... that means he's been calling games since the early 60s. Think about all the rule changes he's had to learn over the decades

4. There's this 78 year old ump in our softball league who still sprints to first base on close calls. Puts some of the 40-somethings to shame

5. Basketball reffing at 83 sounds exhausting though. All that running up and down the court"
nmspbt9,1omx1qy,todayilearned,2025-W44,trubboy,I think this is where we went wrong. Senators should be free to shoot each other. It's what the forefathers would have wanted.
nmspk4l,1omx5so,todayilearned,2025-W44,Abhi_Jaman_92,"Yup, Zulu too. Why not."
nmsprxg,1omw3o0,todayilearned,2025-W44,TradeIcy1669,What’s a Grecian Earn?
nmspxxm,1omx1qy,todayilearned,2025-W44,Intrepid_Hat7359,Now it's just a Foote note in history
nmsqqlj,1omji23,todayilearned,2025-W44,CyanConatus,"I remember in geoguesser that Sri Lanka was super easy to guess as a country.

You just find any sign and it would have like a dozen different languages on it. And the country is small enough that if you pin the center you'll get most of the points"
nmsr4bf,1omevw5,todayilearned,2025-W44,veinss,"it's obviously ""one of the earliest modern western men"" and it's implied everyone else is irrelevant"
nmstfet,1omw3o0,todayilearned,2025-W44,CommanderGumball,It was staring me right in the face. No Menander am I.
nmsu6ji,1omwm5r,todayilearned,2025-W44,commenterzero,Apparently its from when the hulk fought wolverine in japan. Hulk landed a lot of damage and hulk shed blood has a similar signature to a nuke reactor
nmsuxtc,1omx1qy,todayilearned,2025-W44,PimpOfJoytime,All this proves is that most people used to be hammered drunk all the time.
no0tdd4,1oss4rp,todayilearned,2025-W45,akfrombotanybay,"A few years after it was done, I was visiting Maree with my dad (who was born there) and we did a sightseeing trip in a small plane. 
During the flight we saw the Maree Man, and it's very impressive from the air. The whole thing was big news at the time in Adelaide."
no0trag,1osyq4c,todayilearned,2025-W45,Quick-Ad-4422,"Not where he was, so 🤷🏿‍♂️"
no0vbz2,1osyvd5,todayilearned,2025-W45,asdasdasdasda123,Um I don’t think you can say that
no0verz,1osyvd5,todayilearned,2025-W45,Wesgizmo365,Oh wow. I've seen this on someone's neck and never wanted to ask.
no0w9h0,1osxjjm,todayilearned,2025-W45,ztreHdrahciR,Flick? Flick who?
no0x9uc,1osxjjm,todayilearned,2025-W45,MrNiceGuy1999,Sauce?
no0xdux,1osyvd5,todayilearned,2025-W45,thunda789,"Neck back and/or front
Armpits 

Elbow crease 
Behind knees 
Anywhere skin can rub on itself, skin tags are more common in pts with insulin resistance too. "
no0y2ee,1osxjjm,todayilearned,2025-W45,Training-Fold-4684,The Screech of his generation.
no0yg84,1ost4jq,todayilearned,2025-W45,IPlayRaunchyMusic,They did actually have pretty good salads. That’s unfortunate. But you can make your money go a lot further with ingredients for salads at home.
no0ywbu,1ost4jq,todayilearned,2025-W45,CharmCityCrab,"And nobody noticed. 😊


Must not have been selling very well!"
no0zgcq,1ost4jq,todayilearned,2025-W45,Big-Sun5335,Yep during the pandemic and got rid of the yogurt parfait
no0zuq2,1ost4jq,todayilearned,2025-W45,Kurovi_dev,"It was the only high quality item they had, surprisingly good. I used to get them about every week or two.

Haven’t been back since. I don’t eat hamburgers any more, but even when I did I sure as shit didn’t get them from McDonalds. I have no idea why anyone would eat there any more.

You can just go to an actual burger joint and get a burger and fries for the same price, but for dramatically higher quality."
np8hpd7,1oz17ur,todayilearned,2025-W46,shr2016,"Man, gotta feel bad for the family of Gaetan Dugas"
np8hqrr,1oyy2kp,todayilearned,2025-W46,IndifferentAI,Not if its a brown one
np8i3kt,1oyhmu4,todayilearned,2025-W46,Beneficial_Active_14,Hospital Sant Pau in Barcelona did it before they did…
np8oemh,1oypdvv,todayilearned,2025-W46,johnfogogin,"That's rich, is this the only treaty the US has actually honored?"
nqg32v8,1p514te,todayilearned,2025-W47,Wyatt821,How did I not know about this?
nqg33o2,1p41co5,todayilearned,2025-W47,umbium,"That is what having no appartment for oneself, and having no money to live does.to a worker."
nqg5lan,1p4f9t2,todayilearned,2025-W47,dent_de_lion,*my introvert ass runs screaming into the ether*
nqgcpmg,1p3yng2,todayilearned,2025-W47,Stolehtreb,God I’m old
nrmk55u,1patk1m,todayilearned,2025-W48,pponmypupu,feels like something that would happen in rimworld
nrmkg81,1pak7d5,todayilearned,2025-W48,AvailableReporter484,Living every musicians dream tbh
nrmkmkt,1pafhz1,todayilearned,2025-W48,Stairwayunicorn,and here I thought it was Sir Arthur Conan Doyle who did it first
nrmnmun,1p9qkgb,todayilearned,2025-W48,Toad32,Francis Ngannou smashed this record - hit with the force of a **Ford Escort** in a head on collision. 
nrmoeqq,1pak7d5,todayilearned,2025-W48,poppadahut,"If I had the money I'd pay her to ban it from the radio etc 
Every year after Thanksgiving I see how long I can make it before I have to hear it. This year, I didn't make it TO Thanksgiving"
nrmou0x,1pa9u33,todayilearned,2025-W48,GustavoistSoldier,She later converted to catholicism.
nrmq6y3,1pawc6i,todayilearned,2025-W48,Mysterious-Plan93,So the Westchester Militia must have had a high turnover rate...
nsuo78c,1pgtw5s,todayilearned,2025-W49,Apprehensive-Fun4181,"**The Horsehairs** we're a gang of horses that wage a war against gophers and snakes in Eastern Kansas during the early years of the Horsestead era under President Theodore TripleCrown. Known by their biting of skintoos into their hides, their motto was, *You spook, we stomp.*




Wyatt Hoof, a participant in the *Spit Out at the OK Corral*, was part of a posse that help clear a path to the Happy Valley West.  Recent evidence shows they were operating on the unstomped agreement with Gen. Gallop Custer, since the only form of any government was the military at Fort Haystack.




Gen Custer of course lost to the Antelope & Bear Confedercy at the Battle of Dustin Hoffman."
nsuriy8,1pgtw5s,todayilearned,2025-W49,comradequiche,Yes I thought it was a joke at first until I flipped through it
nsuth37,1pgyae8,todayilearned,2025-W49,Billy1121,"For context, Medicaid pays for longer nursing home stays while Medicare does not. So many seniors have to go on Medicaid in their later years to afford long term nursing home care.

Different states go about it in different ways. This article refers to Iowa which uses a third party vendor who gets 11% of all recoveries, so they recovered about $29 million in 2019. Whereas Hawaii has about half the population of Iowa and only recovered around $30,000.

Depending on the state, retirement accounts or homes may be included or excluded. Iowa is brutal because in this article they even went after back pay because the daughter of an elderly person unwittingly enrolled in a program to pay caregivers, which was (unknown to her) actually a Medicaid program.

> ""There's a discrimination against what I call 'the wrong type of disease,'"" Einhart says. Medicare could spend hundreds of thousands of dollars on hospital treatment for a person with serious heart problems or cancer, and no government representatives would try to recoup the money from the person's estate. But people with other conditions, such as dementia, often need extended nursing home care, which Medicare won't cover. Many such patients wind up on Medicaid, and their estates are billed."
nsutlf0,1pgi22r,todayilearned,2025-W49,Alienhaslanded,That's very cool. It's like Earth electroplating..
nsuvkpe,1pgtl3t,todayilearned,2025-W49,Lanto_Cadley,"Love the clarification in the comments, though surely you understand there's at least one more idiot taking a swig before he turns the ignition forward tonight because of this "
nsuxeyg,1pgry6k,todayilearned,2025-W49,brokenloop,Pretty crazy that 2400 years later I'm still referring to my refrigerator as a yakhchal.
nu2khxr,8pzfij,todayilearned,2025-W50,sansisness_101,tung tung tung sahur?!?!
nu2ktar,1pmsr61,todayilearned,2025-W50,DickweedMcGee,"Even today, in the era of eccentric billionaires I don’t know how you’d make it worth the time to take apart. "
nu2l41p,1pmsel7,todayilearned,2025-W50,xyrnil,Those are rookie numbers. You gotta pump those numbers up
nu2lz11,1pm402s,todayilearned,2025-W50,DryShopper,"Create the problem, ""fix"" the problem, be seen as the hero, repeat"
nu2mfaa,1pmb3fi,todayilearned,2025-W50,Secure-Shoulder-010,And yet Redditors will state cats are cleaner. Absolutely filthy creatures.
nu2naap,1pmsr61,todayilearned,2025-W50,Psychic_Hobo,"It makes the British (aka political opponents of their friends Russia) look bad, pretty much."
nu2ngl7,1pmt1k5,todayilearned,2025-W50,MrBoomer1951,"In North America we had horses 15,000 years ago.

Possibly hunted to extinction!"
nu2oavx,1pmsel7,todayilearned,2025-W50,SeasonNo3107,I'm glad you're here
nvaa34w,1psiey6,todayilearned,2025-W51,pogue972,"There was this woman I used to follow on IG named Hoopsie Daisy who did amazing hulu hoop tricks who said she had been to clown school in the UK. I asked her about it and Brits were telling me it's a real thing 🤷

She's very talented, go look her up. She lives off OF I think, but I much more enjoyed watching her spin 4 hoops at once & other amazing tricks."
nvabdbw,1ps9w18,todayilearned,2025-W51,zelmorrison,How do you sneeze quietly??
nvabipk,1psfk4v,todayilearned,2025-W51,nouniquenamesleft2,"""it's Prince, y'all"""
nvadboy,1psiey6,todayilearned,2025-W51,CoconutOk,Charlie Chaplin was a clown?
nvadt0r,1pskt0a,todayilearned,2025-W51,StopSquark,"My spouse wants this and they keep referring to it as ""juicing"". As in ""when I'm dead, just juice me"""
nvaepw6,1pskt0a,todayilearned,2025-W51,captmorgan50,It was a misunderstanding….
nvaeq2s,1pskt0a,todayilearned,2025-W51,fluxumbra,If you go 12 miles out people can gamble on how how fast you'll sink.
nvah7em,1ps9w18,todayilearned,2025-W51,SkyGuy182,"I’ve never vocalized a sneeze, it just comes out like TSCHFHRKFNEH"
nvaha41,1pskt0a,todayilearned,2025-W51,TadpoleOfDoom,Maybe the Navy can test the catapults on an aircraft carrier with you. 
nvahnz9,1pskt0a,todayilearned,2025-W51,ohwowimonredditcool,as mitt romney once said… corporations are people! (that is unless they make a mistake.)
nvahq69,1prtt74,todayilearned,2025-W51,PencilBoy99,My favorite part is the tiny lab coats they wear
