comment_id,post_id,subreddit,year_week,author,text
nvabmn4,1psg5cq,todayilearned,2025-W51,Lycaon-Ur,Goddess damn. I feel like I'm dying 30 seconds in. 7 minutes is outstanding.
nvabzmo,1pskt0a,todayilearned,2025-W51,futureformerteacher,Can't I just be trebucheted into the ocean at such a high speed that I become a thin pink mist?
nvac1t1,1psiey6,todayilearned,2025-W51,Smart_Resist615,Very nice. Now let's see John Wayne Gacy's egg.
nvac7xp,1psk5as,todayilearned,2025-W51,DaveOJ12,What did I just read?
nvachqt,1pskt0a,todayilearned,2025-W51,BertieTheDoggo,"The bones are still left over so can be crushed and turned into ashes, similar to cremation. They're just a lighter colour."
nvacu9j,1pskwal,todayilearned,2025-W51,olamika,Not really though
nvacxfa,1pskt0a,todayilearned,2025-W51,Streambotnt,"Instead of being turned into ash with the possibility of burial in an urn, you are instead made into toxic sewage that‘s a nightmare to process let alone store, all the while using an expensive amount of chemicals to break your body down. What a shitty idea."
nvad1fw,1pskt0a,todayilearned,2025-W51,AbjectList8,That sounds pleasant
nvad46q,1pskt0a,todayilearned,2025-W51,lluciferusllamas,Can this be done on twenty bodies at room temperature in the crawl space of a house?  Asking for a friend who is a clown.
nvads68,1ks0spe,todayilearned,2025-W51,leoyvr,Listen to CBC Podcast: The Devil You know
nvadurj,1psg5cq,todayilearned,2025-W51,Taint_Skeetersburg,"That's insanely impressive. I used to train breath holding for spearfishing / lobstering and made it to 4m30s one summer, after weeks of daily all-day free diving. I can't imagine the dedication it would take to hit 7 minutes. "
nvaed2b,1pskt0a,todayilearned,2025-W51,Cubyface,Tbh sounds like cremation but just with more steps
nvaej8s,1pskt0a,todayilearned,2025-W51,Icelander2000TM,Isn't this how cartels dispose of bodies?
nvaezgu,1psk0bx,todayilearned,2025-W51,Fetlocks_Glistening,"What ""myth""? Never even heard such nonsense"
nvaf34e,1pskt0a,todayilearned,2025-W51,jreykdal,Not toxic at all and mostly safe to process. The alkalinity might be bad for direct skin contact but it can be diluted out with water or neutralized with some acid.
nvafy5l,1pr6gfp,todayilearned,2025-W51,alvinofdiaspar,See also H. pylori as the causative agent for ulcers.
nvagcbr,1pskt0a,todayilearned,2025-W51,Sadimal,[Ask a Mortician ](https://youtu.be/SbQTACCNgcg?si=k-dmzvgNpNvxKFjh)did a video on this years ago.
nvah7fg,1pskwal,todayilearned,2025-W51,olamika,That’s the issue not a new band getting 30 people
nvahnz9,1pskt0a,todayilearned,2025-W51,ohwowimonredditcool,as mitt romney once said… corporations are people! (that is unless they make a mistake.)
