comment_id,post_id,subreddit,year_week,author,text
no0zm8w,1osyu6e,todayilearned,2025-W45,intangible-tangerine,"The most specious group is probably wasps [https://press.princeton.edu/ideas/the-wonderful-world-of-wasps?srsltid=AfmBOopRLrTAUorDdAA4pk7ipeXXG-yyt44s\_3guqaW2Gz55N2NMMytK](https://press.princeton.edu/ideas/the-wonderful-world-of-wasps?srsltid=AfmBOopRLrTAUorDdAA4pk7ipeXXG-yyt44s_3guqaW2Gz55N2NMMytK) 

150k known species but probably many, many more because of the diversity of parasatoid wasps."
no0zzi7,1os847e,todayilearned,2025-W45,davidcwilliams,With friends like these…
no100a8,1oszhu7,todayilearned,2025-W45,GetsGold,"Yeah, was before it became known as the delicious treat we all crave."
no1093b,1ost4jq,todayilearned,2025-W45,ElectricalRespect506,They should bring back fried apple pies.
no10a04,1oszhu7,todayilearned,2025-W45,Ineedacatscan,Brawndo?
no10r6k,1oszhu7,todayilearned,2025-W45,drewster23,I thought garnish was only used for food items? (when in context of 'decoration').
no113gi,1oszhu7,todayilearned,2025-W45,RChickenMan,"I was thinking the same thing! I generally scoff at most posh food trends, but I genuinely enjoyed kale."
np8e746,1oyy2kp,todayilearned,2025-W46,Fett32,"Uh, researchers? Anyone with a hydraulic press and a lego can figure this out."
np8f4lx,1oyz85k,todayilearned,2025-W46,angelcutiebaby,My birthstone
np8ff1d,1oyo0rt,todayilearned,2025-W46,Boringdude1,Also played the lead on Donna Summers’ Hot stuff.
np8hvsf,1oyq0u8,todayilearned,2025-W46,enzo32ferrari,In the released videos I actually had a hard time discerning whether or not the video is sped up or real time.
np8hzwp,9rfr0,todayilearned,2025-W46,w-e-z,I worked there often it's same day you just put overcooked patties into warming bin then off too next chili batch
np8i0rk,1oyy2kp,todayilearned,2025-W46,Blndby90,I’m not surprised. Those things are SOLID.
np8i2f3,1oz17ur,todayilearned,2025-W46,Hankman66,King Leopold owned the Congo Free State. The Belgian Congo was a separate entity that came afterwards.
np8ivso,1oypdvv,todayilearned,2025-W46,Clown_Nightmare1,Wait till the orange oranguatan hears about this.
np8j0ry,1oz17ur,todayilearned,2025-W46,sonnysehra,"The virus originated under Leopold’s rule of the Congo is what I meant to imply (_arguably_ because of colonial practices that started under his regime that facilitated the spread of the virus), but you’re still absolutely right and I appreciate the correction!"
np8j4ns,1oyy2kp,todayilearned,2025-W46,Itisd,So you are saying that even my mother in law can't break a Lego brick?
np8je35,1oyw3s2,todayilearned,2025-W46,blonderoofrat,"If I used it to stain my clothes purple, would they change color if exposed to lemon juice (for example?)  That would actually be a cool trick."
np8jhxy,1oyo4q9,todayilearned,2025-W46,CaolCholla,Shouldnt the responsibility land on the seller/storage host
np8jl32,1oyqb5h,todayilearned,2025-W46,earthmann,"Dr. Felix Liao , sleep doctor, what is his solution to apnea?"
np8ju31,1oysskh,todayilearned,2025-W46,tamsui_tosspot,So TIL [Brooklyn Nine-Nine wasn't just being random](https://youtu.be/xk0h1WcPMHI?si=k9LnXV1V4dxAEFHm).
np8kons,1oyo4q9,todayilearned,2025-W46,Abombasnow,"He didn't ""have"" to do anything. It was legally his."
np8lja2,1oz17ur,todayilearned,2025-W46,Gemmabeta,"Globalization meant that there was a lot more people moving around the world post-WWII.

The reason why AIDS popped up in the New York Haitian Communist first was because they were heavily involved in the shipping industry."
np8m6tw,1oyhmu4,todayilearned,2025-W46,westerngrit,Never heard of anyone doing it twice.
np8mrhw,1oypdvv,todayilearned,2025-W46,AusarHeruSet,There isn’t a treaty the US government hasn’t broken
np8muxc,1oz17ur,todayilearned,2025-W46,joobtastic,Such a good episode.
np8nz14,1oz2bxw,todayilearned,2025-W46,Icy_Block_2262,"Great concept, worth looking into."
np8o0ys,1oz2hde,todayilearned,2025-W46,LitmusPitmus,lmfao
np8ol2z,1oz2hde,todayilearned,2025-W46,RugbyKats,Public Universal Friend is Gay Jesus.
np8pd4n,1oyo4q9,todayilearned,2025-W46,THEREALCABEZAGRANDE,"""Their"" money? They sold it, its all his money, fuck the storage place."
np8pd9y,1oz17ur,todayilearned,2025-W46,poorexcuses,"Yeah, early on they were probably strains that didn't catch as easily as the one that eventually went pandemic. Like how SARS and MERS were contained but COVID couldn't be"
np8pmel,1oz2hde,todayilearned,2025-W46,Emergency_Mine_4455,"The Friend, as far as I’m aware, explained themself as a totally separate entity/soul than Jemima Wilkinson, their birth identity. From what I understand, using feminine pronouns for Jemima would not be incorrect."
nqg33o2,1p41co5,todayilearned,2025-W47,umbium,"That is what having no appartment for oneself, and having no money to live does.to a worker."
nqg358s,1p50m22,todayilearned,2025-W47,draft_final_final,This is probably the most outrageous and horrifying thing an Austrian has ever done.
nqg3e04,1p50m22,todayilearned,2025-W47,uresmane,Hopefully there was some sort of payout
nqg42hs,1p41co5,todayilearned,2025-W47,Intrepid-Love3829,Well. Having third spaces would be helpful to meet new people
nqg4chs,1p41co5,todayilearned,2025-W47,TrueInDueTime,"I (32M) tried so hard in 2025 to get a girlfriend. Singles mixers, speed dating events, dating apps, trying to ask friends if they had any single friends, doing a bunch of different social events to meet people, talking about being single on social media (and sometimes having vids that blew up, like 20K - 200K views). 

Nothing worked out. I went on one date this year. Early January. With a woman who had DMed me on TikTok. That ended up not working out. 

So now I'm just chilling. I have a great life without the romance. There are so many things that are going well in my life. At this point I don't care if I meet someone or not. Because I have learned to be happy while being single. 

It's also peace of mind knowing that I have tried harder than most people to find someone to date, and since it still hasn't worked out, I won't have regrets."
nqg4syq,1p4wtni,todayilearned,2025-W47,Sir-DrProfessor,"Greek here. My grandparents apartment complex in the heart of Thessaloniki was used as one of the main Nazi Hubs/HQ building. Luckily for my great grandparents (white Orthodox Greeks) managed to hang onto it after the occupation ended. But I've heard some horror stories about how their Jewish neighbors were not so lucky. 

Fuck Nazis, never forget."
nqg687d,1p4l1lt,todayilearned,2025-W47,henryhollaway,A flying squirrel raptor?
nqg6t7g,1p41co5,todayilearned,2025-W47,TrueInDueTime,"I feel like, back in college (for me 2011-2015), there were these two metaphorical roads that people were starting to travel on. 

One road was for the people who were getting into relationships, hooking up, having sex, and learning how to initiate a sexual relationship.

The other road was for the people who were not going to parties, not interested in dating, or were going to parties but not able to develop conversations with people they were sexually interested in. I was on this road. 

And the two roads diverged, and now, at 32, it's EXTREMELY difficult for me to somehow hack my way through the woods to get to the other road."
nqg70va,1p514te,todayilearned,2025-W47,DynamiteWitLaserBeam,[Marcus Wayne Chenault](https://aaregistry.org/story/marcus-w-chenault-jr-murderer-born/)
nqg730r,1p3kxn4,todayilearned,2025-W47,Calcularius,The first compression?
nqg92j8,1p3u1s8,todayilearned,2025-W47,DreadPirateGriswold,"In this film, she was about 36 and he was about 20.

Well, maybe Sharon had her own version of Leo's dating age rule?  Certainly wasn't Leo's 25 year old or younger rule."
nqg93q6,1p50m22,todayilearned,2025-W47,Griffon-Knight,Makes you wonder just what they were thinking when they let the 13 year old drill into the skull when it happened.
nqg9727,1p50m22,todayilearned,2025-W47,WheeljacksLabCoat,Person that lodged the complaint was just jealous that they didn’t get to drill the hole.
nqg9t4p,74hkn8,todayilearned,2025-W47,pboy8699,"The writers insisted that Regis say ""bonkos"", which was a stupid decision and most people who saw that episode not only didn't like the fake word, but didn't find it funny in the least, proving Philbin's point that it was a bad decision."
nqga0kh,1p52vfv,todayilearned,2025-W47,headtoesteethnose,I heard the brain did that too
nqga8ha,1p505rj,todayilearned,2025-W47,Puzzleheaded-Mail896,And now we think it’s quite rare for stars not to have planets
nqgaxob,1p52vfv,todayilearned,2025-W47,Mm2k,"I heard it was Yes in French, and Yes in Swedish."
nqgbmcf,1p52vfv,todayilearned,2025-W47,bendable_girder,I heard it was a transliteration of Wicca lol
nqgc0t7,1p41co5,todayilearned,2025-W47,TrueInDueTime,"Dating apps for me are difficult because I'm honest and put ""doesn't want kids"" on my profiles"
nqgc4ya,1p505rj,todayilearned,2025-W47,Frostsorrow,The real kicker is that the asteroid hitting the planet and wiping out the dinosaurs theory is less then a 50 years old.
nqgcaet,1p505rj,todayilearned,2025-W47,Longjumping-Debt7480,I’m sure they just block those facts out of their mind.
nqgccum,1p50m22,todayilearned,2025-W47,justmoderateenough,Well she’s applying for medical school and needs something juicy for her application!
nqgci1v,1p505rj,todayilearned,2025-W47,DogPlane3425,Now they need to determine if there is any intelligent life on the 3rd planet from SOL! Doubting it.
nqgci7k,1p50m22,todayilearned,2025-W47,Cosbybow,Some people dont realize how unprofessional the real professionals are
nqgcsou,1p505rj,todayilearned,2025-W47,CommunicationEast972,And we wonder why we can’t “see aliens” while exoplanets are barely a smudge and we don’t even have one single actual clear picture of a star outside our solar system. Our imaging is so far behind what would be needed to see anything. We are blind 
nrmjjqt,1pawc6i,todayilearned,2025-W48,Deitaphobia,I feel the same way now.
nrmjwf0,1pafhz1,todayilearned,2025-W48,HaileSelassieII,"Fingerprints were used to identify criminals in British India in the mid 1800's though, so it was already a thing by the time he wrote about it. At least I'm pretty sure"
nrmlrus,1patk1m,todayilearned,2025-W48,langsamlourd,I don't appreciate my future obituary written before I die
nrmmc2q,1pa8ipn,todayilearned,2025-W48,ReferenceMediocre369,I have always respected automobile brands named after female anatomy.
nrmmgxw,1patk1m,todayilearned,2025-W48,TheMuffler42069,So they are a danger to others…
nrmnsp6,1pakty6,todayilearned,2025-W48,TheMuffler42069,International what ?
nrmocv2,14gqtc,todayilearned,2025-W48,9to5Voyager,That's hot
nrmog9n,1p8zwf5,todayilearned,2025-W48,Deep_Difficulty4903,What's the worst?
nrmon7z,1p916fj,todayilearned,2025-W48,GreekKnight3,"I sadly think this puts an asterisk next to all prior winners, if the voting hadn't been so flawed this whole time."
nrmp7l0,1paif57,todayilearned,2025-W48,kluthage421,His fault he has a dumb ass name
nrmpdtg,1paowct,todayilearned,2025-W48,Leicester68,And the zonkey/zeedonk: zebra-donkey hybrid
nrmpwg5,1pak7d5,todayilearned,2025-W48,Responsible_Page1108,i am so glad that this song doesn't come up on the christmas pandora station.
nrmq0nk,3wso0u,todayilearned,2025-W48,Open_Construction350,"I think to achieve success and greatness and become extraordinary, you have to have a borderline mental belief in yourself. That same belief can create issues with gambling. Its a blessing and a curse. If you feel like you can beat the odds of life, you feel like you can beat the odds of chance."
nrmqw3q,1pak7d5,todayilearned,2025-W48,cloudyah,"Royalties from streaming services, royalties from the licensing for media usage, and royalties from the licensing contracts with commercial music services like Muzak."
nrmrfbx,1pakty6,todayilearned,2025-W48,Isaacvithurston,Wasn't he a Golden Retriever. Adorable breed but I wouldn't go out of my way to make more of them. They have something like 50% chance of getting cancer sadly.
nrms4lp,1pak7d5,todayilearned,2025-W48,MusicianBudget3960,Yes this gets repeated *evey fucking year*
nrms53p,1palwhp,todayilearned,2025-W48,samx3i,"Is that what they were referencing in the Jordan Peele movie, ""Nope""?"
nrmtnml,1patk1m,todayilearned,2025-W48,Top-Competition9263,"I didn’t read the story, but the title was “An ‘overly obese’ body set a crematorium on fire – again”

It’s the again part that got to me."
nrmtt6p,1paynw7,todayilearned,2025-W48,WardenWolf,"Sorta kinda. They finally shut down their last dialup lines a few months ago. They are finally no longer an ISP, just a content provider."
nrmtyae,1patk1m,todayilearned,2025-W48,MetaphoricalDicks,"i feel qualified to say this (i work next to a crematorium), but allegedly the heavier the person in the cremator) the more it will likely smell like BBQ pork."
nrmuak7,1paynw7,todayilearned,2025-W48,Paraxom,"so a 31 year old randomly names a 33 year old he's never met as his sole heir? like bruh you're worth a billion unless he's sterile, gay and celibate i don't see why that couldn't change within a year"
nrmucw5,1paynw7,todayilearned,2025-W48,BlackWaltz47,Brazilianaire was right there and whiffed on it.
nrmuv0j,1pawc6i,todayilearned,2025-W48,Devins478,One of the founding fathers son try to apologize but do who but didn’t want to hear it from them
nrmuy4d,1pak7d5,todayilearned,2025-W48,Toshiba1point0,"Come in here dear boy have a cigar, youre gonna go far....

.and if we tell you the name of the game boy, we call it riding the gravy train"
nrmv33b,1patk1m,todayilearned,2025-W48,paralleled_existence,Wtf?
nsunout,1pgtl3t,todayilearned,2025-W49,Dizzy_Veterinarian12,This headline is gonna do a lot of harm when stupid people don’t read the article to find out it’s a statistical effect and it does not in fact make it safer to drive slightly drunk compared to being sober
nsunv2m,1pgry6k,todayilearned,2025-W49,tacomaloki,"Loosely related, if anyone is looking for something fun to watch, check out Thermae Romae on Netflix. It's light hearted and fun!"
nsunve2,1pglu5k,todayilearned,2025-W49,Gargomon251,I thought he was the lead singer. My life is a lie.
nsuo4c2,1pgvh39,todayilearned,2025-W49,baldwil,His name was White because of slavery
nsuoc4a,1pglu5k,todayilearned,2025-W49,thatgenxguy78666,"Been listening to an Ozzy audio book,and ""early ""Sabbath would hang around clubs in case the top act didnt show up,and they would offer to play. That happened when Jethro was a no show."
nsuoofc,1pgt5zn,todayilearned,2025-W49,thebawsofyou,"It's worth noting, the object in question is a pool cue."
nsupxle,1pgt5zn,todayilearned,2025-W49,drcygnus,https://youtu.be/3rCTpwLdYQA?si=HvyxSDnOgYAQb0y2
nsuqkkr,1pglu5k,todayilearned,2025-W49,Starwho,Never heard of them
nsuqwpf,1pgtl3t,todayilearned,2025-W49,alonjit,"Ah, I see, ""drunk enough to enjoy driving, but sober enough to know what you're doing"" method."
nsurbu0,1pgs6p0,todayilearned,2025-W49,ManicMakerStudios,"If you sleep 8 hours/day and are awake for 16, that 112 hours/week that you have every single week to live your life.  Some of that time will be taken up by daily necessities, like hygiene, preparing and eating meals, cleaning/laundry etc.

If you set aside 40 hours out of that week for work, that's 72 hours left for everything else.  That means nearly 2/3 of your waking life is ""you time"".

When you put it that way, it seems kind of decadent, doesn't it?"
nsurglm,1pgtw5s,todayilearned,2025-W49,comradequiche,Haha no but I have given that book to many people for Christmas and birthdays 😆
nsus856,1pgdvo9,todayilearned,2025-W49,BobKain,Me trying to say Arrakis after coming out of the dentist.
nsus9j1,1pglu5k,todayilearned,2025-W49,Bugout42,"Honestly, their lyrics are so strange that having a strange band name is acceptable."
nsut4uf,1pgtl3t,todayilearned,2025-W49,Bulbform87,"Anecdotal example here but I love playing billiards. I'm a decent player but I notice that when I'm about 2 or 3 beers in my skills go into overdrive and I play so much better. It's like I get into a zone. Any more alcohol than that and it all goes to hell, I'm done for the night, but maybe this is something similar."
nsuth37,1pgyae8,todayilearned,2025-W49,Billy1121,"For context, Medicaid pays for longer nursing home stays while Medicare does not. So many seniors have to go on Medicaid in their later years to afford long term nursing home care.

Different states go about it in different ways. This article refers to Iowa which uses a third party vendor who gets 11% of all recoveries, so they recovered about $29 million in 2019. Whereas Hawaii has about half the population of Iowa and only recovered around $30,000.

Depending on the state, retirement accounts or homes may be included or excluded. Iowa is brutal because in this article they even went after back pay because the daughter of an elderly person unwittingly enrolled in a program to pay caregivers, which was (unknown to her) actually a Medicaid program.

> ""There's a discrimination against what I call 'the wrong type of disease,'"" Einhart says. Medicare could spend hundreds of thousands of dollars on hospital treatment for a person with serious heart problems or cancer, and no government representatives would try to recoup the money from the person's estate. But people with other conditions, such as dementia, often need extended nursing home care, which Medicare won't cover. Many such patients wind up on Medicaid, and their estates are billed."
nsuupvh,1pgtl3t,todayilearned,2025-W49,CivilRadio1582,"As someone from Grand Rapids, I don't know if I should be proud of this"
nsuvsyd,1pg4n1c,todayilearned,2025-W49,Clawdius_Talonious,There needs to be a video game where you play as Ea-Nasir and you can't make ends meet so you adulterate your products more and more... That could be great fun.
nsuw08y,1pgtl3t,todayilearned,2025-W49,Odd_Comment4104,"More cautious with a beer or two than completely sober, wow easy to understand lol"
nsux40s,1pgjo8e,todayilearned,2025-W49,Doodah18,[A little Moxy Früvous song to lighten the mood.](https://youtu.be/OF3JfiexLVA?si=uS_7RRPOMz9CANbg)
nsuxb6j,1pgtl3t,todayilearned,2025-W49,gnatdump6,I think if you know you had a drink you are more careful to avoid doing anything to be pulled over and therefore lower risk for an accident.
nsuxdj5,1pgtl3t,todayilearned,2025-W49,4s54o73,"Probably a person that had one drink is driving more careful and alert, because they are conscience of having had a drink - radio off, no phone."
nsuxjkn,1pfyy3h,todayilearned,2025-W49,Total-Hack,Practicing? Well did he at least get good at it?
nsuxny6,1pgtw5s,todayilearned,2025-W49,Rococoss,Mammals in general are a neurotic bunch. Even the big ones seem to have that genetic memory of when we were rodent-sized. See: our fear of snakes and creepy crawlies
nsuyjjy,1pgtw5s,todayilearned,2025-W49,Gelnika1987,... What the *fuck?*
nsv00dc,1pgtl3t,todayilearned,2025-W49,LivesDoNotMatter,"how do they gather such data?

I'm wondering if there's a bias in there somewhere."
nu2jhdg,1pmswlh,todayilearned,2025-W50,grungegoth,Still does
nu2k4qc,1pmsr61,todayilearned,2025-W50,ThatDandySpace,Damn...it's so trashed that even British think twice looting it
nu2k4vw,1pmsel7,todayilearned,2025-W50,JeskaiJester,"Don’t OD on deliriants. Also don’t regular on deliriants. Also don’t microdose them. Even consistent usage of normal doses of diphenhydramine for allergies/sleep is associated with big increases in dementia risk. There are studies you can look up, it’s real. But don’t worry, you’re going to forget I told you that and keep doing it anyway "
nu2l69f,1pmsel7,todayilearned,2025-W50,02meepmeep,I am become Autism.  Muddler of Minds.
nu2l7zf,1pl7o4j,todayilearned,2025-W50,Educational_Road2461,no way. i was born there 😭😭
nu2lajy,1pmsel7,todayilearned,2025-W50,cerebral_sequoia,And then she got autism x 1000
nu2lzf1,1pmsel7,todayilearned,2025-W50,pyrocidal,"ugh that'd be so gross


just shoveling handfuls into your mouth"
nu2mts1,1pmswlh,todayilearned,2025-W50,Mlakeside,"Considering elks live natively in Eurasia, in addition to North America and ""moose"" being a loanword Native American Algonquin language, it would be weird if we didn't have a word for the animal until post-Columbian times.


The reason why moose replaced elk in English is simply because Britain doesn't have them, so when English settlers first saw an elk in America, they didn't have (or rather, didn't know they had) a word for the animal. This is also likely the reason they named the wapiti ""elk"", despite it not looking like one: they might have known an elk was a type of large deer, so they just used the term they had."
nu2mvnz,1pmsel7,todayilearned,2025-W50,Proskater789,"I'm happy you are still here! Sharing with the world your own unique ray of sun. Even if sometimes you don't see it shining above the clouds, it's still there."
nu2n1hy,1pmqceo,todayilearned,2025-W50,OceanMan40k,This is gonna make for so many good insults now that I know this
nu2naap,1pmsr61,todayilearned,2025-W50,Psychic_Hobo,"It makes the British (aka political opponents of their friends Russia) look bad, pretty much."
nu2oavx,1pmsel7,todayilearned,2025-W50,SeasonNo3107,I'm glad you're here
nu2odwv,1pmsel7,todayilearned,2025-W50,gbinasia,I assumed the better way is to blend them into a smoothie or something.
nu2or5v,1plpx6z,todayilearned,2025-W50,talann,"For quite a long time, showgirls(1995) reigned as the top grossing NC-17 film."
nu2oybl,1pmsr61,todayilearned,2025-W50,Archivist2016,"Bit late but just look at the piss poor quality of the wiki section in Laxmichand's wiki 💀:


>The Taj Mahal was auctioned twice by the British in 1831, the condition of these auctions being that the person who buys the beautiful stones of the Taj Mahal would have to be handed over to the British government. During that time, Rao Laxmi Chand, who went for shooting in Mathura district with his forces , made the highest bid and bought the Taj Mahal, that is why the Taj Mahal is still standing proudly in its country, otherwise Taj Mahal was about to be demolished.


This the type of shit you read on YouTube comments"
nu2peqs,1pmsel7,todayilearned,2025-W50,mr_diggory,"Back in my Robitussin phase I would take the gel capsules and that involved eating 60-80 of them at once, then usually throwing them all back up about 90 minutes later... It wasn't cute lol I definitely still feel nauseous taking any medicine in that form. I was a pharmacy tech briefly and the Vitamin D capsules looked identical and just the sight of them made me sick 😅"
nu2pgf5,1pmsr61,todayilearned,2025-W50,geniice,Yeah I feel if the brits even considered taking apart the  Taj Mahal bit of it would be in the british museum or V&A.
nu2pirq,1pmsel7,todayilearned,2025-W50,COMOJoeSchmo,"Important note:  most people do not survive taking a bottle of Tylenol or ibuprofen.  It's typically a slow, lingering, painful death by liver failure."
nu2pnsz,1ployeh,todayilearned,2025-W50,Goliathvv,"I grew up with a Mega Drive (Sega Genesis), and a friend had a Master System.

The genesis controller worked on the master system, so I would just bring my controller to my friend's place and we would play together there. Good times."
nu2px3f,1pmsr61,todayilearned,2025-W50,DrJuanZoidberg,Visiting places on your miserable rainy island is not comparable to visiting someplace half a world away in the 1800s for shits and giggles
nu2pyq6,1pmswlh,todayilearned,2025-W50,weeddealerrenamon,">when English settlers first saw an elk in America

I think you mean when they first saw a moose?"
nu2qnxx,1pmsel7,todayilearned,2025-W50,SongStuckInMyHeadd,omg I meant brain damage
nu2r2r7,1pmsel7,todayilearned,2025-W50,LaughingCoyoteCalf,"Thank you!! We are all trying to survive out here, but finding the little enjoyments and dappled sunlight along the way has been incredibly uplifting. Wishing all a peaceful and happy life."
nu2r6e1,1pmjtbg,todayilearned,2025-W50,HeavenlyChickenWings,">Between 1961 and 1965, landmine explosions resulted in the deaths of at least 10 people, including as the result of engineering accidents and late-night partygoers

Party ended with a bang"
nu2rk1o,1pmsel7,todayilearned,2025-W50,KlatuuBarradaNicto,"I often wonder about opioid addicts that take opioid pills containing acetaminophen. When they take more pills than they should in their addiction, do they get liver failure? You don’t hear much about it but I would think that would happen a lot."
nvaa34w,1psiey6,todayilearned,2025-W51,pogue972,"There was this woman I used to follow on IG named Hoopsie Daisy who did amazing hulu hoop tricks who said she had been to clown school in the UK. I asked her about it and Brits were telling me it's a real thing 🤷

She's very talented, go look her up. She lives off OF I think, but I much more enjoyed watching her spin 4 hoops at once & other amazing tricks."
nvaal11,1pskt0a,todayilearned,2025-W51,Mattk1100,New instant pot recipe
nvab48k,1ps554l,todayilearned,2025-W51,GuitarGeezer,"Loved that commercial a few years ago with the people screaming about flying two headed bears attacking them. Glad to see it has some basis in reality. Sorta. Cannot remember the product at all. 

Might be a good time to point out humans woulda still killed them off at an insane kill/death ratio. Never, ever, believe it if they try the hype that humans are not potentially far worse than any other creature out there. Merry Christmas, mother fu$&ers!"
nvab4v8,1pskwal,todayilearned,2025-W51,Own_Detail4392,Any injuries in the club? That’s a lot of people.
nvab6b3,1psfk4v,todayilearned,2025-W51,ScrewAttackThis,"Yeah, I imagine demands of someone like Prince over a gig he's not being paid for are more like pretty pleases. "
nvabbcq,1ps9w18,todayilearned,2025-W51,PhraseFirst8044,i have a habit of accidentally vocalizing my sneezes as a very loud FUCK. yes my father was a sailor
