comment_id,post_id,subreddit,year_week,author,text
nhzg9ik,1nywi6y,todayilearned,2025-W40,HawkHarder,the worst part is people think that is normal. I don't see how they eat so much food. No wonder everyone is broke.
nhzgcj9,1nz4438,todayilearned,2025-W40,Public-Policy24,opportunity for the most reciprocalest thing ever
nhzgqvz,1nywi6y,todayilearned,2025-W40,ShookSamurai_,"How do you even get that heavy?

No I’m being serious, I’m 5’11”, 135 pounds and I can’t gain weight to save my LIFE"
nhzgrys,1nz4438,todayilearned,2025-W40,Bitter-Cable-181,"Hijack a plane or get over it, I stopped caring when I was 9 in 2007 "
nhzgu5o,1nz03a9,todayilearned,2025-W40,CrowSky007,"Surprised no one has mentioned Ed Dwight. Not an astronaut but the first black man selected for training to join the astronaut program.

[https://en.wikipedia.org/wiki/Ed\_Dwight](https://en.wikipedia.org/wiki/Ed_Dwight)"
nhzgw1j,1nz4438,todayilearned,2025-W40,dirty_cuban,Karma is a bitch
nhzhago,1nz4438,todayilearned,2025-W40,EshinX,Maybe they can hire Pete Davidson for the ribbon cutting
nhzhce5,1nywi6y,todayilearned,2025-W40,Hard-Rock68,"My dad is over 200 pounds. His bench press is 370lbs and his squat is 450lbs.
He brings that average up. You gonna tell him he's obese? Unhealthy?"
nhzhf50,1nywi6y,todayilearned,2025-W40,CarlJustCarl,Avg height and BMI?  Weight means nothing without one of those other two.
nhzhi1v,1nywi6y,todayilearned,2025-W40,CarlJustCarl,Source?
nhzhm0g,1nywi6y,todayilearned,2025-W40,Chortney,Crazy that at my heaviest I wasn't even at the US average lol. Now I'm ~140-150 so I stick out in Alabama
nhzhqki,1nywi6y,todayilearned,2025-W40,JackSquat18,Garbage food is cheaper than healthier options that’s why you see a lot of obese people that are poor. You don’t feel as full with the garbage food so you eat more of it.
nhzhtz2,1ny3a0i,todayilearned,2025-W40,52Charles,"Hammett also created another character called 'The Continental Op,' an operative of the Continental Detective Agency, which was a stand-in for the Pinkerton Agency, for whom Hammett had worked previously. The Continental Op (whose name is never given) is sometimes referred to as being short and fat."
nhzi22p,1nywi6y,todayilearned,2025-W40,nomamesgueyz,Wow that's a lot of obese people
nhzidol,1nywi6y,todayilearned,2025-W40,flyover_liberal,Woo!  I'm above average!
nhziry2,1nywi6y,todayilearned,2025-W40,VanillaThnder,I wish
nhzjp9d,1nz03a9,todayilearned,2025-W40,Lahbeef69,ill get downvoted to oblivion for this and as fucked up as it is that’s a pretty funny joke
nhzjx4q,1nywi6y,todayilearned,2025-W40,FlatRooster4561,"You might have broad shoulders and be able to carry weight easily. I have a friend who is the same height as me, but he’s got a huge frame and can easily carry thirty more pounds than me but still be in shape. BMI is a bunch of nonsense. I’m 5’8” 165 with visible abs and I’m just shy of being considered overweight via BMI"
nhzjzeb,1nywi6y,todayilearned,2025-W40,YachtswithPyramids,Tiny ppl
nhzjzkt,1nywi6y,todayilearned,2025-W40,elephant35e,"I'm 5'11 - 6'0, about 164 pounds, and 27. It's nice being 30+ pounds lower than average."
nhzk0vm,1nywi6y,todayilearned,2025-W40,RepresentativeIcy922,what's the median though
nhzk6lo,1nywi6y,todayilearned,2025-W40,DamagedLiver,"I get your messages but that's not super strong for 200lbs+, age is also a factor and props to your dad for keeping in shape. Just weird flex and almost no one works out like your dad does. The point is that most americans are a bit overweight. It doesn't mean all of em."
nhzl7ur,1nyue1w,todayilearned,2025-W40,sadcheeseballs,"I always like to remind people that a huge percentage of the great pacific garbage patch is fishing waste— for instance, large nets. The solution involves better reduction of waste getting into waterways (mostly in a handful of nations) but also reformed sea fishing rules and accountability."
nhzljtd,1nywi6y,todayilearned,2025-W40,jabobo2121,That’s disgusting
nhzlla7,1nywi6y,todayilearned,2025-W40,acrobat2126,"I'm 240 and 6' tall. I need to be stopped and am actively working on my weight. My fat ass usually eats a whole pizza, yesterday I had 1 slice. 

If any other fat bastard reads this, we can do it. Let's try being small for a while."
nj6v0vp,1o54a5i,todayilearned,2025-W41,greatgildersleeve,I hope the kitty was okay.
nj6vvi3,1o546ls,todayilearned,2025-W41,sucksLess,we done fucked up with Al Gore
nj6wwdf,1o546ls,todayilearned,2025-W41,StrictlyForTheBirds,I thought Republicans didn't like drag queens...
nj6wwlm,1o53jwb,todayilearned,2025-W41,Blutarg,"Wow, I thought only half our oxygen came from oceans."
nj6x0rd,1o4u1pk,todayilearned,2025-W41,Beneficial-Focus3702,That should be considered something like assault if you were warned and did it anyway.
nj6x4uw,1o4u1pk,todayilearned,2025-W41,Garchompisbestboi,"Needs of the many outweigh the needs of the few, if your kid can't go out in public without nearly dying then that's on you to make sure that their medical needs are met."
nj6xbyh,1o546ls,todayilearned,2025-W41,BLF402,He’s the deep state president literally fighting the greatest enemy known in existence.
nj6xhzx,1o4u1pk,todayilearned,2025-W41,Akemi_Tachibana,"Two years? Unless that person flies frequently, that isn't a punishment. A life time ban would be appropriate. "
nj6xikb,1o53evy,todayilearned,2025-W41,Trixie1143,Are you young to be on reddit?
nj6xpp0,1o54a5i,todayilearned,2025-W41,spaceporter,Interesting gambit.
nj6xuut,1o4y0au,todayilearned,2025-W41,Optimus_Krime555666,"""reportedly""


AKA pure, grade-A bullshit"
nj6y5sb,1o53s0f,todayilearned,2025-W41,GoldMonk44,"“Are you attempting to steal (a ball 🎾) fro your superior officer? No take, only throw”"
nj6y6lq,1o4u1pk,todayilearned,2025-W41,Lensmaster75,They will jail someone for an internet post over there but this attempted homicide is just two year break from the plane WTF
nj6y81g,1o4xsfj,todayilearned,2025-W41,-UserOfNames,4% of the time it works every time
nj6y9jg,1o4u1pk,todayilearned,2025-W41,clownandmuppet,"With peanut allergies being relatively well known, why do airlines continue to serve peanuts?"
nj6yhqt,1o54a5i,todayilearned,2025-W41,Diarmundy,En passant gambit - Declined
nj6yhs5,1o4zy6e,todayilearned,2025-W41,girldrinkdrunk,"I bought this when it first came out, subsequently played the ever loving shit out of it for many years, only realized what the cover was about fifteen years ago."
nj6ysvf,1o557m3,todayilearned,2025-W41,GBeastETH,Gives new meaning to Old Man River.
nj6z24f,1o557m3,todayilearned,2025-W41,tidymaze,"The Appalachian mountains are older than fossils. Seriously, there are no fossils in those rocks. They also share the same composition as the Scottish highlands."
nj6z38i,1o546ls,todayilearned,2025-W41,Flurb4,He became VP through a vote of Congress.
nj6z41e,1o4u1pk,todayilearned,2025-W41,nojob4acowboy,"Yeah, but maybe……."
nj6zfab,1o54yiq,todayilearned,2025-W41,janspamn,It always gets to me that even the oldest civilizations probably sprouted where people had already been living and thriving for 1000's of years.
nj6ziqx,1o54yiq,todayilearned,2025-W41,dubbzy104,These settlements are in a specific spot because that’s where the aliens landed!
nj6zl2k,1o4u1pk,todayilearned,2025-W41,theblobbbb,"Why isn’t that child traveling with a gas mask on or something? Half the people on planes have earphones on or are just generally ignoring announcements.

More at fault would be the server who gave the nuts surely. And the parent who didn’t have them in a mask."
nj6zm7x,1o546ls,todayilearned,2025-W41,Big_Wave9732,"Yea, being VP historically hasn't been the express lane to the presidency that people think it is.  I'm many instances by the time it's the VP's turn to run, people are sick of the incumbent's policies and don't want more of the same. "
nkedina,1oaww74,todayilearned,2025-W42,Djwshady44,Sounds like the title to a James Bond film.
nkedtla,1ob23u3,todayilearned,2025-W42,GarysCrispLettuce,"If you force a horse to dive, I don't care if you don't thrive."
nkee8xe,1ob0vvo,todayilearned,2025-W42,Low_Wall_7828,"I hate you Trent, here’s a bunch of money."
nkeevow,1ob523x,todayilearned,2025-W42,Johnny-Cash-Facts,"If grammar was a competition, you would *lose*."
nkeg58t,1ob523x,todayilearned,2025-W42,CallingTomServo,Our Attorney General got busted for a DUI not too long after IIRC
nkeg8my,1ob0vvo,todayilearned,2025-W42,XennialBoomBoom,"Reznor's kind of a butt.  So is Durst.  Not to condescend, but has anyone ever dated a ""musician"" before?

Reznor, Durst, and many others were annoying butts before they made artistic impact.

Think of the thousands of mentally unwell music hopefuls and their underappreciated partners.  Is there, like, some sort of N.A. but the problem isn't drugs, it's a *fucking guitar*?"
nkegx8r,1ob523x,todayilearned,2025-W42,MonkMajor5224,My roommate when I was in college in Wisconsin got a DUI going to Burger King at 1 am. It was 8 blocks.
nkehhak,1ob523x,todayilearned,2025-W42,manondorf,"Wisconsinite here, it's shockingly prevalent and normalized. Of the 50 drunkest counties in the country, [41 are in Wisconsin](https://vinepair.com/booze-news/map-drunkest-and-driest-counties-america/). We top the leaderboards for [specific cities](https://www.datapandas.org/ranking/drunkest-cities-in-america), too.

The map in that first link shows a stark contrast between us and neighboring states that get as little sunlight and as much snow as we do, so I can't blame it all on that. It's like people take pride in how regularly and how much they drink."
nkehqz3,1ob523x,todayilearned,2025-W42,JonJackjon,I would be curious if one blew 3 or 4 times what variation in the level might be.
nkei801,1ob0vvo,todayilearned,2025-W42,bigdaddypoppin,Imagine writing a diss track about one of the GOATs of rock
nkeid66,1ob08ba,todayilearned,2025-W42,Sweaty_Goat_3920,Ace Fraleys is the best of the four
nkeiove,1ob523x,todayilearned,2025-W42,Canklosaurus,"I’ve been in the Navy for close to twenty years and have only personally known one person who was processed out for alcohol-abuse disorder.

He was from Wisconsin, and drank more than anyone I’ve ever met. He invited me over to his house once after work and cleared 28 beers out of a 30 rack (I had the other two). It was a Tuesday."
nkeiumd,1ob3l6o,todayilearned,2025-W42,hiraeth_stars,Well that's just disgusting 🤢
nkejnor,1ob0vvo,todayilearned,2025-W42,LoudDistribution3473,Limp bizkit sucks anyway
nkejski,1ob523x,todayilearned,2025-W42,jdeeth,Wisconsin was 0.15% till I think the 60s
nkekd1j,1oazzl9,todayilearned,2025-W42,piscesman,Featured within [this video.](https://youtu.be/HL0RH3x7Zzo)
nkekuji,1oac428,todayilearned,2025-W42,Masterpiece-Haunting,Do they have a bayonet that gets used by chance?
nkelhqr,1ob5z03,todayilearned,2025-W42,Elevator-Ancient,https://youtu.be/1rnEjPbSqOE?si=jAKDxHV_bK9GHKx8
nkelkpw,1ob523x,todayilearned,2025-W42,TrulyNotABot,Subjective mood
nkelxmv,1ob523x,todayilearned,2025-W42,lblack_dogl,"I don't agree. What you just described is a grammar issue. OP misspelled ""lose"" as ""loose"". It was a spelling problem. Surely, OP did not say the word loose out loud or internally. He meant lose and spelled it wrong. You cannot misspell ""have"" as ""of"". In that case, you are using the wrong word entirely, so it's a grammar problem."
nkem2l5,u86bt6,todayilearned,2025-W42,OpenUpShop786,"The Late, Great George Carlin explained to us why ppl like Geller gain even more fame despite being proven a hack...

""Think of how stupid the average person is, and realize half of them are stupider than that."""
nkemc85,1oa9vpu,todayilearned,2025-W42,Miyuki22,Hmmm... That's rather sexist of them.
nkemg9q,1oa9okm,todayilearned,2025-W42,AppleDane,"Well, he was a Dane."
nkemjqt,1ob0vvo,todayilearned,2025-W42,nkaka,i always thought it was an homage!
nkemkv4,1ob0vvo,todayilearned,2025-W42,MagicOrpheus310,Lol never knew that until now so... Guess that was a fucken waste Fred haha
nlkgko6,1ogjx1k,todayilearned,2025-W43,sadboyinparis,"honestly the stabbing seems like the worse option here - drowning's supposed to be peaceful after the initial panic, right? but I guess being trapped underwater changes the math"
nlkgx3n,1ogjx1k,todayilearned,2025-W43,fakiresky,I read some of the entries on this page. Most of are just sad instances of horrible coincidences but Instant karma for JRN.
nlkgxfi,1ogyxfu,todayilearned,2025-W43,CaptainBayouBilly,"The republican party is anti-american. And anti-humanity.

It is pro death, pro slavery, and pro hate."
nlkh3pt,1ogyxfu,todayilearned,2025-W43,mymar101,This might be the last we ever have. They probably don’t intend on ever opening again
nlkh9f3,1ogmprb,todayilearned,2025-W43,TheEponymousBot,One of them went on to found r/lifeprotips and the other r/lifehacks.
nlkhmg2,1ogzolb,todayilearned,2025-W43,kernraftingdotcom,"Generally speaking, where in CA?"
nlkhrp0,1ofs94s,todayilearned,2025-W43,Seaguard5,"Gee, I wonder why?

*STAGNANT WAGES COUGH COUGH

Work takes too much of our time now. Nobody has time for much else any more"
nlki97a,1ogzolb,todayilearned,2025-W43,tous_die_yuyan,I was expecting this title to end a lot worse than it did.
nlkicha,1ogzmes,todayilearned,2025-W43,material_mailbox,Robert DeNiro was perfect in Jackie Brown
nlkil5i,1ogyuzi,todayilearned,2025-W43,cumberlandbeggar,There's a great novel written about this called the Wake. It's written in a constructed shadow language.
nlkir7z,1ogzb7x,todayilearned,2025-W43,BigGrayBeast,"I swear I saw a made for TV movie prior to the series where the island was hell and he was the devil. I cannot find it on IMDB. 

I remember it began with people on a windowless airliner. One guy was commenting to his wife that another passenger was a famous F1 driver he'd heard on the radio had died in an accident, but guessed that had been an error."
nlkj7bn,1ogzmes,todayilearned,2025-W43,Joulmaster,The Stallone casting would have been fire
nlkjbd0,1og8wmd,todayilearned,2025-W43,SteveCastGames,It’s great now but anyone denying it was a clusterfuck on release is off their meds. I played on PS4 and at one point they put out a patch that made it so that if you opened the settings menu you couldn’t close it. You’d have to reset the whole game. That’s when I refunded.
nlkjbod,1ogjx1k,todayilearned,2025-W43,Interesting-Copy-657,The thumb nail though?
nlkjch0,1oh0fvx,todayilearned,2025-W43,MemoirsOfSharkeisha,Reminds me of someone
nlkjhpa,1ogyutp,todayilearned,2025-W43,gearstars,I'm glad the surgery to get the hole in his hand fixed worked out
nlkjs90,1ogyxfu,todayilearned,2025-W43,Summitjunky,"1976: Under President Gerald Ford. Lasted for 11 days.
1977: Under President Jimmy Carter. Lasted 12 days.
1977: Under Carter. Lasted eight days.
1977: Under Carter. Lasted eight days.
1978: Under Carter. Lasted 17 days.
1979: Under Carter. Lasted 11 days.
1981: Under President Ronald Reagan. Lasted two days.
1982: Under Reagan. Lasted one day.
1982: Under Reagan. Lasted three days.
1983: Under Reagan. Lasted three days.
1984: Under Reagan. Lasted two days.
1984: Under Reagan. Lasted one day.
1986: Under Reagan. Lasted one day.
1987: Under Reagan. Lasted one day.
1990: Under George H.W. Bush. Lasted four days.
1995: Under President Bill Clinton. Lasted five days.
1996: Under Clinton. Lasted 21 days.
2013: Under President Barack Obama. Lasted 17 days.
2018: Under President Donald Trump. Lasted three days.
2018: Under Trump. Lasted several hours.
2019: Under Trump. Lasted 35 days and cost the economy about $3 billion, equal to 0.02% of GDP, according to the Congressional Budget Office.
2025: Under Trump. Started on Oct. 1, 2025."
nlkjxme,1oh0fvx,todayilearned,2025-W43,DarkAlman,The original neck beard
nlkk1h8,1ogyutp,todayilearned,2025-W43,Fit-Let8175,"According to that logic, shouldn't all A&W staff, especially suits: CEO, management, etc., be fired if they eat anywhere else, too?"
nlkk3p7,1oh0fvx,todayilearned,2025-W43,DTPVH,"Ya know, I was going to correct you and say that it was called the “Golden Palace”, but no, the Latin does literally translate to “Golden House”, which is boring."
nlkk5jp,1ogyuzi,todayilearned,2025-W43,Certain-Candle607,"Look up his funeral, he was so obese and his corpse was so bloated that it literally exploded when they stood on his coffin trying to close it."
nlkl15z,1oh0fvx,todayilearned,2025-W43,Sinan_reis,yeah nero was also unfairly maligned by critics as they tried to lie about his actions for political profit.
nlkl5qg,1ogyxfu,todayilearned,2025-W43,0neAy0pen,Yeah but Reagan actually had integrity and cared for the American people. Donnie hates Americans and he hates himself. It’s like comparing an apple to an aggressive tumor.
nlkldvp,1ogzolb,todayilearned,2025-W43,ReticulatedPasta,"There’s a great documentary about this, forget the name, Into the Abyss or something?"
nlkldxb,1ogyxfu,todayilearned,2025-W43,anillop,Say what you will about Regan he had class.
nmsny67,1omt29i,todayilearned,2025-W44,Nobody275,"Republicans are always saying dumb shit like “the government can’t do anything” and “government can’t be efficient.”

The problem is, that’s not what the record shows, and lots of governments around the world do very good jobs of a lot of things. 

Republicans are just paid by oligarchs to ensure that the government is so small and ineffective that for all intents and purposes, there is no accountability for the rich.  That’s their endgame.  And you…..well, after they slash all the hard-won regulations that keep corporations from giving you cancer, killing you in unsafe workplaces, and polluting everything that you depend on………well, you’re screwed and have no recourse."
nmsnzz7,1omps8w,todayilearned,2025-W44,T-Bills,Kind of wild for a race car prototype not to have a fire extinguisher on board
nmso1ab,1omt29i,todayilearned,2025-W44,somewhatfaded,"So remember every day you use weapons of war, and call it work."
nmso4dx,1omt021,todayilearned,2025-W44,Samtyang,"1. My grandpa officiated high school wrestling for 45 years and only stopped at 79 because his knees gave out.. not his eyesight or anything, just couldn't kneel down for the mat work anymore

2. The crazy part is these older refs usually know every single rule better than the young guys. Like they've seen literally every weird situation that can happen in a game

3. I wonder if he started when he was like 20... that means he's been calling games since the early 60s. Think about all the rule changes he's had to learn over the decades

4. There's this 78 year old ump in our softball league who still sprints to first base on close calls. Puts some of the 40-somethings to shame

5. Basketball reffing at 83 sounds exhausting though. All that running up and down the court"
nmsoh6f,1omevw5,todayilearned,2025-W44,Markgulfcoast,One of the earliest? How on gods green earth would one determine that this is the case?
nmspbt9,1omx1qy,todayilearned,2025-W44,trubboy,I think this is where we went wrong. Senators should be free to shoot each other. It's what the forefathers would have wanted.
nmspdqq,1omx1qy,todayilearned,2025-W44,Darwin_Always_Wins,Not a bad idea arming congress and the senate letting them slug it out….survival of the fittest and all…
nmspk4l,1omx5so,todayilearned,2025-W44,Abhi_Jaman_92,"Yup, Zulu too. Why not."
nmspl0o,1omt29i,todayilearned,2025-W44,Domsdad666,I thought Al Gore invented the internet.
nmspv4a,1omw3o0,todayilearned,2025-W44,apeocalypyic,Bro probably'd write a mean sopranos episode
nmspzjp,1om2339,todayilearned,2025-W44,MermaidOfScandinavia,I remember hearing about this in Denmark 15 years ago or so.
nmsr3gp,1omw3o0,todayilearned,2025-W44,buster_rhino,A guy told me once he was working on a bit about an Ancient Greek comedian named Hilaricles.
nmssdow,1omtdyd,todayilearned,2025-W44,TheSpatulaOfLove,We like dystopian shit…
nmssoz3,1omw3o0,todayilearned,2025-W44,mzchen,Why is this entire thread just corny ancient Greece themed standup? Is there some joke or reference I'm not seeing here?
nmst8at,1omx1qy,todayilearned,2025-W44,TwoDrinkDave,"Hell Benton making that joke, weren't you?"
nmsu2mm,1omtdyd,todayilearned,2025-W44,IllustriousFile6404,Smoking DMT did that to me 
nmsu7ky,1omtdyd,todayilearned,2025-W44,Puzzleheaded-Flow724,"> are questions that have puzzled neuroscientists for centuries.

Centuries? Neuroscience has started in 1964..."
nmsuif4,1omb3mw,todayilearned,2025-W44,NewEnglandRoastBeef,"My favorite Dan Aykroyd thing was some UFO documentary he did where he just sits in a chair, in front of a table lamp and proceeds to rip Marlboros while talking about aliens. It's both entertaining, enlightening and emphysema."
nmsurrk,1omx1qy,todayilearned,2025-W44,SessileRaptor,Also “The Caning: The Assault that drove America to civil war” by Stephen Puleo is a great book on the same subject with a narrower focus on the singular incident of the beating of Senator Charles Sumner.
nmsuu5b,1omtdyd,todayilearned,2025-W44,cawfytawk,"Our bodies exist from/through electrical impulses. It controls the brain and our muscles. Scientifically, It makes sense that there's still activity once we die. Metaphysically, I think the brain ""wraps it up"" just before you die to give you closure and as a distraction from the pain. Spiritually, I think the soul leaves the body endures in a different form. Energy can't be created nor destroyed; it can only be transformed."
nmsvg4b,1omtdyd,todayilearned,2025-W44,BrotherChe,There's a great 70s scifi movie with Christopher Walken called Brainstorm that actually depicts tecnology that captures this
nmsvjdv,1omx1qy,todayilearned,2025-W44,KindAwareness3073,"Yes, but that caning was merely the most egregious incident in a smoldering battle that was waged for 30 years before bursting into flame.  Not the cause, just a symptom."
nmsvlrr,1omtdyd,todayilearned,2025-W44,FraggleBiologist,"Does this not terrify anyone else? How long is our brain picking up enough information from the outside world for us to process? Do we even process them? It would be easy to check for full brain death before rolling patients to a morgue, but those bodies at murder scenes, are they still processing anything?

We don't know if they are good memories. We don't really know what it is, it's just a lot nicer to believe you remember all those wonderful moments before our brain shuts down."
nmsvoc4,1omtdyd,todayilearned,2025-W44,DevProjector,What's the evolutionary advantage for such a feature to develop?
nmswdoy,1omw3o0,todayilearned,2025-W44,sexyapple0,"Even time couldn’t cancel him, just delayed the tour by a couple millennia."
no0t755,1oss4rp,todayilearned,2025-W45,Crazy-Gate-948,"I remember reading that there were actually coordinates left at the site pointing to some obscure book about Aboriginal hunting techniques. The whole thing feels like an elaborate art project that got way out of hand.

What gets me is the sheer scale - you'd need serious equipment and planning to pull this off without anyone noticing. Plus the GPS precision in 1998 wasn't exactly consumer grade stuff.

The fact that it's still visible after all these years is wild too. Most land art disappears pretty quickly but the outback conditions must be perfect for preservation. I wonder if whoever made it checks satellite images sometimes just to see their work still there."
no0tdd4,1oss4rp,todayilearned,2025-W45,akfrombotanybay,"A few years after it was done, I was visiting Maree with my dad (who was born there) and we did a sightseeing trip in a small plane. 
During the flight we saw the Maree Man, and it's very impressive from the air. The whole thing was big news at the time in Adelaide."
no0tdvb,1osuz6i,todayilearned,2025-W45,Correct-Active-2876,Did they want it though?
no0thzr,1osyq4c,todayilearned,2025-W45,AskMeHowToBangMILFs,"A lot of people are mistakenly under the impression that the age of consent is 18. He had sex with a 17 year old girl, which is legal in most of the World."
no0tm5h,1osxyc1,todayilearned,2025-W45,Worldly-Time-3201,The same god that told them to genocide six or seven civilizations would NEVER let this slide. Proof there’s no god. Checkmate.
no0tsrj,1osyu6e,todayilearned,2025-W45,the_almighty_walrus,"Just wait until you find out about wasps (100,000), beetles (350,000) and nematodes (probably over a million)."
no0ugx7,1osxyc1,todayilearned,2025-W45,MrScotchyScotch,"lol so many comments about the religion. i think it's interesting that they added the feature. apparently many manufacturers have. i wonder if it was because there's a growing observant population, or if *not* having the feature meant customers went to the brands that did, so everybody had to adopt it?"
no0us9e,1osuz6i,todayilearned,2025-W45,yankeefan0312,Two pieces of shit. Awesome
no0v3kr,1osuz6i,todayilearned,2025-W45,RideWithMeSNV,They aren't sending their best...
no0vnjw,1osyvd5,todayilearned,2025-W45,Noobphobia,Also known as chub rub
no0vuse,1osuz6i,todayilearned,2025-W45,Mathemodel,Tracks for America
no0wngv,1ost4jq,todayilearned,2025-W45,MelodiesOfLife6,"weren't the salads just as bad (if not worse) then most of their other menu items? (in terms of being 'healthy')

  
They still were great but ... yeah...."
no0x0ym,1orcm0z,todayilearned,2025-W45,Hot-Engineering-9743,Yeah. Corpsification.
no0xqfw,1oszhu7,todayilearned,2025-W45,TheSchlaf,"Garnishes for the buffet, probably."
no0y2ee,1osxjjm,todayilearned,2025-W45,Training-Fold-4684,The Screech of his generation.
no0y3fm,1oszhu7,todayilearned,2025-W45,Draxtonsmitz,Kind of. Their buffets were kept cool by tubs of ice and they used the kale to hide the ice.
no0y3gy,1oszhu7,todayilearned,2025-W45,AHailofDrams,It was actually used as decoration for their salad bars
no0y8e2,1oszhu7,todayilearned,2025-W45,mmss,"100% this. It was an extremely cheap and edible decoration, and not widely known as a food."
